bug_id,bug_report_analysis,suspicious_files,fixed_files
2061,"The bug report indicates that the method `JsonReader.hasNext()` erroneously returns true when it should be indicating the end of a document, which corresponds to the `JsonToken.END_DOCUMENT`. This suggests that there may be a logical flaw in the code that determines the state of the `hasNext()` method with respect to the `peek()` method, which is responsible for observing the current token without consuming it. The keywords to focus on include 'JsonReader', 'hasNext', and 'END_DOCUMENT'. It is notable that `JsonReader.hasNext()` relies on the outcome of `peek()`, indicating a possible point of failure in the logic that checks for document termination.","{""ranked_list"": [{""file"": ""gson/src/main/java/com/google/gson/stream/JsonReader.java"", ""justification"": ""The `hasNext()` implementation checks two conditions to determine if there are more elements: it checks `PEEKED_END_OBJECT` and `PEEKED_END_ARRAY`, but may fail to check for `PEEKED_EOF`, which indicates the end of the document. This closely aligns with the bug where `hasNext()` incorrectly indicates true at `END_DOCUMENT`.""}, {""file"": ""gson/src/main/java/com/google/gson/JsonStreamParser.java"", ""justification"": ""This file implements `hasNext()` which synchronizes on the parser's state and checks if the current token is not `JsonToken.END_DOCUMENT`. Its logic is critical in determining if the parser erroneously indicates that more elements are available when they actually are not.""}, {""file"": ""gson/src/main/java/com/google/gson/internal/bind/JsonTreeReader.java"", ""justification"": ""This implementation of `hasNext()` checks the current token from the stack. It could indirectly relate to the implementation of `hasNext()` in `JsonReader` and may exhibit similar behaviors or assumptions.""}, {""file"": ""gson/src/main/java/com/google/gson/internal/LinkedTreeMap.java"", ""justification"": ""While this file has a `hasNext()` method, it appears unrelated to JSON reading or parsing but is included for completeness. No direct correlation to the bug was found, but it can be checked if needed.""}]}","gson/src/main/java/com/google/gson/internal/bind/JsonTreeReader.java,gson/src/main/java/com/google/gson/stream/JsonReader.java"
2214,"The bug report indicates an issue with the handling of the `@Until` annotation in the `Gson` library's `Excluder`. The report states that the Excluder rejects fields if the version exceeds or is equal to the version specified by `@Until`, which deviates from the expected behavior of ignoring fields only if the version exceeds this value. Relevant keywords include 'Excluder', 'version', and '@Until'. The primary affected components are the `Excluder`, which manages exclusion logic for fields based on versioning, and possibly the `GsonBuilder`, which configures these behaviors. The bug's context heavily relates to methods that check versions and field exclusions.","{""ranked_list"": [{""file"": ""gson/src/main/java/com/google/gson/internal/Excluder.java"", ""justification"": ""The primary file involved in the reported bug. It contains the `excludeField` and `isValidVersion` methods which likely include the logic leading to the bug described in the report. Specifically, `excludeField` handles exclusion based on the version from the `@Until` annotation, making it directly relevant.""}, {""file"": ""gson/src/test/java/com/google/gson/VersionExclusionStrategyTest.java"", ""justification"": ""This test file directly tests the behavior of the `Excluder` for different version scenarios. The methods `testClassAndFieldAreAtSameVersion`, `testClassAndFieldAreBehindInVersion`, and `testClassAndFieldAreAheadInVersion` validate the exclusion behavior, which aligns perfectly with the bug context.""}, {""file"": ""gson/src/main/java/com/google/gson/GsonBuilder.java"", ""justification"": ""Contains the `setVersion` method that affects how the version is set for the `Excluder`. This indirectly relates to the bug since it controls the version context for exclusions.""}, {""file"": ""gson/src/main/java/com/google/gson/ExclusionStrategy.java"", ""justification"": ""Defines exclusion strategies for fields and classes. While it is not directly implicated in the bug, it is related to how fields may be excluded based on strategies that involve versioning.""}]}","gson/src/main/java/com/google/gson/GsonBuilder.java,gson/src/main/java/com/google/gson/annotations/Since.java,gson/src/main/java/com/google/gson/annotations/Until.java,gson/src/main/java/com/google/gson/internal/Excluder.java"
2364,"The bug report suggests that the `equals()` method does not handle `BigDecimal` comparisons correctly, illustrating this with tests that involve `JsonPrimitive` objects that represent `double` values versus `BigDecimal` values. The `JsonPrimitive` class appears to be the core component that potentially requires modification to support these comparisons properly. Based on the provided test methods, significant aspects include comparisons across types, particularly with `BigDecimal`, which are directly relevant to the issue. Given these insights, the focus should be on the methods responsible for equality checking and their interactions with `BigDecimal`.","{""ranked_list"": [{""file"": ""gson/src/main/java/com/google/gson/JsonPrimitive.java"", ""justification"": ""The equals() method in this class is crucial as it handles the equality check of JsonPrimitive instances. Currently, it does not include a case for BigDecimal, which is the core of the bug report.""}, {""file"": ""gson/src/test/java/com/google/gson/JsonPrimitiveTest.java"", ""justification"": ""Contains unit tests that are directly related to JsonPrimitive's equals method, including tests for comparing doubles and BigDecimal instances. Understanding these tests can provide insights into what modifications are needed.""}, {""file"": ""gson/src/main/java/com/google/gson/Gson.java"", ""justification"": ""The fromJson() method here indicates how JSON parsing occurs, potentially affecting how JsonPrimitive objects are created and compared. Changes in comparison logic may affect serialization/deserialization.""}, {""file"": ""gson/src/main/java/com/google/gson/internal/LazilyParsedNumber.java"", ""justification"": ""This class represents lazily parsed numbers and has its own equals method. Understanding its comparison logic is important for ensuring that number equivalency is correctly handled.""}, {""file"": ""gson/src/main/java/com/google/gson/internal/bind/JsonTreeWriter.java"", ""justification"": ""The value() method in this class deals with how numbers are written in JSON structure. Additional logic may be needed to ensure proper handling of BigDecimal.""}, {""file"": ""gson/src/main/java/com/google/gson/JsonArray.java"", ""justification"": ""This class incorporates methods that deal with arrays of JsonElements, including how individual elements are compared. Given that BigDecimals can exist within these, it\u2019s relevant.""}, {""file"": ""gson/src/main/java/com/google/gson/JsonElement.java"", ""justification"": ""As a base class, changes in comparison logic here can affect all subclasses, including behavior for JsonPrimitive, making it relevant to modifications proposed.""}, {""file"": ""gson/src/main/java/com/google/gson/JsonObject.java"", ""justification"": ""Similar to JsonArray, JsonObject is important for handling structured data. Any method that interacts with JsonPrimitive comparison affects overall behavior.""}, {""file"": ""gson/src/test/java/com/google/gson/functional/PrimitiveTest.java"", ""justification"": ""May contain additional tests for primitive types that could reveal more about how different types compare, enhancing understanding of the equals functionality.""}, {""file"": ""gson/src/main/java/com/google/gson/internal/NonNullElementWrapperList.java"", ""justification"": ""This class might also play a part in how elements wrap around and manage null/non-null types. This could reveal additional behavior impacting JsonPrimitive equality checks.""}]}",gson/src/main/java/com/google/gson/JsonPrimitive.java
2071,"The bug report indicates an issue with deserializing `EnumMap` using Gson, resulting in a `ClassCastException`. The key components of the bug report suggest that there is a mismatch between the expected type during deserialization and the actual structure of the JSON being deserialized. Keywords extracted from the report include: `EnumMap`, `ClassCastException`, `Gson`, and `deserialization`. The related test case provided simulates the deserialization of an `EnumMap` and compares the expected output with the actual output, thus directing attention towards classes and methods in the Gson codebase that manage serialization and deserialization mechanics, especially for enum types and maps.","{""ranked_list"": [{""file"": ""gson/src/main/java/com/google/gson/internal/bind/MapTypeAdapterFactory.java"", ""justification"": ""One of the crucial methods in this file (`read(JsonReader in)`) handles the deserialization of maps, including scenarios relevant to `EnumMap`. This is likely where the class cast issue is stemming from, particularly in how keys and values are processed and added into the map.""}, {""file"": ""gson/src/main/java/com/google/gson/Gson.java"", ""justification"": ""The `fromJson(String json, Type typeOfT)` method called during deserialization is pivotal. If the deserialization of a map fails here, it helps pinpoint the root cause of the `ClassCastException` when handling `EnumMap`.""}, {""file"": ""gson/src/test/java/com/google/gson/functional/MapTest.java"", ""justification"": ""Contains tests relevant to map serialization/deserialization. The `testMapDeserialization()` method may provide insights into how Gson handles deserialization, necessary for troubleshooting the `EnumMap` issue.""}, {""file"": ""gson/src/test/java/com/google/gson/functional/MapAsArrayTypeAdapterTest.java"", ""justification"": ""This test verifies complex map serialization and deserialization scenarios that could inform the behavior observed in the bug report, especially in edge cases where type adapter registration is key.""}, {""file"": ""gson/src/test/java/com/google/gson/functional/EnumTest.java"", ""justification"": ""Includes methods such as `testTopLevelEnumDeserialization()` which directly refer to enum types in Gson. This can help validate how enums are converted to and from JSON, shedding light on potential issues with `EnumMap`.""}, {""file"": ""gson/src/test/java/com/google/gson/functional/EnumWithObfuscatedTest.java"", ""justification"": ""Tests deserialization involving enum types in potentially obfuscated formats. This may uncover special handling cases that affect general deserialization behavior for enums.""}, {""file"": ""gson/src/test/java/com/google/gson/functional/CustomTypeAdaptersTest.java"", ""justification"": ""The `testCustomDeserializers()` method explores custom deserialization, which could relate to how enums or maps are handled, particularly when user-defined rules complicate default behaviors.""}, {""file"": ""gson/src/test/java/com/google/gson/GsonTest.java"", ""justification"": ""Contains various tests for the core functionalities of Gson, including deserialization logic. Any failures here may hint at broader issues affecting multiple types of deserialization, including `EnumMap`.""}, {""file"": ""gson/src/test/java/com/google/gson/JavaSerializationTest.java"", ""justification"": ""May contain integration tests that cover serialization and deserialization processes in Java, providing a broader context of data type handling in Gson that could also affect enum mappings.""}]}",gson/src/main/java/com/google/gson/internal/ConstructorConstructor.java
2153,"The bug report specifies that `Gson.getAdapter((TypeToken) null)` causes an exception due to a failure in handling null values correctly after a disputed commit. The critical part of the report mentions that the handling of the `type` argument in the `getAdapter` method had changed, which can lead to a `NullPointerException`. The solution proposed suggests removing null handling for the `getAdapter(TypeToken)` method rather than fixing it, indicating that analyzing the `Gson` class is essential. The keywords to focus on include `getAdapter`, `TypeToken`, `null`, and `NullPointerException`.","{""ranked_list"": [{""file"": ""gson/src/main/java/com/google/gson/Gson.java"", ""justification"": ""The primary file involved in the bug report, it contains both the `getAdapter(TypeToken<T> type)` and `getAdapter(Class<T> type)` methods, which are central to the issue. The method body for `getAdapter(TypeToken)` shows it uses `type` and handles null cases, which directly relates to the reported bug.""}, {""file"": ""gson/src/main/java/com/google/gson/TypeAdapter.java"", ""justification"": ""Although this file doesn't have direct mentions in the bug report, it is generally useful for understanding how type adapters are created and used, which is relevant when examining the overall functioning of `Gson`'s serialization behavior.""}, {""file"": ""gson/src/main/java/com/google/gson/GsonBuilder.java"", ""justification"": ""This file is relevant since it constructs `Gson` instances and may provide insight into how customization can affect serialization behavior, particularly concerning how type adapters are registered.""}, {""file"": ""gson/src/test/java/com/google/gson/TypeAdapterTest.java"", ""justification"": ""This file likely contains unit tests related to `TypeAdapter`, making it relevant for validating the behavior of type handling in `Gson`, including edge cases for null handling.""}, {""file"": ""gson/src/test/java/com/google/gson/GsonTypeAdapterTest.java"", ""justification"": ""Contains tests specific to `Gson`, which may include tests for null cases or various type combinations used with type adapters.""}, {""file"": ""gson/src/main/java/com/google/gson/internal/bind/TypeAdapters.java"", ""justification"": ""It may contain implementations or utility methods related to type adapters, which could provide further insights or affect how null cases are managed.""}, {""file"": ""gson/src/main/java/com/google/gson/JsonNull.java"", ""justification"": ""Relevant because it represents a JSON null value, which could be involved in handling null parameters within the Gson framework.""}, {""file"": ""gson/src/main/java/com/google/gson/reflect/TypeToken.java"", ""justification"": ""Involved in the type handling framework in Gson. Since `getAdapter` interacts with `TypeToken`, understanding this file helps clarify type argument handling.""}, {""file"": ""gson/src/test/java/com/google/gson/functional/NullObjectAndFieldTest.java"", ""justification"": ""This test file likely contains tests that cover scenarios involving null objects or fields, making it relevant for understanding how the Gson library deals with null cases.""}, {""file"": ""gson/src/test/java/com/google/gson/functional/DefaultTypeAdaptersTest.java"", ""justification"": ""Possibly contains tests focused on the default type adapters provided by Gson, including how null values are treated or expected behavior when faced with `null`.""}]}",gson/src/main/java/com/google/gson/Gson.java
2130,"The bug report describes an issue with the `JsonWriter` when working with float values. Specifically, it mentions calling `writer.value(x)` with a float value `x`, which results in an incorrect representation of the float due to the method `value(double value)` being called instead of a specialized float handler. The report indicates a desire to address this by adding new handling for float values. Keywords such as ""JsonWriter"", ""float"", and ""value"" are crucial for locating affected files. The provided code implies that methods dealing with JSON writing and numeric types (floating-point specifically) are central to the bug's investigation.","{""ranked_list"": [{""file"": ""gson/src/main/java/com/google/gson/stream/JsonWriter.java"", ""justification"": ""Contains the method `value(double value)` which is directly referenced in the bug report. This method handles the conversion of a double to JSON, potentially leading to precision issues when used with floats.""}, {""file"": ""gson/src/main/java/com/google/gson/Gson.java"", ""justification"": ""Contains methods that deal with JSON writing, particularly `write(JsonWriter out, Number value)`, which is responsible for serializing number types, including float. This is relevant given the bug's focus on float handling.""}, {""file"": ""gson/src/main/java/com/google/gson/internal/bind/NumberTypeAdapter.java"", ""justification"": ""This class defines how to serialize numbers in the JSON structure, including the method `write(JsonWriter out, Number value)`, which can indirectly lead to issues when floats are serialized through the `JsonWriter`.""}, {""file"": ""gson/src/main/java/com/google/gson/stream/JsonReader.java"", ""justification"": ""Contains methods like `nextDouble()` that retrieve double values from JSON. If float values are processed improperly, they may lead to calling this method and affect float behavior.""}, {""file"": ""gson/src/main/java/com/google/gson/internal/bind/DefaultDateTypeAdapter.java"", ""justification"": ""While primarily focused on date types, it shows the structure of writing values to JSON via `JsonWriter`, important for the context of adding float handling.""}, {""file"": ""gson/src/main/java/com/google/gson/JsonElement.java"", ""justification"": ""Provides foundational classes for JSON elements which could interact with serialization mechanisms, indirectly related to how floats and associated types are handled.""}, {""file"": ""gson/src/main/java/com/google/gson/internal/bind/TypeAdapters.java"", ""justification"": ""Although not directly explored, it might contain predefined type adapters that could include handling for float types.""}, {""file"": ""gson/src/test/java/com/google/gson/stream/JsonWriterTest.java"", ""justification"": ""Contains tests for the `JsonWriter` functionality. It's crucial for understanding how the `JsonWriter` behaves with various data types, including floats.""}, {""file"": ""gson/src/test/java/com/google/gson/GsonTest.java"", ""justification"": ""Tests related to `Gson` interactions with various data types, including floating-point numbers. These tests could reveal if the bug affects existing serialization.""}, {""file"": ""gson/src/test/java/com/google/gson/functional/PrimitiveTest.java"", ""justification"": ""Tests serialization of primitive types, including floats which align with the bug's focus on identifying float handling errors.""}]}",gson/src/main/java/com/google/gson/stream/JsonWriter.java
2376,"The bug report addresses a problem with the handling of generic type information in Gson, specifically when using `TypeToken`. The error arises from missing type information that leads to failures during cast operations, resulting in a `ClassCastException`. The keywords extracted from the report include ""missing type information"", ""TypeTokens"", ""ClassCastException"", and ""flag as early as possible"". The report suggests adding validation checks for type variables to prevent unexpected behavior. This indicates that the affected components are likely related to generic type handling and serialization/deserialization processes within the Gson library.","{""ranked_list"": [{""file"": ""gson/src/main/java/com/google/gson/reflect/TypeToken.java"", ""justification"": ""Central to the issue described, `TypeToken` is responsible for managing type information and is directly related to the missing type information when deserializing. The method `getType()` may need additional checks to handle generic types properly.""}, {""file"": ""gson/src/main/java/com/google/gson/Gson.java"", ""justification"": ""Contains the `fromJson` methods which directly interact with `TypeToken`. It is crucial for understanding how type information is utilized during JSON deserialization, integral to reproducing and fixing the class cast issue.""}, {""file"": ""gson/src/test/java/com/google/gson/reflect/TypeTokenTest.java"", ""justification"": ""This file includes various tests concerning `TypeToken`, specifically testing for type assignments and invalid scenarios which may expose the issue mentioned in the bug report. The method `testParameterizedFactory_Invalid` validates cases where parameterization is incorrect, thus related to the bug.""}, {""file"": ""gson/src/main/java/com/google/gson/internal/$Gson$Types.java"", ""justification"": ""This file contains methods for handling types and generics extensively, such as `getCollectionElementType`. Any issues regarding type resolution when using collections will intersect with the problems reported in the bug.""}, {""file"": ""gson/src/main/java/com/google/gson/internal/bind/TypeAdapterRuntimeTypeWrapper.java"", ""justification"": ""Handles runtime type adaptation which is essential when working with generic types. Problems during type adaptation or failure to correctly select the right adapter can link back to the issues raised.""}, {""file"": ""gson/src/main/java/com/google/gson/TypeAdapter.java"", ""justification"": ""The `TypeAdapter` is responsible for the serialization and deserialization processes. Any failure to handle types correctly here may lead to the casting exception described in the report.""}, {""file"": ""gson/src/test/java/com/google/gson/functional/ReusedTypeVariablesFullyResolveTest.java"", ""justification"": ""Tests using generics and their resolution, which connects to the need for validating correct types at runtime. The interaction of type variables is critical to fixing the bug.""}, {""file"": ""gson/src/main/java/com/google/gson/internal/bind/TypeAdapters.java"", ""justification"": ""While not directly mentioned, methods here may rely on type validation during deserialization, hence any implications of the bug could manifest in this class.""}, {""file"": ""gson/src/main/java/com/google/gson/internal/ConstructorConstructor.java"", ""justification"": ""Handles type construction, which is impacted by generic types and may also contribute to serialization issues when type information is missing.""}]}","gson/src/main/java/com/google/gson/reflect/TypeToken.java,shrinker-test/src/main/java/com/example/ClassWithJsonAdapterAnnotation.java"
2134,"The bug report highlights an issue with the `ISO8061Utils.parse()` method, specifically that it allows non-existent dates to be parsed into valid `Date` objects without throwing an expected exception, such as `IllegalArgumentException`. Key keywords extracted from the report are: ""parse"", ""ISO8601Utils"", ""non-existent dates"", and ""exception"". The expected behavior is that the method should throw an exception when faced with invalid date strings like '2022-14-30' and '2022-12-33'. This indicates that the parsing logic might have a flaw in its validation, particularly in enforcing strict rules when constructing `Date` objects from string inputs.","{""ranked_list"": [{""file"": ""gson/src/main/java/com/google/gson/internal/bind/util/ISO8601Utils.java"", ""justification"": ""This file contains the `parse(String date, ParsePosition pos)` method which is directly mentioned in the bug report. The method's body logically constructs a `Date` object while checking various components of the date string. Its leniency in setting calendar fields based on input verification fails to validate the date correctly, leading to the issues raised in the report.""}, {""file"": ""extras/src/main/java/com/google/gson/typeadapters/UtcDateTypeAdapter.java"", ""justification"": ""This file also defines a `parse(String date, ParsePosition pos)` method. Although its role is auxiliary, it operates on date parsing and has overlapping logic with `ISO8601Utils` which warrants its consideration for further investigation.""}, {""file"": ""gson/src/main/java/com/google/gson/JsonParser.java"", ""justification"": ""This file includes various `parse` method signatures. While its primary focus is on JSON parsing, understanding how it interacts with date handling components may uncover related issues or related parsing strategies.""}, {""file"": ""metrics/src/main/java/com/google/gson/metrics/ParseBenchmark.java"", ""justification"": ""Despite not being directly related to date parsing, it's included because it carries a method named `parse(char[] data, Document document)` which might show how data is sanitized or parsed before reaching the date methods. Its analysis might reveal additional nuances in data handling.""}, {""file"": ""gson/src/main/java/com/google/gson/internal/Streams.java"", ""justification"": ""This file includes a `parse(JsonReader reader)` method which deals with reading JSON data. Given that JSON data can include various date strings, it\u2019s relevant to ensure that date fields are processed correctly, ensuring parsing consistency.""}, {""file"": ""metrics/src/main/java/com/google/gson/metrics/ParseBenchmark.java"", ""justification"": ""Though not directly related to the bug report, the benchmarks and document parsing methods may provide insight on performance implications of parsing which could relate to how lenient parsing impacts larger operations.""}]}",gson/src/main/java/com/google/gson/internal/bind/util/ISO8601Utils.java
