bug_id,bug_report_analysis,suspicious_files,fixed_files
122,"The bug report highlights issues with logging in the implementations of unsafe variants of `HostnameVerifier` and `TrustManager` which may cause excessive logging, specifically indicating the acceptance of self-signed certificates. Key phrases to focus on include 'disable logging', 'spam logs', 'self-signed certificate', and references to the `HostnameVerifier` and `TrustManager` classes. This implies that the bug is related to SSL context handling and certificate verification.","{""ranked_list"": [{""file"": ""sslcontext-kickstart/src/main/java/nl/altindag/ssl/hostnameverifier/UnsafeHostNameVerifier.java"", ""justification"": ""The `UnsafeHostNameVerifier` class includes a `verify` method that logs warnings when accepting hostnames without actual verification. This matches the bug's concern about excessive logging in unsafe verifiers.""}, {""file"": ""sslcontext-kickstart/src/main/java/nl/altindag/ssl/trustmanager/UnsafeX509ExtendedTrustManager.java"", ""justification"": ""This class features a `logCertificate` method that logs warnings whenever a certificate is accepted, which is directly related to the bug report about unwanted logging and self-signed certificates.""}, {""file"": ""sslcontext-kickstart/src/main/java/nl/altindag/ssl/trustmanager/CompositeX509ExtendedTrustManager.java"", ""justification"": ""Contains a `logCertificate` method that logs certificate details, but only at debug level. Relevant as it may impact existing logging behavior described in the bug report.""}, {""file"": ""sslcontext-kickstart/src/main/java/nl/altindag/ssl/trustmanager/TrustManagerFactorySpiWrapper.java"", ""justification"": ""This class initializes a trust manager wrapper. Its logging behavior during initialization (`engineInit` method) may influence how certificates are processed and logged.""}, {""file"": ""sslcontext-kickstart/src/main/java/nl/altindag/ssl/trustmanager/HotSwappableX509ExtendedTrustManager.java"", ""justification"": ""This generic trust manager might have implications on how certificates and their logging behavior are managed during verification processes.""}, {""file"": ""sslcontext-kickstart/src/main/java/nl/altindag/ssl/util/TrustManagerUtils.java"", ""justification"": ""Utilities for managing trust managers are relevant since they might be involved in the settings or configurations impacting logging behavior.""}, {""file"": ""sslcontext-kickstart/src/main/java/nl/altindag/ssl/trustmanager/TrustManagerFactoryWrapper.java"", ""justification"": ""Wrapper for trust manager instantiation may affect the logging scale and should be inspected for logging calls regarding certificates.""}, {""file"": ""sslcontext-kickstart/src/main/java/nl/altindag/ssl/trustmanager/TrustStoreTrustOptions.java"", ""justification"": ""This could influence how trust managers operate internally when handling certificates, potentially impacting logging.""}, {""file"": ""sslcontext-kickstart/src/main/java/nl/altindag/ssl/util/HostnameVerifierUtils.java"", ""justification"": ""It may provide auxiliary functionalities related to hostname verification and could affect how logging is scoped during verification processes.""}]}","sslcontext-kickstart/src/main/java/nl/altindag/ssl/hostnameverifier/UnsafeHostNameVerifier.java,sslcontext-kickstart/src/main/java/nl/altindag/ssl/trustmanager/UnsafeX509ExtendedTrustManager.java"
197,"The bug appears to be related to SSL certificate validation mechanisms in version 7.4.3, specifically when trying to use the methods `withUnsafeTrustMaterial()` and `withTrustingAllCertificatesWithoutValidation()`. The error indicates that the `UnsafeX509ExtendedTrustManager` is improperly configured, leading to zero accepted certificates, thereby failing the connection's SSL validation. The report suggests that previous versions (7.3.0 and 7.4.2) did not have this issue, indicating a regression in the recent update. The key components likely affected by the bug include trust manager implementations and the SSL factory responsible for creating SSL contexts and managing trust materials.","{""ranked_list"": [{""file"": ""sslcontext-kickstart/src/main/java/nl/altindag/ssl/trustmanager/UnsafeX509ExtendedTrustManager.java"", ""justification"": ""Contains critical methods like `checkServerTrusted` and `checkClientTrusted` which override component behavior to ignore certificate validation. The zero accepted certificates directly relate to the core of the bug.""}, {""file"": ""sslcontext-kickstart/src/main/java/nl/altindag/ssl/trustmanager/CombinableX509TrustManager.java"", ""justification"": ""This file implements methods handling multiple trust managers, which may impact how `UnsafeX509ExtendedTrustManager` operates within a combination and could be related to the failure in validation.""}, {""file"": ""sslcontext-kickstart/src/main/java/nl/altindag/ssl/SSLFactory.java"", ""justification"": ""Methods `withUnsafeTrustMaterial()` and `withTrustingAllCertificatesWithoutValidation()` are crucial to setting up the trust manager's configuration as seen in the bug report, making it highly relevant to analyze.""}]}","sslcontext-kickstart/src/main/java/nl/altindag/ssl/trustmanager/CombinableX509TrustManager.java,sslcontext-kickstart/src/main/java/nl/altindag/ssl/util/TrustManagerUtils.java"
167,"The bug report identifies an issue with the SSLContext where the trusted certificates are not being correctly set, resulting in an empty trustedCerts list. Key components of the report include mentions of classes and methods such as CertificateUtils, SSLFactory, and certificate entries. Users note the method of creating a trust store and the handling of certificate aliases, hinting at the need for the alias to likely be transformed to lowercase to match existing keys. This indicates that the core functionality revolves around key management and trust management processes.","{""ranked_list"": [{""file"": ""sslcontext-kickstart/src/main/java/nl/altindag/ssl/util/KeyStoreUtils.java"", ""justification"": ""Contains the method createTrustStore, which directly relates to the issue of managing trusted certificates in the SSL context.""}, {""file"": ""sslcontext-kickstart/src/main/java/nl/altindag/ssl/util/CertificateUtils.java"", ""justification"": ""Includes the method generateAlias, which is involved in generating certificate aliases that might relate to the bug report's mention of alias handling.""}, {""file"": ""sslcontext-kickstart/src/main/java/nl/altindag/ssl/SSLFactory.java"", ""justification"": ""The SSLFactory class is responsible for building the SSLContext. Issues with the SSLContext completeness could stem from how it integrates with other components.""}, {""file"": ""sslcontext-kickstart/src/main/java/nl/altindag/ssl/trustmanager/UnsafeX509ExtendedTrustManager.java"", ""justification"": ""This manager ignores certificate validation entirely, which could be pertinent given that the report emphasizes issues with trusted certificates.""}, {""file"": ""sslcontext-kickstart/src/main/java/nl/altindag/ssl/trustmanager/DelegatingX509ExtendedTrustManager.java"", ""justification"": ""Involves trust management logic which may impact trusted certificate processing.""}, {""file"": ""sslcontext-kickstart/src/main/java/nl/altindag/ssl/trustmanager/CompositeX509ExtendedTrustManager.java"", ""justification"": ""Uses multiple trust managers and could be part of the handling that determines trusted certificates.""}, {""file"": ""sslcontext-kickstart/src/main/java/nl/altindag/ssl/trustmanager/CertificateCapturingX509ExtendedTrustManager.java"", ""justification"": ""Captures certificates, which is relevant to the handling of certificate entries, potentially aiding issues in trust validation.""}, {""file"": ""sslcontext-kickstart/src/main/java/nl/altindag/ssl/trustmanager/DelegatingTrustManager.java"", ""justification"": ""Delegates checks to various trust managers, affecting how SSL certificates are validated.""}, {""file"": ""sslcontext-kickstart/src/main/java/nl/altindag/ssl/util/TrustManagerUtils.java"", ""justification"": ""Possibly contains utility methods for managing trust relationships that are relevant to the SSLContext generation process.""}]}",sslcontext-kickstart/src/main/java/nl/altindag/ssl/util/CertificateUtils.java
217,"The bug report indicates a failure in the SSL connection due to certain trust managers not accepting all certificates. The problem seems related to changes introduced in version 7.4.3 that affect methods like `withUnsafeTrustMaterial()` and `withTrustingAllCertificatesWithoutValidation()`. The core of the issue lies in the `UnsafeX509ExtendedTrustManager`, which has no accepted certificates, and how this interacts with `CombinableX509TrustManager`. The methods responsible for handling the trust material configuration and the checking of certificates are crucial in this context. Specifically, any issues with these methods could lead to the described behavior of skipping the acceptance of certificates.","{""ranked_list"": [{""file"": ""sslcontext-kickstart/src/main/java/nl/altindag/ssl/trustmanager/UnsafeX509ExtendedTrustManager.java"", ""justification"": ""This file contains the `checkClientTrusted()` and `checkServerTrusted()` methods, both of which implement logic that ignores certificate validation. Given the bug report indicates skipping accept-all configurations, this class is directly related to the issue.""}, {""file"": ""sslcontext-kickstart/src/main/java/nl/altindag/ssl/trustmanager/CombinableX509TrustManager.java"", ""justification"": ""This file manages the interactions between multiple trust managers and their trust evaluations. The `checkTrusted()` method is critical in determining how trust is collectively assessed, making it highly relevant to the bug.""}, {""file"": ""sslcontext-kickstart/src/main/java/nl/altindag/ssl/SSLFactory.java"", ""justification"": ""This file defines the `withUnsafeTrustMaterial()` method, which is implicated in the bug. This method's functionality directly affects how certificates are accepted in the SSL context, aligning tightly with the symptoms in the bug report.""}, {""file"": ""sslcontext-kickstart/src/test/java/nl/altindag/ssl/SSLFactoryShould.java"", ""justification"": ""This test file contains tests for the `SSLFactory`, particularly for building configurations with trusting all certificates and handling various trust materials. Relevant assertions validate the behavior expectations described in the bug report.""}, {""file"": ""sslcontext-kickstart/src/test/java/nl/altindag/ssl/trustmanager/UnsafeX509ExtendedTrustManagerShould.java"", ""justification"": ""This test file likely tests behavior of the `UnsafeX509ExtendedTrustManager`. The `checkServerTrusted()` test demonstrates how the manager handles incoming certificates, relevant to the bug symptoms.""}, {""file"": ""sslcontext-kickstart/src/main/java/nl/altindag/ssl/trustmanager/CompositeX509ExtendedTrustManager.java"", ""justification"": ""This implementation could hold relevant logic in combining multiple trust managers, although less directly than others, it's worthwhile to inspect as it influences the combined behavior of several trust managers.""}, {""file"": ""sslcontext-kickstart/src/main/java/nl/altindag/ssl/trustmanager/TrustManagerConsumer.java"", ""justification"": ""Defines the callback mechanism for checking trust against individual trust managers, providing context on how one trust manager may influence another, although less pivotal directly.""}, {""file"": ""sslcontext-kickstart/src/test/java/nl/altindag/ssl/SSLFactoryIT.java"", ""justification"": ""Integration tests here would provide insight into how the SSLFactory and its components work together under real scenarios, which might reveal interactions leading to the observed bug.""}, {""file"": ""sslcontext-kickstart/src/test/java/nl/altindag/ssl/trustmanager/CompositeX509ExtendedTrustManagerShould.java"", ""justification"": ""Potentially tests additional combinations of trust managers and their behaviors during certificate checks, indirectly relevant to understanding the interaction of trust components.""}, {""file"": ""sslcontext-kickstart/src/main/java/nl/altindag/ssl/trustmanager/DummyX509ExtendedTrustManager.java"", ""justification"": ""This could possibly simulate trust manager behavior and help validate edge cases of trust evaluations. While contextually not as strong, it's worth reviewing.""}]}","sslcontext-kickstart/src/main/java/nl/altindag/ssl/util/TrustManagerUtils.java,sslcontext-kickstart/src/main/java/nl/altindag/ssl/util/ValidationUtils.java"
203,"The bug report mentions the need for support for the Android keystore. The Android keystore serves as a secure system for managing cryptographic keys. The keywords to note from this report would be 'keystore' and any references to methods or classes related to keystore operations. Based on standard practices, operations involving loading the keystore, creating trust managers, and key manager functionalities are likely to be impacted by changes or issues with the Android keystore integration.","{""ranked_list"": [{""file"": ""sslcontext-kickstart/src/main/java/nl/altindag/ssl/util/KeyStoreUtils.java"", ""justification"": ""This file contains methods directly related to keystore functionality, such as loading a keystore and creating trust stores. Its direct relation to keesting operations makes it a top candidate for containing the bug.""}, {""file"": ""sslcontext-kickstart/src/main/java/nl/altindag/ssl/util/KeyManagerUtils.java"", ""justification"": ""This file includes methods for creating key managers, which are essential for managing keystore interactions. The methods' responsibilities align closely with the functionality needed when dealing with the Android keystore.""}, {""file"": ""sslcontext-kickstart/src/main/java/nl/altindag/ssl/SSLFactory.java"", ""justification"": ""The SSLFactory handles SSL materials and key management setups; any bugs in integrating keystore functions could be highlighted here, especially through the methods that create key and trust managers.""}, {""file"": ""sslcontext-kickstart/src/main/java/nl/altindag/ssl/util/TrustManagerUtils.java"", ""justification"": ""This file's methods revolve around creating and managing trust managers, which play a role in how keystores verify the authenticity of keys, making it relevant to the bug concerning the keystore.""}, {""file"": ""sslcontext-kickstart/src/main/java/nl/altindag/ssl/trustmanager/TrustManagerFactorySpiWrapper.java"", ""justification"": ""This file deals with creating trust managers which are often used alongside keystores for SSL configurations. Any issues with key storage would likely affect this wrapper.""}, {""file"": ""sslcontext-kickstart/src/main/java/nl/altindag/ssl/keymanager/KeyManagerFactoryWrapper.java"", ""justification"": ""This serves as a wrapper around KeyManager functionalities and its role relates to handling keys securely, thus impacting keystore-related functionality.""}, {""file"": ""sslcontext-kickstart/src/main/java/nl/altindag/ssl/trustmanager/DelegatingTrustManager.java"", ""justification"": ""This file manages the delegating trust behavior for trust managers, closely intertwined with how keystore procedures work.""}, {""file"": ""sslcontext-kickstart/src/main/java/nl/altindag/ssl/model/KeyStoreHolder.java"", ""justification"": ""The KeyStoreHolder is designed for holding keystore references and their existence plays a supporting role in keystore operations. This helps in analyzing whether the keystore integration is functional.""}, {""file"": ""sslcontext-kickstart/src/main/java/nl/altindag/ssl/exception/GenericKeyStoreException.java"", ""justification"": ""This exception handling class is relevant as it would be triggered in the event of failures associated with keystore operations, making it essential to review.""}, {""file"": ""sslcontext-kickstart/src/main/java/nl/altindag/ssl/trustmanager/CompositeX509ExtendedTrustManager.java"", ""justification"": ""This file aids in managing multiple trust managers, which is vital when multiple keystore configurations are used, thus potentially revealing issues with how they interact with the Android keystore.""}]}",sslcontext-kickstart/src/main/java/nl/altindag/ssl/util/KeyStoreUtils.java
234,"The bug report centers around potential issues within the `FenixHostnameVerifier` class, specifically regarding its verification logic for hostnames. Key considerations extracted from the report include: 1. **Use of `endsWith()`**: The report questions whether `endsWith()` should be used instead of the current string comparison logic. 2. **Redundant Checks**: The report suggests that checking for non-empty values could be unnecessary if a size check is in place (size=2). 3. **CN Check Omission**: It raises concerns about the intentional exclusion of Common Names (CN) in the verification process, which might lead to security vulnerabilities, as CN is a critical part of SSL certificate verification. 4. **Warning about TLD patterns**: There’s mention of a need for a warning related to invalid patterns in Top-Level Domains (TLDs) such as *.co.uk or incorrect wildcard handling. The components affected include the hostname verification logic and any related classes or methods used in the verification process.","{""ranked_list"": [{""file"": ""sslcontext-kickstart/src/main/java/nl/altindag/ssl/hostnameverifier/FenixHostnameVerifier.java"", ""justification"": ""This is the main class referenced in the bug report that contains the hostname verification logic. Specific methods that are likely candidates for issues include verify(String host, SSLSession sslSession), verify(String host, X509Certificate certificate), and verifyHostname(String hostname, X509Certificate certificate).""}, {""file"": ""sslcontext-kickstart/src/test/java/nl/altindag/ssl/hostnameverifier/FenixHostnameVerifierShould.java"", ""justification"": ""This test class appears to contain unit tests for the FenixHostnameVerifier methods, potentially validating the correctness of the hostname verification logic. It includes tests for CN and Subject Alternative Name (SAN) checks which are directly related to the bug report questions.""}, {""file"": ""sslcontext-kickstart/src/main/java/nl/altindag/ssl/util/HostnameVerifierUtils.java"", ""justification"": ""This utility class contains the method createFenix(), which directly creates an instance of FenixHostnameVerifier. Understanding its usage context could provide insights into how FenixHostnameVerifier is utilized in the application.""}, {""file"": ""sslcontext-kickstart/src/main/java/nl/altindag/ssl/hostnameverifier/UnsafeHostnameVerifier.java"", ""justification"": ""This class may provide alternative hostname verification strategies that could illuminate potential flaws or differences in how hostnames are validated compared to FenixHostnameVerifier.""}, {""file"": ""sslcontext-kickstart/src/main/java/nl/altindag/ssl/hostnameverifier/Hostnames.java"", ""justification"": ""Although it does not seem directly referenced in the bug report, the utility methods in this class might help in processing hostname strings, which could be relevant for validation logic.""}, {""file"": ""sslcontext-kickstart/src/main/java/nl/altindag/ssl/util/TrustManagerUtils.java"", ""justification"": ""Contains methods related to trust management, which might facilitate understanding of how certificates and verification strategies integrate with HostnameVerifier implementations.""}, {""file"": ""sslcontext-kickstart/src/main/java/nl/altindag/ssl/trustmanager/ChainAndAuthTypeValidator.java"", ""justification"": ""The validation logic could interplay with the hostname verification process, contributing to security considerations highlighted in the bug report.""}, {""file"": ""sslcontext-kickstart/src/main/java/nl/altindag/ssl/hostnameverifier/BasicHostnameVerifier.java"", ""justification"": ""This is another hostname verifier that may show different approaches to verification, potentially providing contrast to FenixHostnameVerifier's implementation.""}]}",sslcontext-kickstart/src/main/java/nl/altindag/ssl/hostnameverifier/FenixHostnameVerifier.java
505,The bug report indicates that the class `LoggingX509ExtendedTrustManager` should log `CertificateException` thrown by the delegate. The solution suggests implementing a try/catch for delegate calls and adding logging for any exceptions that occur during the certificate checking. The context points towards components related to certificate validation and logging mechanism in X509 trust managers. The main objective is to ensure that any `CertificateException` encountered during the trust management processes is logged properly.,"{""ranked_list"": [{""file"": ""sslcontext-kickstart/src/main/java/nl/altindag/ssl/trustmanager/LoggingX509ExtendedTrustManager.java"", ""justification"": ""This file directly contains the implementation of `LoggingX509ExtendedTrustManager`, which is pertinent to the bug report. Specifically, the methods `checkClientTrusted` and `checkServerTrusted` currently invoke `logCertificate`, but do not catch or log `CertificateException`, which is the core issue raised in the report.""}, {""file"": ""sslcontext-kickstart/src/test/java/nl/altindag/ssl/trustmanager/LoggingX509ExtendedTrustManagerShould.java"", ""justification"": ""This testing file likely contains unit tests that would confirm the proper logging functionality around the `LoggingX509ExtendedTrustManager`. It can provide insights on expected behaviors and potentially verify if exceptions are logged as intended.""}, {""file"": ""sslcontext-kickstart/src/main/java/nl/altindag/ssl/trustmanager/CompositeX509ExtendedTrustManager.java"", ""justification"": ""This file implements composite trust management. Given its role in aggregating multiple trust managers, it will be useful to inspect how exceptions are managed when multiple managers are involved, impacting the overall trust validation flow.""}, {""file"": ""sslcontext-kickstart/src/main/java/nl/altindag/ssl/trustmanager/DelegatingX509ExtendedTrustManager.java"", ""justification"": ""This class delegates trust management decisions to another trust manager and could be relevant in understanding where `CertificateException` might originate when working with delegate managers.""}, {""file"": ""sslcontext-kickstart/src/test/java/nl/altindag/ssl/trustmanager/CertificateCapturingX509ExtendedTrustManagerShould.java"", ""justification"": ""This file likely contains tests that confirm whether `checkClientTrusted` behaves correctly. It captures certificates, which might offer a pathway to better understand the flow of exceptions.""}, {""file"": ""sslcontext-kickstart/src/main/java/nl/altindag/ssl/trustmanager/SystemX509ExtendedTrustManager.java"", ""justification"": ""While less directly relevant, this file manages system-level trust operations. Its methods could potentially throw `CertificateException`, making it a file of interest when considering the broader certificate handling strategy.""}, {""file"": ""sslcontext-kickstart/src/test/java/nl/altindag/ssl/trustmanager/CompositeX509ExtendedTrustManagerShould.java"", ""justification"": ""This test file validates the functionalities of the `CompositeX509ExtendedTrustManager`, particularly methods that might throw exceptions and how those exceptions are handled.""}, {""file"": ""sslcontext-kickstart/src/test/java/nl/altindag/ssl/trustmanager/EnhanceableX509ExtendedTrustManagerShould.java"", ""justification"": ""As it tests enhancements to the trust manager, this file's tests will be relevant for understanding if the enhancements introduced any exception handling improvements.""}, {""file"": ""sslcontext-kickstart/src/test/java/nl/altindag/ssl/util/CertificateUtilsShould.java"", ""justification"": ""Utility functions for handling certificates might be tested here, which could include scenarios leading to `CertificateException`. Understanding these utilities could help in identifying underlying causes.""}, {""file"": ""sslcontext-kickstart/src/test/java/nl/altindag/ssl/util/TrustManagerUtilsShould.java"", ""justification"": ""Generic utility tests related to trust managers can also highlight patterns in how exceptions are produced or logged, contributing to a general understanding of the issue.""}]}",sslcontext-kickstart/src/main/java/nl/altindag/ssl/trustmanager/LoggingX509ExtendedTrustManager.java
