bug_id,bug_report_analysis,suspicious_files,fixed_files
django__django-12497,"The bug report discusses an error related to Django's handling of Many-to-Many relationships and ForeignKeys, specifically when multiple ForeignKeys are present in an intermediary model without specified through_fields. The report indicates that the hint provided by Django is misleading, suggesting a recursive relationship is being incorrectly identified with the use of ForeignKey instead of ManyToManyField. The keywords extracted include 'ForeignKey', 'ManyToManyField', 'symmetrical', and 'through'. The affected components primarily involve model relationships and mappings in Django's ORM. The presence of the error indicates that specific methods or functionalities handling these relationships are at fault, emphasizing a need for examination of files related to model fields, relationships, and their management in Django.","{""ranked_list"": [{""file"": ""django/db/models/fields/related.py"", ""justification"": ""This file contains the implementation of relationship fields, including ManyToManyField and ForeignKey. The methods here likely include logic pertinent to relationship definitions, which is central to the described bug.""}, {""file"": ""django/db/models/fields/related_descriptors.py"", ""justification"": ""This file handles descriptors for related fields, including methods to manage Many-to-Many relationships. Its methods like add(), create(), and get_queryset() likely interface directly with the creation and management of relationships, making it a primary candidate for the bug's origin.""}, {""file"": ""django/db/models/options.py"", ""justification"": ""Contains logic to assert and validate model options and fields, including ManyToManyField specifications. The method 'is_not_an_m2m_field' could provide additional context on whether the related fields are incorrectly categorized.""}, {""file"": ""django/db/models/fields/__init__.py"", ""justification"": ""This file serves as the initialization for various field types in Django models, including ForeignKey and ManyToManyField definitions. Analyzing how these fields are created and initialized may reveal if there are implementation errors.""}, {""file"": ""django/db/migrations/operations/models.py"", ""justification"": ""Responsible for handling migrations on models. It may provide insights into how changes or additions to ForeignKey and ManyToManyField relationships are managed during migrations.""}, {""file"": ""django/db/models/base.py"", ""justification"": ""This file deals with the core mechanics of Django models, including their interactions and relationships. Errors in defining relationships can sometimes stem from abstract base class logic.""}, {""file"": ""django/contrib/admin/options.py"", ""justification"": ""Admin options control how models are presented and interacted with in the Django admin interface. Applicable if the bug surfaces in admin functionality related to model relationships.""}, {""file"": ""django/db/models/query.py"", ""justification"": ""Handles querying of models. If the relationship handling affects data retrieval or query formulation, this file may contain relevant information on how these queries are constructed.""}, {""file"": ""django/db/migrations/autodetector.py"", ""justification"": ""Involved in detecting changes in models and could be responsible for indicating changes in relationship definitions that need migrating.""}, {""file"": ""django/core/checks/model_checks.py"", ""justification"": ""This file contains checks for model integrity and relationships within the Django framework, which may catch issues like incorrect ForeignKey definitions.""}]}",['django/db/models/fields/related.py']
django__django-12589,"The bug report indicates issues with handling ""GROUP BY"" clauses in Django 3.0, particularly in the context of complex queries involving model annotations and relationships. The error mentioned is a ProgrammingError due to ambiguous column references in the generated SQL when transitioning from Django 2.2.11 to 3.0. The models of concern (A, B, AB, and C) demonstrate relationships expected to be handled in the specific query construction that involves aggregating and filtering based on these relationships. Key terms include ""GROUP BY"", ""annotate"", and ""ambiguous column reference"". This suggests analysis of the query generation process, particularly methods responsible for annotations and aggregations.","{""ranked_list"": [{""file"": ""django/db/models/sql/query.py"", ""justification"": ""Contains methods essential for managing query fundamentals, including 'set_group_by', which directly relates to the GROUP BY error discussed.""}, {""file"": ""django/db/models/sql/compiler.py"", ""justification"": ""Manages how the SQL query is constructed, including the method 'get_group_by' which assesses the GROUP BY clauses in complex queries.""}, {""file"": ""django/db/models/query.py"", ""justification"": ""Houses the 'annotate' method which is central to the error as it operates on queryset modification and aggregation, potentially causing GROUP BY issues.""}, {""file"": ""django/db/models/aggregates.py"", ""justification"": ""Defines aggregation features necessary to evaluate how annotated fields interact with GROUP BY operations.""}, {""file"": ""django/db/models/sql/subqueries.py"", ""justification"": ""Important for managing subqueries which may affect the way GROUP BY clauses are structured in complex queries.""}, {""file"": ""django/db/models/fields/related.py"", ""justification"": ""Contains definitions regarding related fields that could impact filter conditions and GROUP BY processing.""}, {""file"": ""django/db/models/sql/where.py"", ""justification"": ""Manages WHERE conditions, significant since they contribute to the overall structure of SQL queries, including GROUP BY clauses.""}, {""file"": ""django/db/backends/postgresql/operations.py"", ""justification"": ""Houses operations that provide PostgreSQL specific SQL functionalities which might affect query generation and interpretation.""}, {""file"": ""django/db/models/query_utils.py"", ""justification"": ""Includes utilities for managing queryset operations, which may affect or mediate how aggregations and filters are structured.""}, {""file"": ""django/db/models/constraints.py"", ""justification"": ""Handles constraints on database tables which can potentially disrupt complex query generation, including GROUP BY functionality.""}]}",['django/db/models/sql/query.py']
django__django-12708,"The bug report indicates a crash during migration related to Django's `index_together` and `unique_together` features. The specific error arises from the `_delete_composed_index()` method in the 'schema.py' file, where the function fails due to multiple constraints existing when only one was expected. The report emphasizes the need for a coherent relationship between these two features and indicates that refactoring code to utilize Django 1.11's `Options.indexes` is also part of the issue. Key components involve constraints, indexes, and the management of relational database entries in Django.","{""ranked_list"": [{""file"": ""django/db/backends/base/schema.py"", ""justification"": ""Contains the primary method _delete_composed_index() that is directly connected to the crash described in the bug report due to improper handling of indexes and constraints.""}, {""file"": ""django/db/models/indexes.py"", ""justification"": ""Houses methods related to the management of indexes, including create_sql() and remove_sql(), which are relevant to the bug's context regarding index operations.""}, {""file"": ""django/db/models/base.py"", ""justification"": ""Includes _check_index_together() and _check_unique_together() methods, which validate the coherence between index_together and unique_together, addressing the concerns in the bug report.""}, {""file"": ""django/db/migrations/operations/models.py"", ""justification"": ""Involved in handling operations related to models, which may indirectly impact migration-related processes as described in the bug.""}, {""file"": ""django/db/models/constraints.py"", ""justification"": ""Directly deals with constraints, thus relevant to the reported issue of constraint management as it relates to index and unique constraints.""}, {""file"": ""django/db/models/options.py"", ""justification"": ""Contains methods that handle various model options, including settings for unique and index constraints that may impact migration behavior.""}, {""file"": ""django/db/models/fields/related.py"", ""justification"": ""Includes validations and checks for related fields that could influence overall model relationships and integrity.""}, {""file"": ""django/db/migrations/operations/fields.py"", ""justification"": ""Significant for managing migration operations related to fields, which tie into the analysis of how fields interact with indexes and uniqueness.""}, {""file"": ""django/db/models/indexes.py"", ""justification"": ""Focused on operations specifically for index management, vital for understanding migration failures involving indexes.""}, {""file"": ""django/db/backends/sqlite3/schema.py"", ""justification"": ""Useful for understanding backend-specific implementation details regarding schema management, particularly for SQLite databases.""}]}",['django/db/backends/base/schema.py']
django__django-12700,"The bug report indicates an issue with the insufficient cleansing of sensitive values in Django settings, specifically when dealing with non-dictionary iterables. The report highlights the methods `django.views.debug.SafeExceptionReporterFilter.get_safe_settings()` and `django.views.debug.cleanse_setting()` as critical components that require inspection due to their roles in returning and cleansing sensitive settings values. Keywords such as 'settings', 'cleaning', and specific methods directly connect to potential files that may contain relevant code for understanding and fixing the issue.","{""ranked_list"": [{""file"": ""django/views/debug.py"", ""justification"": ""This file defines the methods `get_safe_settings()` and `cleanse_setting()`, which are directly responsible for sanitizing Django settings. The body of these methods reflects their insufficiency in handling non-dictionary types, making it central to the reported issue.""}, {""file"": ""django/conf/__init__.py"", ""justification"": ""Contains configurations and likely interacts with settings management, specifically through the `__getattr__` method that relates to dynamic access and potentially handling sensitive settings.""}, {""file"": ""django/core/management/commands/diffsettings.py"", ""justification"": ""This file processes user-defined settings vs. default settings. The relationship between user settings and systemic settings might be relevant in the context of how settings are displayed or altered.""}, {""file"": ""django/core/checks/templates.py"", ""justification"": ""Includes checks related to settings which may provide insights into best practices for settings management and validation but may not be directly related to cleansing.""}, {""file"": ""django/db/utils.py"", ""justification"": ""While more related to database operations, this file interacts with settings, ensuring configurations are properly instantiated, which can indirectly influence how sensitive data is managed.""}, {""file"": ""django/test/signals.py"", ""justification"": ""Manages various settings signals which may include triggers related to changes in sensitive settings, although indirectly related.""}, {""file"": ""django/core/checks/security/base.py"", ""justification"": ""Contains checks that may detect potential vulnerabilities in settings, although not directly tied to the cleansing issue raised.""}, {""file"": ""django/core/files/storage.py"", ""justification"": ""Interacts with file storage settings that may include sensitive paths or configurations, potentially interesting for security reviews.""}, {""file"": ""django/forms/forms.py"", ""justification"": ""While primarily focused on forms, it may interact with settings related to input validation and display of sensitive fields.""}, {""file"": ""django/views/decorators/debug.py"", ""justification"": ""Contains decorators that may affect debugging output where sensitive settings could appear, warranting a review of usage.""}]}",['django/views/debug.py']
django__django-12856,"The bug report highlights an issue with the Django model migration process related to the handling of unique constraints. Specifically, it mentions that when a model gains a UniqueConstraint, the Django 'makemigrations' command should validate that the fields designated by the UniqueConstraint exist. At present, this check appears to be either missing or not functioning correctly, contrasting with the older `unique_together` syntax, which raises an error if any of the fields are absent. Key aspects to investigate based on this bug report include checks for unique constraints, the definition and initialization of UniqueConstraint, and the methods involved in verifying model fields during the migrations process. The overall functionality, particularly focusing on unique constraints and field validation, should be analyzed.","{""ranked_list"": [{""file"": ""django/db/models/base.py"", ""justification"": ""Contains methods related to model checks, specifically '_check_unique_together' and 'check', which are vital to field verification and control over unique constraints during migrations.""}, {""file"": ""django/db/models/constraints.py"", ""justification"": ""Defines the UniqueConstraint class, which is directly affected by the issues stated in the bug report. The constructor and methods to check conditions on constraints need to be assessed.""}, {""file"": ""django/core/checks/model_checks.py"", ""justification"": ""This file encompasses various model checks, including validation checks that are critical during the 'makemigrations' process.""}, {""file"": ""django/db/migrations/operations/models.py"", ""justification"": ""Contains methods that manage migration operations, including those for handling unique constraints, and initialization methods could influence how these are set up.""}, {""file"": ""django/db/migrations/autodetector.py"", ""justification"": ""Responsible for detecting changes in models, including the addition of unique constraints, reaching into how those constraints are generated in migrations.""}, {""file"": ""django/forms/models.py"", ""justification"": ""If unique constraints are being handled through forms, this file will contain validations affecting the integrity of fields related to the UniqueConstraint.""}, {""file"": ""django/db/models/fields/mixins.py"", ""justification"": ""Includes checks that could interact with model field definitions, which are fundamental when creating unique constraints.""}, {""file"": ""django/db/migrations/loader.py"", ""justification"": ""Responsible for loading migrations and ensuring that constraints are correctly managed across migrations. Complements the analysis from 'autodetector.py'.""}, {""file"": ""django/db/models/fields/related.py"", ""justification"": ""Checks related model fields which may also impact how unique constraints function in multi-field scenarios.""}]}",['django/db/models/base.py']
django__django-12915,"The bug report highlights a missing asynchronous response function, `get_response_async`, in the `ASGIStaticFilesHandler`. The traceback shows that while trying to use this handler, a 'NoneType' object is not callable exception occurs, indicating that the response function expected by the ASGI handler is not properly defined or is returning None. Related components include `StaticFilesHandlerMixin` and any classes or files involved in the ASGI handling process.","{""ranked_list"": [{""file"": ""django/core/handlers/base.py"", ""justification"": ""Contains the `get_response_async` method, which is critical to this bug report. The method's definition includes async handling logic, which is central to solving the issue described.""}, {""file"": ""django/core/handlers/asgi.py"", ""justification"": ""Defines the ASGI entry point and calls the `get_response_async` method. It handles the asynchronous request processing, making it vital for understanding how the static files handler operates.""}, {""file"": ""django/contrib/staticfiles/handlers.py"", ""justification"": ""Involved in static file handling for Django applications. While it doesn't define `get_response_async`, it directly interacts with the request and response flow, hence potentially relevant to the issue.""}, {""file"": ""django/core/handlers/exception.py"", ""justification"": ""Handles exceptions during the request/response cycle. Since exceptions are part of the async processing flow, this file may contain relevant error handling logic.""}, {""file"": ""django/utils/asyncio.py"", ""justification"": ""Contains async-related utilities that could provide insights or helper functions related to async handling, particularly around function safety in async contexts.""}, {""file"": ""django/http/response.py"", ""justification"": ""Defines various HTTP response classes including error handling responses. Understanding this file may help clarify how responses are structured when errors occur.""}, {""file"": ""django/core/checks/async_checks.py"", ""justification"": ""Could contain checks related to async processing which might indirectly relate to being safe in async contexts.""}, {""file"": ""django/utils/deprecation.py"", ""justification"": ""Might contain deprecated functionalities that relate to async or static file handling that needs to be reviewed for thoroughness.""}, {""file"": ""django/utils/log.py"", ""justification"": ""Handles logging mechanisms potentially utilized during the async response process, which could help trace issues.""}, {""file"": ""django/middleware/http.py"", ""justification"": ""Defines middleware that could affect request/response processing, and given its position in the stack, it may interact with asynchronous handling.""}]}",['django/contrib/staticfiles/handlers.py']
django__django-12908,"The bug report indicates that when using `.union()` and `.distinct()` on annotated querysets from Django's ORM framework, the expected behavior of `.distinct()` is not functioning correctly. This suggests a potential bug in how the distinct clause is being combined or applied after the union operation. The relevant classes and methods here primarily involve querysets, SQL compilation, and conditional logic around handling databases. Keywords extracted include 'union', 'distinct', and 'queryset'. Specific methods of interest from the bug report hint at areas in the Django ORM where these functionalities are handled. Components likely affected include `django/db/models/query.py`, which handles query construction and logic implementations for these operations.","{""ranked_list"": [{""file"": ""django/db/models/query.py"", ""justification"": ""Contains the implementation of both 'union' and 'distinct' methods, critical for understanding how these operations manipulate querysets. The observed behavior in the bug report directly relates to the logic within these methods.""}, {""file"": ""django/db/models/sql/compiler.py"", ""justification"": ""Responsible for compiling the SQL queries generated by the ORM, which includes handling 'DISTINCT ON' clauses. This file is relevant for analyzing how the compiled SQL interacts with the UNION and DISTINCT operations.""}, {""file"": ""django/db/models/sql/query.py"", ""justification"": ""Defined for managing SQL queries and combining multiple querysets. The 'add_distinct_fields' method is particularly pertinent as it is involved in how distinct fields are processed during query compilation.""}, {""file"": ""django/db/models/sql/where.py"", ""justification"": ""This file interacts directly with conditions in the SQL query, affecting how 'WHERE' clauses are generated, which may have implications on UNION logic when combined with DISTINCT.""}, {""file"": ""django/db/models/query_utils.py"", ""justification"": ""Includes utility functions that may be relevant to handling query conditions and structuring query logic. The synergy of these utilities with our queryset operations is crucial to verify.""}, {""file"": ""django/db/models/aggregates.py"", ""justification"": ""Methods integrate with the queryset to allow for aggregate operations which may influence the results returned by DISTINCT, especially when filters and aggregation are applied.""}, {""file"": ""django/db/models/sql/subqueries.py"", ""justification"": ""Related to subquery generation, which can be pivotal when UNION operations contain nested queries that require DISTINCT processing.""}, {""file"": ""django/db/models/base.py"", ""justification"": ""Fundamental file for base model operations; any incorrect behaviors in the underlying model's retrieval functions may contribute to the observed erroneous behaviors.""}, {""file"": ""django/test/testcases.py"", ""justification"": ""Contains test cases for different model operations; if present, examining previous test cases could reveal if this issue was considered in the testing suite.""}, {""file"": ""django/core/checks/model_checks.py"", ""justification"": ""Includes checks that validate model-related operations which might indirectly relate to issues in queryset handling like the one described in the bug report.""}]}",['django/db/models/query.py']
django__django-12747,"The bug report indicates an inconsistency in the result format of the `QuerySet.Delete` method in Django. The reported issue highlights two different outcomes when no objects are deleted: one involving models with foreign keys returning a tuple with an empty dictionary, while another with simple models returns a tuple with a zero-value dictionary. The expectation is that both outcomes should align in how they represent the absence of deleted records. Key areas to investigate related to this report include files responsible for the `delete` method and model relationships in Django, particularly in the context of how objects are managed during deletions and how foreign keys are handled.","{""ranked_list"": [{""file"": ""django/db/models/query.py"", ""justification"": ""This file contains the implementation of the `delete` method as part of the `QuerySet` class. It handles the actual deletion of records from the database and aligns directly with the issue described in the bug report regarding inconsistencies when deleting objects.""}, {""file"": ""django/db/models/deletion.py"", ""justification"": ""The `deletion.py` file works with relational data structures and manages the delete operations. It details the process of collecting instances to be deleted, operations involving foreign key relationships, and how they are cascaded during deletion, directly impacting the bug report's situation.""}, {""file"": ""django/db/models/base.py"", ""justification"": ""This file includes the base class for all models in Django. Its `delete` method interfaces with the deletion process and is fundamental in determining how objects are deleted, which is relevant to the inconsistency mentioned in the report.""}, {""file"": ""django/db/models/query_utils.py"", ""justification"": ""The query_utils file provides functions that help manipulate and organize query results, which can directly affect how deletion operations are interpreted and managed, potentially contributing to the inconsistencies observed.""}, {""file"": ""django/core/cache/backends/db.py"", ""justification"": ""While primarily dealing with caching, this file\u2019s delete methods may also provide insights into how deletion operations affect underlying data integrity and how results are returned.""}, {""file"": ""django/db/models/fields/related.py"", ""justification"": ""This file deals with related fields in the Django ORM, which is crucial for understanding how related objects are managed during deletion, especially concerning foreign key constraints and their expected behaviors.""}, {""file"": ""django/contrib/contenttypes/fields.py"", ""justification"": ""While this file focuses on content types, it may also intersect with deletion semantics where relationships between content types and their handling during deletion are concerned, making it worth reviewing.""}, {""file"": ""django/db/models/fields/related_descriptors.py"", ""justification"": ""This file contains the descriptors used for handling relationships in Django models. Since the bug involves potential inconsistencies across related and non-related objects during deletion, methods here might be relevant.""}, {""file"": ""django/db/migrations/operations/models.py"", ""justification"": ""Migrations can directly impact how deletions modify the schema and data representations in the database. Analyzing migration operations could uncover issues relating to how deletions are expected to behave post-migration.""}, {""file"": ""django/db/models/sql/query.py"", ""justification"": ""As queries interface with the database, understanding how deletion queries are structured and executed can lead to insights into potential inconsistencies arising from SQL operations that reflect the deletion process.""}]}",['django/db/models/deletion.py']
