bug_id,bug_report_analysis,suspicious_files,fixed_files
django__django-11001,"The bug report details an issue with the `SQLCompiler.get_order_by()` method in Django, indicating that it improperly removes duplicate 'ORDER BY' clauses when they only differ by newline characters in multiline RawSQL. The reported issue suggests that the current implementation incorrectly determines duplicates based on only the last line of SQL expressions, leading to unintended removal of necessary ordering. The report hints at the underlying causes related to how `self.ordering_parts.search(sql)` operates and suggests a workaround: cleaning up SQL input to a single line. Key components involve the `get_order_by` method and Regular Expressions.","{""ranked_list"": [{""file"": ""django/db/models/sql/compiler.py"", ""justification"": ""The file contains the `get_order_by` method which directly relates to the bug, as the issue revolves around how this method identifies duplicates in SQL queries.""}, {""file"": ""django/db/models/sql/query.py"", ""justification"": ""This file includes the `add_ordering` method that adds items to the ORDER BY clause. This method might be related to how order is being managed and potentially influenced by the erroneous logic in `get_order_by`.""}, {""file"": ""django/db/models/query.py"", ""justification"": ""Includes methods such as `filter`, `exclude`, and `annotate`, which can affect how queries are constructed and may influence the ORDER BY behavior indirectly.""}, {""file"": ""django/db/models/expressions.py"", ""justification"": ""The expressions in this file could relate to how SQL is constructed, particularly focusing on the manipulations of SQL fragments and their integration into the overall query.""}, {""file"": ""django/db/models/sql/where.py"", ""justification"": ""May provide context in how SQL conditions are structured, ensuring that any SQL logic checks are accounted for. This could also impact ordering conditions.""}, {""file"": ""django/db/models/fields/__init__.py"", ""justification"": ""Contains core field type definitions which could be indirectly involved when complex fields are used in order statements.""}, {""file"": ""django/db/models/aggregates.py"", ""justification"": ""May influence how aggregate functions are included when ordering clauses are built, affecting resultant queries.""}, {""file"": ""django/db/backends/mysql/operations.py"", ""justification"": ""Local implementation details of SQL operations may have specific differences that could expose or introduce an additional layer to the underlying issue.""}]}",['django/db/models/sql/compiler.py']
django__django-11039,"The bug report refers to an issue in the `sqlmigrate` command of the Django framework, specifically regarding the handling of transaction wrapping for migrations. The primary concern is that the `sqlmigrate` command should check if the database can support transactional DDL through `connection.features.can_rollback_ddl` before wrapping the output in BEGIN/COMMIT blocks. The bug report suggests modifying the assignment of `self.output_transaction` in `sqlmigrate.py` and creating a test case to validate the behavior when DDL rollback is not supported by the database. The affected components revolve around migration execution, transaction handling, and database capabilities regarding DDL operations.","{""ranked_list"": [{""file"": ""django/core/management/commands/sqlmigrate.py"", ""justification"": ""This file directly implements the `sqlmigrate` command where the bug is reported. The method `execute` hints at the handling of SQL output, making it the primary candidate for the bug.""}, {""file"": ""django/db/migrations/executor.py"", ""justification"": ""Manages migration execution including transaction handling. The `migrate` method orchestrates how migrations are applied, thus is crucial for understanding how transactions are managed within migrations.""}, {""file"": ""django/db/migrations/migration.py"", ""justification"": ""Defines migration operations and how they are applied to the database. The `apply` method processes migration operations, which is relevant in the context of whether to wrap these operations in transactions.""}, {""file"": ""django/db/backends/base/features.py"", ""justification"": ""Contains the method `supports_transactions`, which is vital for determining if the current database backend supports transactional DDL, directly relating to the bug's context.""}, {""file"": ""django/db/backends/sqlite3/base.py"", ""justification"": ""As a specific backend, it might show differing behavior related to transactional DDL depending on the features of the database. Understanding its behavior is important for any fixes.""}, {""file"": ""django/db/migrations/operations/base.py"", ""justification"": ""Provides the foundational structure for migration operations, likely to contain checks on DDL and transaction compatibility.""}, {""file"": ""django/db/migrations/loader.py"", ""justification"": ""Handles loading of migrations, which is crucial for understanding the overall flow and context in which the `sqlmigrate` command operates.""}, {""file"": ""django/db/backends/mysql/features.py"", ""justification"": ""This could represent backend-specific features regarding transactions which are critical to assess how the `sqlmigrate` command should behave.""}, {""file"": ""django/db/backends/postgresql/creation.py"", ""justification"": ""Manages database schema creation, which might also involve aspects related to transactional behavior on migration.""}, {""file"": ""django/core/management/commands/migrate.py"", ""justification"": ""The main command for applying migrations, relevant for understanding how `sqlmigrate` interacts with migration processes.""}]}",['django/core/management/commands/sqlmigrate.py']
django__django-11179,"The bug report indicates that invoking the `delete()` method on instances of models without any dependencies does not set the primary key (PK) to None after the deletion call. This implies an expected functionality where the PK should be updated post-deletion. The user specifically referenced Django's source code around lines 276-281 in `django.db.models.deletion`, hinting that the logic for dealing with deletions is located there. Keywords identified include 'delete', 'instances', 'dependencies', and 'PK'. The report suggests that the `delete` methods located in relevant Django files are the primary focus for investigation.","{""ranked_list"": [{""file"": ""django/db/models/deletion.py"", ""justification"": ""Contains the main logic for the delete operation, directly referenced in the bug report. The method body includes handling for updating field values and seems to relate directly to the expected behavior of PK management after deletion.""}, {""file"": ""django/db/models/base.py"", ""justification"": ""Defines the base `delete()` method which calls the Collector to manage deletions. This file's delete method checks for primary key presence, which is related to the bug report's symptom that PKs are not nulled after deletions.""}, {""file"": ""django/db/models/query.py"", ""justification"": ""Contains a delete method that handles deletions at the queryset level. Relevant as it may interact with model deletions and has implications on how instances are managed during delete operations.""}, {""file"": ""django/core/cache/backends/db.py"", ""justification"": ""While not directly related, methods for delete operations in this file might provide insight into how deletions are managed in other contexts.""}, {""file"": ""django/db/models/fields/files.py"", ""justification"": ""Manage file fields that may involve PK updates, especially in the context of objects without dependencies.""}, {""file"": ""django/db/backends/mysql/schema.py"", ""justification"": ""Relates to schema-level operations which may interact with the primary key settings during deletion of entries from MySQL databases.""}, {""file"": ""django/db/models/fields/related_descriptors.py"", ""justification"": ""Manages relationships which can indirectly affect how deletes are processed based on dependencies.""}, {""file"": ""django/db/backends/postgresql/schema.py"", ""justification"": ""Pertains to specific handling for PostgreSQL, might uncover unique behavior of delete operations in this context.""}, {""file"": ""django/db/backends/sqlite3/schema.py"", ""justification"": ""Relevant for understanding how delete operations could differ between database types, contributing to mismanagement of PKs during deletions.""}]}",['django/db/models/deletion.py']
django__django-11019,"The bug report discusses a MediaOrderConflictWarning that arises when merging media files from Django forms, particularly when multiple widget classes define media dependencies that can lead to conflicts in the order of JS files. The primary focus is on the 'MyForm' class, which uses widgets that depend on 'text-editor.js', 'text-editor-extras.js', and 'color-picker.js'. The core issue seems to originate from how these media attributes are combined across different widget classes.","{""ranked_list"": [{""file"": ""django/forms/widgets.py"", ""justification"": ""This file defines the 'Widget' class, foundational for managing media in Django forms. The 'media' method is likely where the merging conflict occurs, thus directly relevant to the bug reported.""}, {""file"": ""django/forms/forms.py"", ""justification"": ""Contains the 'Form' class definition which implements the 'media' method that aggregates the media from all fields. It is central to understanding how media is composed in forms and may connect to the bug.""}, {""file"": ""django/contrib/admin/widgets.py"", ""justification"": ""This file manages widgets specifically for the Django admin interface, which may also involve compositional logic that could trigger the warning during media merging.""}, {""file"": ""django/forms/formsets.py"", ""justification"": ""While primarily dealing with formsets, it includes methods related to media aggregation that could influence how order conflicts could be encountered.""}, {""file"": ""django/contrib/admin/options.py"", ""justification"": ""Provides administrative functionalities and can interact with form media contexts. The 'media' method here can also play a role in media ordering.""}, {""file"": ""django/contrib/admin/helpers.py"", ""justification"": ""Supports admin features that may include form-rendering functionalities where media merging impacts can arise.""}, {""file"": ""django/contrib/gis/admin/options.py"", ""justification"": ""This file provides utilities for GIS models and admin functionalities, relevant if spatial data widgets are concerned.""}, {""file"": ""django/contrib/admin/forms.py"", ""justification"": ""Contains form definitions specific to the Django admin, including the potential influences on media order across widget usage.""}, {""file"": ""django/forms/fields.py"", ""justification"": ""Defines fields used in forms, crucial for understanding widget media interactions; relevant for how media files are constructed.""}, {""file"": ""django/forms/models.py"", ""justification"": ""Provides functionalities for model-based forms, contributing to form media management that could lead to warning issues.""}]}",['django/forms/widgets.py']
django__django-11049,"The bug report indicates that there is an issue with the error messaging format for the DurationField in Django. It specifies that the expected format for invalid input should clarify that seconds are mandatory, whereas minutes and hours are optional. The bug could reside in any part of the code responsible for handling DurationField validational and error messaging. Key areas of focus include the methods that handle, validate or present data for the DurationField and its error messaging. Keywords here are ""DurationField"", ""error message"", ""validate"", ""clean"", which are essential in guiding the subsequent file and method analysis.","{""ranked_list"": [{""file"": ""django/forms/fields.py"", ""justification"": ""This file contains the definition of form fields, specifically the 'to_python', 'validate', and 'clean' methods which are critical in translating, validating, and cleaning input data from forms. It is directly related to how user inputs for the duration field are processed.""}, {""file"": ""django/utils/duration.py"", ""justification"": ""This file defines utility functions for handling durations, including duration_string and duration_iso_string. These methods are relevant as they might interact with how duration data is formatted and presented, directly affecting the error messaging.""}, {""file"": ""django/db/models/fields/__init__.py"", ""justification"": ""This file defines the base for model fields, including the DurationField. The methods 'validate' and 'clean' are vital for ensuring that the DurationField works properly and generates the correct error messages, thus linking it to the reported bug.""}, {""file"": ""django/db/models/fields/related.py"", ""justification"": ""This file might contain relevant operations for related fields, which sometimes relate to forms and may have implications on how data is linked, influencing the validation of fields like DurationField.""}, {""file"": ""django/core/exceptions.py"", ""justification"": ""This file includes the definitions for various exceptions that may be raised during validation. Analyzing this will help in understanding if the right exceptions are raised for DurationField errors which might be part of the problem.""}, {""file"": ""django/core/management/__init__.py"", ""justification"": ""Methods here may handle commands related to field management which could indirectly involve data integrity checks linked to DurationFields.""}, {""file"": ""django/db/migrations/operations/fields.py"", ""justification"": ""Examining field operations in database migrations might shed light on how the DurationField is treated during schema changes, which can provide context regarding issue propagation.""}, {""file"": ""django/utils/dateformat.py"", ""justification"": ""This file contains utilities that could impact how dates and times are formatted, potentially affecting error messages around datetime fields including DurationField.""}, {""file"": ""django/contrib/admin/helpers.py"", ""justification"": ""Functions in this file are used for admin operations which may relate to how fields are shown and validated in the admin UI, influencing the user's perception of error messages.""}, {""file"": ""django/contrib/humanize/templatetags/humanize.py"", ""justification"": ""This file contains logic that might influence how durations are presented in templates, indirectly affecting user interface messaging.""}]}",['django/db/models/fields/__init__.py']
django__django-11099,"The bug report highlights an issue with the UsernameValidator allowing trailing newlines in usernames due to the use of the regex pattern '^[\w.@+-]+$'. The report suggests that this behavior can be mitigated by using an alternate pattern, '\A[\w.@+-]+\Z'. The affected classes are likely to be ASCIIUsernameValidator and UnicodeUsernameValidator, both of which are part of Django's authentication backend. The relevant keywords extracted from the report include 'UsernameValidator', 'trailing newline', 'regex', 'ASCII', 'Unicode', and 'validators'. The two classes mentioned are likely to correspond to methods within the 'django/contrib/auth/validators.py' file or similar validator files. The analysis of related class and methods should focus on files within the Django authentication framework that deal with username validation and regex processing.","{""ranked_list"": [{""file"": ""django/contrib/postgres/validators.py"", ""justification"": ""This file is expected to contain the implementation of the relevant username validators and potentially houses the logic that processes the regex patterns impacting username validation. It likely involves the problematic regex that allows trailing newlines.""}, {""file"": ""django/core/validators.py"", ""justification"": ""This file contains core validation logic, including regex handling through various methods. It may contain foundational components used by the UsernameValidator classes.""}, {""file"": ""django/contrib/auth/models.py"", ""justification"": ""This file may manage user-related functions, such as user creation and validation, which can indirectly relate to username handling and validation.""}, {""file"": ""django/contrib/auth/forms.py"", ""justification"": ""Forms likely implement the user input and validation mechanisms. Changes in validation may reflect here if usernames are being processed through forms.""}, {""file"": ""django/contrib/auth/password_validation.py"", ""justification"": ""While primarily focused on password validation, this file is part of the same authentication ecosystem and may include interdependencies or relevant validation rules.""}, {""file"": ""django/contrib/auth/admin.py"", ""justification"": ""This file handles admin interface operations for user management, which may involve username validations when creating or editing user records.""}, {""file"": ""django/contrib/auth/backends.py"", ""justification"": ""This file is part of the authentication process. Any changes related to username validation might indirectly affect backend operations.""}, {""file"": ""django/contrib/auth/checks.py"", ""justification"": ""As a checks file, it might identify issues with validation rules, including username validator checks.""}, {""file"": ""django/contrib/auth/views.py"", ""justification"": ""Views often handle user interaction, which may involve rendering forms or processing username input.""}]}",['django/contrib/auth/validators.py']
django__django-10914,"The bug report discusses issues with file upload permissions in Django, particularly related to the `FILE_UPLOAD_PERMISSION` setting and how file permissions vary depending on file types such as `MemoryUploadedFile` and `TemporaryUploadedFile`. The bug arises from the behavior of the built-in `tempfile` module, which sets file permissions based on environmental factors (e.g., operating system behavior). The report suggests a need for documentation enhancement regarding default permissions and warns about potential permission issues when files are uploaded without explicit settings. The keywords to focus on are 'FILE_UPLOAD_PERMISSION', 'MemoryUploadedFile', 'TemporaryUploadedFile', 'file permissions', and 'tempfile'. Any files involved in file storage, file handling, or file uploads may be affected.","{""ranked_list"": [{""file"": ""django/core/files/storage.py"", ""justification"": ""Contains methods that handle file saving and may implement permission settings (`file_permissions_mode`). This file is central to file storage in Django.""}, {""file"": ""django/core/files/uploadhandler.py"", ""justification"": ""This file deals with handling file uploads. Methods such as `new_file` and `file_complete` are relevant, as they might dictate the handling of uploaded file types that can influence permissions.""}, {""file"": ""django/core/files/uploadedfile.py"", ""justification"": ""Handles uploaded file objects, including `temporary_file_path`, which is important for understanding how uploaded files are structured and potentially how their permissions are set.""}, {""file"": ""django/core/files/temp.py"", ""justification"": ""Directly works with temporary files and may reference or utilize the `tempfile` module. The init method suggests connections to how temporary files are created, which might inform permission issues.""}, {""file"": ""django/core/files/base.py"", ""justification"": ""Implements foundational file handling functionality and includes methods related to file manipulation, providing context for any file permission configurations.""}]}",['django/conf/global_settings.py']
django__django-11133,"The bug report indicates that there is an issue with handling memoryview objects in Django's HttpResponse when retrieving BinaryField data from a PostgreSQL database. The problem manifests as an unexpected output: `b'<memory at 0x7fcc47ab2648>'` instead of the expected byte string. This points toward a bug in the handling of data types within HttpResponse, particularly around serialization or response content creation.","{""ranked_list"": [{""file"": ""django/http/response.py"", ""justification"": ""This file defines the HttpResponse class, which is central to the bug report. Its methods, such as `__init__`, `make_bytes`, `write`, and `flush`, handle incoming content, including types like bytes and memoryviews. Analyzing this file is crucial as it contains the logic for content serialization and could directly relate to the error described.""}, {""file"": ""django/db/backends/postgresql/base.py"", ""justification"": ""This file is responsible for the PostgreSQL database connection backend in Django. The handling of connections and the types of data returned from the database may directly affect how the data is serialized when constructing an HttpResponse. The method `get_new_connection` is particularly relevant as it sets up the connection to the database.""}, {""file"": ""django/contrib/postgres/fields/jsonb.py"", ""justification"": ""The JSONB field implementation might interact with how memoryview objects are converted or handled when retrieved from the database. The `to_python` and `validate` methods could reveal how the data is processed and might tie into the underlying issue.""}, {""file"": ""django/contrib/postgres/fields/array.py"", ""justification"": ""Similar to jsonb, the array field can interact with how data is interpreted when retrieved from PostgreSQL. The `get_db_prep_value` and `to_python` methods handle data transformation and could relate to how byte data or memoryviews are processed.""}, {""file"": ""django/contrib/postgres/forms/jsonb.py"", ""justification"": ""This file handles JSONB fields in forms, which may indirectly affect how data is serialized and can affect what HttpResponse will receive, relating to the memoryview issue.""}, {""file"": ""django/contrib/postgres/forms/array.py"", ""justification"": ""Similar logic applies as the jsonb forms, which handle array type fields and could discuss data returned that could be memoryviews.""}, {""file"": ""django/db/models/fields/files.py"", ""justification"": ""Might intersect with binary file handling in models, which can impact how data is structured when being sent in responses.""}, {""file"": ""django/utils/http.py"", ""justification"": ""Utility functions that may include helper methods for handling various data types in HTTP responses and could help clarify how Django manages atypical data types.""}, {""file"": ""django/core/handlers/base.py"", ""justification"": ""This file contains higher-level handling logic for requests and responses, which may help understand the context around HTTP response generation and the broader lifecycle affecting `HttpResponse` templating and processing.""}]}",['django/http/response.py']
