bug_id,bug_report_analysis,suspicious_files,fixed_files
django__django-15061,"The bug report indicates a need to remove the 'id_for_label' method usage from the MultiWidget class. The main focus is on the behavior of the 'id_for_label' method, where IDs generated are formatted with an index, leading to confusion and lack of clarity. Functionality mentioned includes how 'ChoiceWidget' uses 'add_id_index', which allows for a more customizable approach for label identifiers. Hence, any components or classes dealing with widgets and label identifiers, especially those that implement or extend functionalities of the 'id_for_label' method, will be pertinent for investigation.","{""ranked_list"": [{""file"": ""django/forms/widgets.py"", ""justification"": ""Contains the core 'id_for_label' methods that are directly referenced in the bug report. The methods handle ID generation with and without an index, key to understanding the problem.""}, {""file"": ""django/contrib/admin/widgets.py"", ""justification"": ""This file has its own implementation of 'id_for_label', which involves calling the parent's method. The presence of similar functionality suggests that fixing the MultiWidget class may also require changes here.""}, {""file"": ""django/forms/boundfield.py"", ""justification"": ""Implements the 'id_for_label' method in a different context which returns attributes, indicating relevance to how label IDs are managed in relation to forms.""}, {""file"": ""django/contrib/postgres/forms/array.py"", ""justification"": ""Contains its own version of 'id_for_label'. Though structurally different, it's important to analyze it for potential parallels or differences in ID generation behavior.""}, {""file"": ""django/contrib/admin/options.py"", ""justification"": ""May contain methods that relate to widget handling within the admin interface, which could be affected by changes in the 'id_for_label' implementations.""}, {""file"": ""django/contrib/admin/helpers.py"", ""justification"": ""Includes rules for admin-related functionalities and may have dependencies on how widgets are rendered or labeled.""}, {""file"": ""django/forms/fields.py"", ""justification"": ""Contains form field definitions that may call or use widgets involved with label ID generation\u2014a potential source of further investigation.""}, {""file"": ""django/forms/models.py"", ""justification"": ""Handles model forms which may interact with MultiWidget, thus influencing the labels involved with model forms.""}, {""file"": ""django/db/models/base.py"", ""justification"": ""Central to the database model implementations that forms relate to, which could affect how widgets and labels are populated.""}, {""file"": ""django/db/models/fields/related.py"", ""justification"": ""Contains fields that are related and could influence widget behavior in rendering and labeling, making it relevant in the context of the changes proposed.""}]}",['django/forms/widgets.py']
django__django-15202,"The bug report indicates that there is an error in the Django framework where a `ValueError` is raised instead of a `ValidationError` when `forms.URLField.clean()` is invoked with an input that does not represent a valid URL. The error traceback provides insight into the flow of execution leading to the error. It suggests that the validation process involve methods in the `django/forms/fields.py` file, specifically the `clean` method, where this error seems to originate. The `validators.py` file is also relevant because it likely contains validation rules that are not being applied correctly, potentially due to an issue in how input data is handled prior to validation. The keywords for analysis here include `URLField`, `clean`, `ValueError`, `ValidationError`, and `validators`.","{""ranked_list"": [{""file"": ""django/forms/fields.py"", ""justification"": ""Contains the 'clean' method relevant to URLField and is likely where the wrong exception type is being raised instead of ValidationError.""}, {""file"": ""django/core/validators.py"", ""justification"": ""This file contains validation methods including validate_ipv6_address, which may be directly related to the URL validation process.""}, {""file"": ""django/forms/forms.py"", ""justification"": ""Provides field-wide cleaning logic that might influence how 'clean' processes data across all fields, possibly catching URLField.""}, {""file"": ""django/contrib/auth/forms.py"", ""justification"": ""Contains 'clean' implementation which might have handling logic that, while not directly related, could affect validation flow in forms.""}, {""file"": ""django/contrib/flatpages/forms.py"", ""justification"": ""Has 'clean' method that might contribute to validation logic in more complex composite forms, providing insight into how unique URLs are handled.""}, {""file"": ""django/forms/models.py"", ""justification"": ""Relevant due to its cleaning process, which might be utilized in integrated form instances that handle URLs.""}, {""file"": ""django/forms/formsets.py"", ""justification"": ""While not directly mentioned in the crash, formsets can alter how individual forms operate, making it important in broader validation contexts.""}, {""file"": ""django/forms/utils.py"", ""justification"": ""Could contain utility functions that handle validation and normalization of form inputs, impacting the behavior of URL fields.""}, {""file"": ""django/utils/http.py"", ""justification"": ""May provide underlying HTTP utilities that interface with URL handling and validation potentially impacting the URLField behavior.""}, {""file"": ""django/utils/ipv6.py"", ""justification"": ""Directly relates to IPv6 validation which is critical as the error presents an invalid IPv6 URL demonstrating the importance of this validator.""}]}",['django/core/validators.py']
django__django-15347,"The bug report describes an issue with the Django messages framework where the 'extra_tags' parameter, when an empty string, gets incorrectly converted to None after serialization and deserialization. This happens because the MessageEncoder checks for the truthiness of 'extra_tags', which fails for an empty string (''), treating it as False. The bug is particularly impactful since it leads to unexpected behavior in templates relying on this parameter, could cause errors when checking message tags against empty strings. Key components referenced in the bug include the 'MessageEncoder' and 'MessageDecoder'. Potentially affected files include those related to message storage, encoding and the API for messaging.","{""ranked_list"": [{""file"": ""django/contrib/messages/storage/cookie.py"", ""justification"": ""The file contains 'MessageEncoder' and has the methods 'decode' and 'process_messages', which are directly involved in the serialization and deserialization processes described in the bug report. The method 'decode' interacts with how messages are processed, making it a likely candidate for the bug.""}, {""file"": ""django/contrib/messages/storage/base.py"", ""justification"": ""This file defines the 'Message' class including the '__init__' method that initializes 'extra_tags'. The method 'add' manages adding messages to storage and could be pivotal in how 'extra_tags' is handled. The presence of 'extra_tags=None' as an optional parameter suggests this file is critical to how empty tags are processed.""}, {""file"": ""django/contrib/messages/storage/fallback.py"", ""justification"": ""This file manages multiple storage backends and routines to store and retrieve messages. The methods '_get' and '_store' indicate how messages are processed across different storage systems, potentially impacting how empty strings are treated.""}, {""file"": ""django/contrib/messages/api.py"", ""justification"": ""The API layer interacts with the core message functionality and could be responsible for setting 'extra_tags' when messages are added. The 'add_message' method's signature indicates it uses 'extra_tags', making it relevant.""}]}",['django/contrib/messages/storage/cookie.py']
django__django-15252,"The bug report indicates an issue with the MigrationRecorder not adhering to the migration rules defined by the db_router's allow_migrate method. Specifically, the Router class is supposed to allow migrations only on the 'default' database. However, the current behavior causes migrations to be attempted on other database connections as well, leading to errors when the Migration model is not found. Key methods referenced in the report include allow_migrate(), record_applied(), ensure_schema(), and related behaviors of the MigrationRecorder class. The report emphasizes discrepancies in how migrations are supposed to be applied and recorded based on defined database routing rules, suggesting potential misimplementations or missing logic in these methods.","{""ranked_list"": [{""file"": ""django/db/migrations/recorder.py"", ""justification"": ""This file contains the MigrationRecorder class which includes critical methods such as record_applied and ensure_schema that directly relate to the bug. The ensure_schema method creates the Migration table if it doesn't exist, which is against the expected behavior when using a db_router.""}, {""file"": ""django/db/migrations/executor.py"", ""justification"": ""This file includes methods like apply_migration and migration_plan that are responsible for applying migrations. The bug report mentions issues with recording migrations, and this file directly manipulates migration states and interactions with the recorder.""}, {""file"": ""django/db/utils.py"", ""justification"": ""This file contains the allow_migrate method within a router context, which is vital to understanding how migrations are supposed to be routed. The bug report specifically cites the incorrect behavior regarding allowed migrations.""}, {""file"": ""django/db/migrations/loader.py"", ""justification"": ""The loader file manages the loading of migration data and may influence how migration records are interpreted against allowed migrations.""}]}",['django/db/migrations/executor.py']
django__django-15388,"The bug report details issues related to the Django development server failing to restart after making specific changes to the `settings.py` file. The crucial part of the report mentions adding the `BASE_DIR` variable to the `DIRS` list in the `TEMPLATES` setting. The symptoms include the development server not detecting file changes, leading to a need for manual restarts. Key components that could be affected include template loading and the server's autoreload feature. Keywords from the report include: 'dev server', 'restart', 'BASE_DIR', 'TEMPLATES', 'changes', 'settings.py', and 'autoreload'. This indicates a focus on file management, template handling, and server controls in the codebase.","{""ranked_list"": [{""file"": ""django/core/management/commands/runserver.py"", ""justification"": ""The `runserver.py` file contains the logic for running the Django development server. The method `run(self, **options)` is directly related to server operation, including managing autoreloading, which is central to the bug report.""}, {""file"": ""django/utils/autoreload.py"", ""justification"": ""This file deals with the autoreload functionality of Django, essential for detecting changes in files automatically. Methods such as `restart_with_reloader()` and `notify_file_changed(self, path)` are pivotal for correctly triggering server restarts when files change.""}, {""file"": ""django/template/engine.py"", ""justification"": ""The `get_template(self, template_name)` method here is responsible for locating and compiling templates. Since the bug involves adding a template directory based on `BASE_DIR`, this file's function could be critical in understanding templates' integration with the server.""}, {""file"": ""django/core/checks/templates.py"", ""justification"": ""The `check_setting_app_dirs_loaders(app_configs, **kwargs)` method in this file checks the configuration of template loaders and directories. It is relevant to the bug since misconfiguration in settings could lead to issues with templates that directly impact restarting behavior.""}, {""file"": ""django/core/management/commands/testserver.py"", ""justification"": ""Similar to `runserver.py`, `testserver.py` handles the operation of a Django server but in a testing context. The issue with autoreloading and manual restarts may require reviewing how tests interact with server operations.""}, {""file"": ""django/contrib/staticfiles/utils.py"", ""justification"": ""This file includes utility functions for static file management which can have indirect effects on how templates are rendered and may influence server behavior on file changes.""}, {""file"": ""django/template/autoreload.py"", ""justification"": ""This method watches for changes in template directories and can affect server autoreloading based on template modifications.""}, {""file"": ""django/core/management/__init__.py"", ""justification"": ""This core management file is central to Django's command structure, including how commands such as `runserver` are executed, which is relevant to understanding the server's operations.""}, {""file"": ""django/core/management/commands/diffsettings.py"", ""justification"": ""This file deals with comparing settings, which might help in diagnosing the differences caused by the changes made in `settings.py` that prompted the bug.""}, {""file"": ""django/db/backends/base/base.py"", ""justification"": ""While not directly implicated, understanding how database connections are managed may shed light on unexpected behavior related to server restarts in a web application context.""}]}",['django/template/autoreload.py']
django__django-15400,"The bug report highlights that `SimpleLazyObject` from Django does not implement the `__radd__` magic method, which is causing an issue. The report discusses how a complete proxy implementation, analogous to `wrapt.ObjectProxy`, would require various magical methods including `__radd__`. The author mentions the specific implementation details and the need to ensure `_wrapped` is initialized before attempting operations. The goal is to localize the problem to ensure correct functionality when trying to perform addition with `SimpleLazyObject`. Key terms from the report include `__radd__`, `new_method_proxy`, and the context of proxies and lazy loading. Specific details about the implementation of `__radd__` and `new_method_proxy` are provided, pointing towards the need to examine those functions in relevant files.","{""ranked_list"": [{""file"": ""django/utils/functional.py"", ""justification"": ""Contains the `new_method_proxy` function which is relevant to the implementation of proxy methods, including `__radd__`. The presence of the method `__radd__` that returns `other + self.__cast()` implies it is designed for handling addition which aligns with the bug report.""}, {""file"": ""django/db/models/base.py"", ""justification"": ""While this file's methods do not directly relate to `__radd__`, it may interact with various model proxies. Understanding its implementation can provide insight into how models manage addition operations through proxies.""}, {""file"": ""django/contrib/gis/db/models/proxy.py"", ""justification"": ""This file defines proxy behavior and may contain functionalities relevant to lazy loading and magic methods that could relate to the needed `__radd__` implementation.""}, {""file"": ""django/db/models/fields/proxy.py"", ""justification"": ""This file might provide information on how field proxies interact with models and how they could be extended to include necessary magic methods including addition.""}, {""file"": ""django/utils/decorators.py"", ""justification"": ""Although not directly related to `__radd__`, it may contain decorator logic that could be necessary for function proxies in general.""}, {""file"": ""django/core/handlers/base.py"", ""justification"": ""This file is responsible for handling requests and middleware which can play a role in the overall pipeline, indirectly affecting how objects, including lazy objects, are instantiated and managed.""}, {""file"": ""django/db/models/query.py"", ""justification"": ""Query methods defined here could relate to how lazy objects are computed and hence, indirectly affect operations like addition.""}, {""file"": ""django/db/models/manager.py"", ""justification"": ""This file could contain methods responsible for managing database queries which may tie into how proxies are resolved.""}, {""file"": ""django/utils/deconstruct.py"", ""justification"": ""Understanding how objects are deconstructed may provide insights into the behavior when adding lazy objects to others.""}, {""file"": ""django/contrib/gis/measure.py"", ""justification"": ""As it relates to GIS functionalities, it may contain relevant operations or integrations that depend on proxy objects.""}]}",['django/utils/functional.py']
django__django-15738,"The bug report discusses issues with Django model migrations related to changing a foreign key to a many-to-many relationship and the complications arising from unique constraints. Keywords from the report include 'models', 'migration', 'foreign key', 'many to many', 'unique together', 'migrations', and 'ValueError'. The reported error indicates a mismatch in the number of constraints during migrations, specifically related to the unique constraints on the fields. Key components affected include the 'Authors', 'ProjectDataSet', and migration files where these models and their relationships are defined. The report also hints at modifying the existing models and generating new migrations, which is a crucial part of ensuring data integrity and compliance with Django's ORM principles.","{""ranked_list"": [{""file"": ""django/db/models/base.py"", ""justification"": ""Contains methods like validate_unique and full_clean essential for handling unique constraints and validating model data, which are directly related to the issues raised during migrations.""}, {""file"": ""django/db/migrations/operations/models.py"", ""justification"": ""Handles the logic for applying model changes in migrations, particularly in database_forwards and database_backwards, critical for understanding how changes are processed.""}, {""file"": ""django/db/migrations/operations/fields.py"", ""justification"": ""Manages field operations in migrations, which includes inspecting and updating fields as described in the bug report regarding foreign keys and many-to-many conversions.""}, {""file"": ""django/db/migrations/migration.py"", ""justification"": ""Central to the structure of migrations, this file's methods deal with how migrations are created and applied, providing context for the error arising during migration processes.""}, {""file"": ""django/db/models/constraints.py"", ""justification"": ""Defines mechanisms for checking and enforcing constraints in the database. Affected by the unique_together configuration discussed in the bug report.""}, {""file"": ""django/db/models/options.py"", ""justification"": ""Interacts with the model's Meta options and constraints like unique_together, which is fundamental to the reported constraints error during migration.""}, {""file"": ""django/db/models/fields/related.py"", ""justification"": ""Manages related fields, including many-to-many and foreign key operations, crucial for properly setting relationships as described in the migration process.""}, {""file"": ""django/db/backends/base/schema.py"", ""justification"": ""Framework for database schema alterations, this file's methods may directly interact with the statements generated by models, influencing migration outcomes.""}, {""file"": ""django/core/management/commands/migrate.py"", ""justification"": ""Directly involved in executing migration commands which are the source of the reported errors. Understanding this file helps localize the issue in the migration workflow.""}, {""file"": ""django/db/migrations/autodetector.py"", ""justification"": ""Assists in detecting changes in models and creating migrations based on those changes, closely tied to the actions described in the bug report.""}]}",['django/db/migrations/autodetector.py']
django__django-15498,"The bug report focuses on changing the handling of the If-Modified-Since header within a web framework context, specifically where an empty string was previously ignored but is now raising exceptions. This suggests there are functionalities deeply tied to HTTP request and response handling, potentially in middleware or utility classes responsible for caching or header management. Keywords include 'If-Modified-Since', 'header', 'exception', and 'empty string'.","{""ranked_list"": [{""file"": ""django/views/static.py"", ""justification"": ""This file contains a method named 'serve' that directly handles static file serving, which involves the If-Modified-Since logic to determine if the file has been modified. This is core to the bug reported about improper handling of the header.""}, {""file"": ""django/utils/cache.py"", ""justification"": ""Contains methods related to caching and cache control which are likely involved in managing conditional requests like If-Modified-Since. The method '_if_modified_since_passes' is crucial in validating the If-Modified-Since condition.""}, {""file"": ""django/http/response.py"", ""justification"": ""The 'set_cookie' and 'get' methods may not directly relate to If-Modified-Since but the response management is critical in web applications, especially in how headers are managed overall.""}, {""file"": ""django/http/request.py"", ""justification"": ""The headers method plays a role in retrieving HTTP headers including If-Modified-Since, which is critical to request handling.""}, {""file"": ""django/http/multipartparser.py"", ""justification"": ""Manages parsing of multipart HTTP bodies, which relates to requests that might include If-Modified-Since in a broader context. The parse method indicates how data is retrieved from requests.""}, {""file"": ""django/middleware/http.py"", ""justification"": ""Contains middleware that may handle requests and responses, particularly regarding needs for caching and headers, which could affect how If-Modified-Since is processed.""}, {""file"": ""django/middleware/common.py"", ""justification"": ""This middleware works with general processing of requests and responses; it could be involved in redirecting or altering how certain request methods are handled.""}, {""file"": ""django/contrib/sessions/backends/cache.py"", ""justification"": ""Since sessions often rely on headers and may interact with caching strategies, it may be linked indirectly to header handling.""}, {""file"": ""django/middleware/cache.py"", ""justification"": ""Directly handles cache mechanisms which can impact how conditional headers like If-Modified-Since are respected.""}]}",['django/views/static.py']
