bug_id,bug_report_analysis,suspicious_files,fixed_files
django__django-13757,"The bug report highlights an issue with the handling of null values in JSON fields when using isnull=True with KeyTransform in Django's ORM. The problem occurs specifically in SQLite and Oracle backends, where the query incorrectly matches objects having keys with null values, contrary to the expected behavior. It indicates that the filtering logic for isnull=True should only include objects that do not have the key at all and provides a test case that shows how the current implementation is failing. Keywords such as 'isnull', 'JSON', 'SQLite', 'Oracle', 'KeyTransform', and 'filter' are central to understanding this issue. The test case mentioned, located in 'tests.model_fields.test_jsonfield', is also relevant as it centers around how the fields are queried based on null conditions.","{""ranked_list"": [{""file"": ""django/db/models/sql/query.py"", ""justification"": ""This file contains the 'build_filter' method which is essential for building queries with conditions, including those involving isnull. Since the report discusses behavior when filtering with isnull, this file is highly relevant.""}, {""file"": ""django/db/models/lookups.py"", ""justification"": ""It contains 'get_db_prep_lookup' and 'get_prep_lookup' methods that likely handle how lookup conditions, including null checks, are prepared for database operations. This is crucial for diagnosing the problem with isnull checks.""}, {""file"": ""django/db/models/fields/json.py"", ""justification"": ""This file defines how JSON fields operate within Django's ORM, including transformations related to these fields. It may include logic that interacts with isnull checks and affects JSON filter behavior.""}, {""file"": ""django/db/models/query.py"", ""justification"": ""This is the primary query construction file and includes methods that manipulate querysets, including applying filters which are directly affected by the handling of isnull=True.""}, {""file"": ""django/contrib/gis/db/models/lookups.py"", ""justification"": ""Though especially relevant for geospatial lookups, it shares methods for managing database prep logic which might have similarities to the JSON logic, particularly how lookups are prepared.""}, {""file"": ""django/db/models/fields/__init__.py"", ""justification"": ""This file is the umbrella for field types in Django, including potential interactions with JSON fields and their corresponding lookups. It's foundational for understanding any field-related issues.""}, {""file"": ""django/db/backends/sqlite3/features.py"", ""justification"": ""SQLite is one of the specific databases mentioned in the report that exhibits buggy behavior with JSON null comparisons. This file could explain database feature support regarding JSON fields.""}, {""file"": ""django/db/backends/oracle/features.py"", ""justification"": ""Similar to the SQLite file, this addresses Oracle-specific behaviors, which is relevant since the report indicates that Oracle also matches null values incorrectly.""}, {""file"": ""django/db/backends/mysql/features.py"", ""justification"": ""Although MySQL works as intended, a thorough understanding of how isnull behaves in this backend could provide insights into why SQLite and Oracle are problematic.""}, {""file"": ""django/db/models/query_utils.py"", ""justification"": ""Contains utilities for managing complex queries; if transforms involve isnull logic, it might shed light on related issues impacting how queries are run or constructed.""}]}",['django/db/models/fields/json.py']
django__django-13925,"The bug report suggests issues with Django's handling of primary keys in models when using the alpha version of Django 3.2. The warnings indicate that models which should inherit primary keys from parent models instead utilize an auto-created primary key of type 'django.db.models.AutoField'. This occurred in several models (e.g., accounts.ReservedUsername, accounts.User, blocks.Block, etc.). The report implies that the Django code responsible for migrations, specifically associated with primary key handling (like `DEFAULT_AUTO_FIELD` settings), might be buggy in this alpha version.","{""ranked_list"": [{""file"": ""django/core/checks/model_checks.py"", ""justification"": ""This file contains the `check_all_models` method, which validates model configurations. The bug report is about issues with model inheritance and primary key inheritance; hence, this file's code checks for model errors including those related to auto-generated primary keys.""}, {""file"": ""django/db/migrations/operations/models.py"", ""justification"": ""The `models.py` file deals with operations relating to models and their fields. Its responsibilities include initializing model definitions which aligns with the bug report's concern over how primary key fields are being auto-created when they shouldn't be.""}, {""file"": ""django/db/migrations/autodetector.py"", ""justification"": ""This file is responsible for detecting changes in models and generating migrations accordingly. Issues with primary key inheritance would likely manifest during migrations, thus any bugs related to this functionality would be captured in this file.""}, {""file"": ""django/apps/config.py"", ""justification"": ""The `default_auto_field` method in this file returns the default setting for auto fields, which is central to the issues mentioned in the bug report regarding primary key configuration. Understanding its behavior can help diagnose the underlying problem.""}, {""file"": ""django/db/models/fields/__init__.py"", ""justification"": ""This file contains definitions for fields, including primary keys. Issues in primary key generation are likely tracked or influenced here as the field types are established and validated.""}, {""file"": ""django/db/models/options.py"", ""justification"": ""This file includes options for models which can contain configurations for fields, including primary key-related options. It's relevant to understand how options set on models might affect inherited fields.""}, {""file"": ""django/core/management/commands/inspectdb.py"", ""justification"": ""This file has commands related to inspecting the database schema that could be affected by the way primary keys are handled in inherited models.""}, {""file"": ""django/db/migrations/state.py"", ""justification"": ""It tracks the state of models during migrations. Any faults in how primary keys are inherited would have implications for migration state.""}, {""file"": ""django/db/backends/base/schema.py"", ""justification"": ""Schema generation and alterations for models are done here; any bugs relating to primary key handling might pop up during schema generation.""}, {""file"": ""django/db/models/query.py"", ""justification"": ""Although less directly related, any issues that arise from querying models due to mismanaged primary keys during inheritance could be impacted by this file.""}]}",['django/db/models/base.py']
django__django-13933,"The bug report discusses an issue with ModelChoiceField not returning the value of an invalid choice when raising a ValidationError. It compares ModelChoiceField with other field types such as ChoiceField, indicating that a similar handling mechanism should be applied to the ModelChoiceField. The additional details suggest modifying the existing error messages to correctly include the invalid choices value. Keywords extracted from the report include 'ModelChoiceField', 'ValidationError', 'invalid choice', and 'error message'. These point to classes and methods related to form fields in a Django-like context, specifically fields that validate input choices against a set of model options. Based on the analysis, affected components appear to be the ModelChoiceField and its parent/related classes, as changes in handling validation errors could directly affect how user input is processed during form submissions.","{""ranked_list"": [{""file"": ""django/forms/models.py"", ""justification"": ""Contains the ModelChoiceField definition and is essential since the issue pertains specifically to this field type. The presence of methods like 'formfield' and 'clean' implies potential validation paths that could be influenced by changes.""}, {""file"": ""django/forms/fields.py"", ""justification"": ""Holds general field-related functionality and the 'clean' method, which is crucial for validation. This is directly relevant as it might process and validate the ModelChoiceField's input values.""}, {""file"": ""django/db/models/fields/__init__.py"", ""justification"": ""Includes foundational field classes in Django, like the base Field class. Critical for understanding how validation operates globally across field types, impacting ModelChoiceField's functionality.""}, {""file"": ""django/db/models/fields/related.py"", ""justification"": ""Manages relationships between models and contains validation logic that could directly influence how ModelChoiceField handles invalid selections.""}, {""file"": ""django/core/exceptions.py"", ""justification"": ""Defines the ValidationError that is raised in the scenario described in the bug report. Relevant for understanding how errors related to invalid choices are constructed and raised.""}, {""file"": ""django/forms/boundfield.py"", ""justification"": ""Handles the binding of form fields, likely to influence how data from submitted forms is processed, especially regarding validation and errors.""}, {""file"": ""django/db/models/fields/related_descriptors.py"", ""justification"": ""May include methods crucial for the validation of fields with relationships, potentially impacting how choices are validated in ModelChoiceField.""}, {""file"": ""django/db/models/options.py"", ""justification"": ""Contains metadata about models that could include choice configurations, indirectly relevant for understanding how invalid recommendations are made.""}, {""file"": ""django/contrib/admin/forms.py"", ""justification"": ""Contains admin forms related handling, which might utilize ModelChoiceField configurations. Their validation setup may highlight further implications of the reported issue.""}, {""file"": ""django/db/models/fields/json.py"", ""justification"": ""While not directly related, holds advanced field functionalities that may intersect with ModelChoiceField behaviors in complex queries or input validations.""}]}",['django/forms/models.py']
django__django-14016,"The bug report highlights a TypeError that occurs when trying to apply the '|' operator to a Q object with a non-pickleable type (dict_keys). The user expects the use of dict_keys to work within the Q object but encounters a TypeError instead. Keywords and components of interest include: 'Q object', 'TypeError', 'pickle', 'dict_keys', and usage of the '|' operator.","{""ranked_list"": [{""file"": ""django/db/models/query.py"", ""justification"": ""Contains methods '__or__' and 'filter', which are crucial for handling operations involving Q objects and QuerySets. The '__or__' method details how the '|' operator is implemented, making it directly relevant to the bug's context.""}, {""file"": ""django/db/models/query_utils.py"", ""justification"": ""Defines the '__or__' and '__and__' methods used in Query operations. Since the bug involves the Q object and the '|' operator, understanding how this utility interacts with Q is essential.""}, {""file"": ""django/db/models/expressions.py"", ""justification"": ""Includes the '__or__' method, which is relevant to how expressions within Q objects are combined using logical operators. This aligns with the reported 'TypeError' in using Q with keys.""}]}",['django/db/models/query_utils.py']
django__django-13660,"The bug report describes a crash when Python commands are executed via the Django shell with the -c option, specifically relating to failing `exec()` calls. Keywords extracted from the report include 'crash', 'exec', 'django', 'command', 'management', and 'options'. The crash occurs when the command being executed lacks a defined context for globals, indicating a possible problem with how `exec` is called in the application. Affected components most likely involve Django's management commands, particularly the command responsible for executing shell commands. Additionally, the report suggests the bug might recur regardless of the Python version, as it references consistent functionality in both Python 3.7 and 3.8.","{""ranked_list"": [{""file"": ""django/core/management/commands/shell.py"", ""justification"": ""Directly implements the `handle` method that uses `exec` to run commands passed through options. This method is at the core of the reported issue with incorrect context for `exec`.""}, {""file"": ""django/core/management/commands/check.py"", ""justification"": ""This command checks for errors in application configurations and may be relevant due to its usage of options, which could relate to the improper handling of shell command executions.""}, {""file"": ""django/core/management/commands/migrate.py"", ""justification"": ""Manages and applies database migrations. This file could potentially exhibit issues with command execution and the use of `exec`, though primarily focused on database operations.""}, {""file"": ""django/core/management/commands/makemigrations.py"", ""justification"": ""Handles the creation of new migrations based on model changes. Its management of command options might overlap with the underlying issues in command execution.""}, {""file"": ""django/core/management/commands/squashmigrations.py"", ""justification"": ""Concerned with merging multiple migrations into one. The handling of command options here might reveal similar command execution problems.""}, {""file"": ""django/core/management/commands/test.py"", ""justification"": ""Involved in running tests and may utilize similar command execution logic that could be implicated in the bug.""}, {""file"": ""django/core/management/commands/flush.py"", ""justification"": ""Flushes the database and handles options related to command interactions. Relevant for understanding how commands are processed.""}, {""file"": ""django/core/management/commands/inspectdb.py"", ""justification"": ""Generates model code based on database schema, which means it may interact with the command handling processes involved in the bug.""}, {""file"": ""django/core/management/commands/runserver.py"", ""justification"": ""Starts Django's development server and manages various command line options, which can relate closely to how commands are executed.""}, {""file"": ""django/core/management/commands/dumpdata.py"", ""justification"": ""Handles the command for dumping data from the database, again involving command options which could help surface issues related to how commands are executed.""}]}",['django/core/management/commands/shell.py']
django__django-14155,"The bug report identifies that `ResolverMatch.__repr__()` does not handle `functools.partial()` objects properly when generating string representations. It suggests that the `__repr__` method should be updated to unwrap `functools.partial()` objects, which would involve looking at the parameters being passed and ensuring that the output reflects the underlying function and parameters instead of simply displaying `functools.partial`. Additionally, it mentions that adjustments might be made in the `__init__()` method of `ResolverMatch`. The keywords to focus on are: `__repr__`, `functools.partial`, `unwrap`, `ResolverMatch`, and potentially the `__init__()` method.","{""ranked_list"": [{""file"": ""django/urls/resolvers.py"", ""justification"": ""Contains the method `__repr__()` which is cited in the bug report. Analysis shows that it constructs its representation from attributes like `urlconf_name`, `namespace`, and `pattern`, aligning with the bug's context involving representation of complex objects.""}, {""file"": ""django/utils/functional.py"", ""justification"": ""Contains the method `__repr__()` which may involve similar logic as `ResolverMatch.__repr__()`. Its implementation handles an internal `_wrapped` state, suggesting it could relate to how partial functions are represented.""}, {""file"": ""django/db/models/base.py"", ""justification"": ""Implements `__repr__()` which generates a simple representation from the model instance. Understanding its method can provide context on how Django represents objects, hinting on how to unwrap complex function representations.""}, {""file"": ""django/forms/forms.py"", ""justification"": ""Also includes `__repr__()`, providing insights on handling errors and bound states, which can relate to how additional context might be added for complex objects like those from `functools.partial()`.""}, {""file"": ""django/db/models/fields/related.py"", ""justification"": ""While not directly related, it might provide insights into how Django handles relationships, which can inform how objects are constructed and represented, particularly in complex scenarios.""}, {""file"": ""django/utils/deconstruct.py"", ""justification"": ""Includes mechanisms for deconstructing instances, which is crucial in modifying representations for functions that may not directly offer their arguments for display.""}, {""file"": ""django/core/management/commands/makemessages.py"", ""justification"": ""While its relation is less direct, it may involve handling of function representations in related functionalities that could be tied to the bug context.""}, {""file"": ""django/test/client.py"", ""justification"": ""Involves representation of client responses and interaction, which may yield insights on managing representation formats of various entities.""}, {""file"": ""django/db/models/expressions.py"", ""justification"": ""Implies handling expressions which carry parameters, thus may help understand how to manage the representation of functions with pre-bound arguments.""}, {""file"": ""django/contrib/auth/models.py"", ""justification"": ""To examine potential user-related representation aspects that may bear similarities to function-based representations.""}]}",['django/urls/resolvers.py']
django__django-13964,"The bug report indicates a data loss issue related to saving an object with a foreign key (a situation in Django ORM). The primary problem arises when an unsaved child (Order) entity points to a parent (Product) entity that does not yet have a defined primary key. When this unsaved child instance is saved, the parent object can lose its association with the child, causing issues in data integrity. This suggests that the methods involved in saving models and handling their relationships need to be analyzed in depth.","{""ranked_list"": [{""file"": ""django/db/models/base.py"", ""justification"": ""Contains the 'save' method, which is critical for understanding how instances are persisted to the database and how relationships are managed during the save operation.""}, {""file"": ""django/db/models/fields/related.py"", ""justification"": ""Includes methods for handling foreign key relationships. Notably, 'get_foreign_related_value' and 'formfield', which could impact how related fields are processed and might tie into the logic leading to data loss.""}, {""file"": ""django/db/models/query.py"", ""justification"": ""Houses the 'create' and 'bulk_create' methods, which tie directly to how instances of models are created and saved, including aspects of validation that might fail in this scenario.""}, {""file"": ""django/db/migrations/operations/models.py"", ""justification"": ""While it had issues retrieving specific methods, this file is related to model creation and alteration operations, essential for understanding how changes to models are handled in migrations.""}, {""file"": ""django/contrib/admin/models.py"", ""justification"": ""The 'log_action' and 'get_change_message' methods can provide insight into how model changes are logged and validated in the admin interface, potentially relevant if the data loss is being tracked or logged.""}]}",['django/db/models/base.py']
django__django-14017,"The bug report indicates that combining the `Q()` object with the `Exists(...)` function raises a `TypeError`, specifically during the call to the `__and__` method, which suggests there is a type mismatch when combining these two expressions. The description mentions that the operators should be commutative, hinting at a potential issue in the `__and__` or `_combine` methods of the `django/db/models/query_utils.py` file that handle this logic. The use of `Exists(...)` indicates that the bug is likely also related to a database query or filtering operation, particularly within the Django ORM context. The keywords focused on include `TypeError`, `Q(...)`, `Exists(...)`, and the operations `__and__` and `_combine`.","{""ranked_list"": [{""file"": ""django/db/models/query_utils.py"", ""justification"": ""This file contains the implementations of the Q object's logical operations. The presence of `__and__` and `_combine` methods directly relates to how `Q()` combines with other expressions, and given the TypeError occurs during this operation, this file is highly relevant.""}, {""file"": ""django/db/models/expressions.py"", ""justification"": ""Houses the implementation of expression logic, including the `__rand__` method which is used in conjunction with combinations of expressions like Q and Exists. Relevant to the TypeError when combining these expressions.""}, {""file"": ""django/db/models/query.py"", ""justification"": ""Contains logic for combining querysets and filtering where the `__and__` operator is applied, making it relevant to the handling of Q and Exists operations leading up to the TypeError.""}, {""file"": ""django/db/models/sql/query.py"", ""justification"": ""Manages SQL query construction, including the `exists()` method, which is central to the behavior when working with Exists expressions. Important for understanding what may be going wrong during the execution.""}, {""file"": ""django/contrib/postgres/search.py"", ""justification"": ""Contains methods that define how search queries can be logically combined. While not direct, it provides context on combining functionality which could impact the current logic.""}, {""file"": ""django/contrib/gis/geos/geometry.py"", ""justification"": ""Although specifically related to geometric operations, its `__and__` method showcases the expected behavior for the intersection of operations, offering insight on how combination operations might be expected to behave.""}, {""file"": ""django/contrib/gis/gdal/geometries.py"", ""justification"": ""Similar to the geos module, it contains a `__and__` method providing a reference for expected behavior in geometric intersections, which can shed light on expectations for combining logic.""}, {""file"": ""django/db/models/sql/compiler.py"", ""justification"": ""Responsible for compiling SQL queries and may also be involved in how ORM functionality translates to SQL, particularly with complex queries combining Q and Exists which might relate indirectly to the issue.""}, {""file"": ""django/db/models/constraints.py"", ""justification"": ""While focused on database constraints, understanding what constraints might apply in query combinations can be helpful in diagnosing the underlying issues leading to a TypeError.""}, {""file"": ""django/db/models/fields/related.py"", ""justification"": ""Could contain relevant handling of related object queries that may be affected when logical combinations are attempted. Offers broader context of field behavior affecting the original issue.""}]}",['django/db/models/query_utils.py']
