bug_id,bug_report_analysis,suspicious_files,fixed_files
sympy__sympy-13773,"The bug report highlights an issue with the matrix multiplication operator `@` (implemented via the `__matmul__` method) allowing non-matrix operands. The expected behavior is that it should raise an error if one operand is not a matrix. Specifically, error messages and examples show that multiplying a scalar with a matrix using `@` should fail, similar to behavior in NumPy. This indicates that the logic within the overridden `__matmul__` method may not properly validate the types of its operands, failing to check if they conform to matrix requirements before proceeding with an operation that expects matrices.","{""ranked_list"": [{""file"": ""sympy/matrices/expressions/matexpr.py"", ""justification"": ""Contains the `__matmul__` method which needs to enforce matrix-type validation. Analysis indicates that this function currently calls `MatMul(self, other).doit()`, but does not enforce any checks for the types of its arguments.""}, {""file"": ""sympy/matrices/common.py"", ""justification"": ""Implements a `__matmul__` that directly references the `__mul__` method, which implies that it potentially inherits the same issue, allowing for non-matrix operands. Essential for understanding why non-matrix operations are succeeding.""}, {""file"": ""sympy/matrices/expressions/matmul.py"", ""justification"": ""Implements logic for matrix multiplication in MatMul definition, including checks on matrix shapes in `validate()`, crucial for defining what constitutes valid multiplication.""}, {""file"": ""sympy/matrices/expressions/tests/test_matmul.py"", ""justification"": ""Contains unit tests for various matrix multiplication cases which likely include scenarios for matrix and non-matrix operands, essential for validating fixes to `@` behavior.""}, {""file"": ""sympy/matrices/tests/test_commonmatrix.py"", ""justification"": ""Tests various matrix operations and properties; can provide context to see how matrices interact in operations involving `@`.""}, {""file"": ""sympy/matrices/tests/test_densearith.py"", ""justification"": ""Tests arithmetic operations including multiplication which may reveal if `@` operations yield the wrong results.""}, {""file"": ""sympy/matrices/matrices.py"", ""justification"": ""General matrix implementation; understanding its structure is crucial for identifying where type violations may originate.""}, {""file"": ""sympy/core/tests/test_arit.py"", ""justification"": ""May contain tests that indirectly engage the `__matmul__` method through other operations, helping to identify the extent of the issue.""}, {""file"": ""sympy/core/tests/test_noncommutative.py"", ""justification"": ""Could provide tests related to non-commutative operations which overlap with matrix multiplication, identifying misbehavior in handling types.""}]}",['sympy/matrices/common.py']
sympy__sympy-13971,"The bug report involves a display issue with the `SeqFormula` method from the Sympy library. Keywords include 'SeqFormula', 'backslash-escapes', 'square brackets', 'Jupyter rendering', and rendering issues with Markdown. The problem described shows that the generated LaTeX code introduces unnecessary backslashes before square brackets, which hinder rendering of the output. The outputs that are expected and what is rendered are clearly outlined in the report, indicating a relationship with how sequences are generated and displayed in LaTeX format, specifically in the context of how nested sequences are formatted.","{""ranked_list"": [{""file"": ""sympy/printing/latex.py"", ""justification"": ""The file contains method `_print_SeqFormula(self, s)` implementing LaTeX formatting for sequences. The analysis shows it generates escaped brackets which is directly tied to the bug report, explaining the bug of incorrect display of sequences.""}, {""file"": ""sympy/printing/pretty/pretty.py"", ""justification"": ""Includes `_print_SeqFormula(self, s)` which handles sequence formatting and may show similar behavior, affecting how sequences are displayed in pretty print, relevant to the rendering issues described in the bug report.""}, {""file"": ""sympy/series/sequences.py"", ""justification"": ""Contains `__new__(cls, formula, limits=None)` which processes sequence formulas and is essential to the instantiation of `SeqFormula`. The logic here could influence how sequences are constructed and formatted, hence affecting the output.""}, {""file"": ""sympy/printing/tests/test_latex.py"", ""justification"": ""This file tests LaTeX rendering including sequence outputs. The method `test_latex_sequences()` directly tests outputs related to `SeqFormula`, providing evidence linked to the bug report.""}, {""file"": ""sympy/printing/pretty/tests/test_pretty.py"", ""justification"": ""Tests pretty printing, including sequences. The method `test_pretty_seq()` could provide insights into discrepancies in output formatting related to the bug report.""}, {""file"": ""sympy/series/formal.py"", ""justification"": ""Might include handling of sequences that also influence how `SeqFormula` behaves. Involves sequence manipulations that could link to rendering issues.""}, {""file"": ""sympy/printing/tests/test_repr.py"", ""justification"": ""Includes tests which may verify various representations including sequences which could unveil problems linked with incorrect escaping in the output.""}, {""file"": ""sympy/printing/pycode.py"", ""justification"": ""Contains printing methods that might impact how sequences are transpiled into other formats, potentially influencing the rendering issues in the reported case.""}, {""file"": ""sympy/printing/pretty/tests/test_pretty.py"", ""justification"": ""Has tests that validate pretty-printing of various entities, including sequences, relevant for verifying proper formatting and output issues.""}]}",['sympy/printing/latex.py']
sympy__sympy-13895,"The bug report focuses on the incorrect output from the simplification of the expression (-x/4 - S(1)/12)**x - 1, when using the `simplify()` function from the Sympy library. Key points extracted from the bug report include:+ The original expression is (-x/4 - S(1)/12)**x - 1, which is not simplifying correctly as expected. The simplification of the expression returns an inequivalent expression. + The values substituted for `x` also yield discrepancies in the output, such as different complex parts produced. + The method `simplify()` and its related approaches and options are crucial for the reported issues, which involve algebraic manipulations of symbolic expressions. The parameters for simplification like `ratio`, `measure`, and `rational` might affect the behavior of the simplification process.","{""ranked_list"": [{""file"": ""sympy/simplify/simplify.py"", ""justification"": ""This file contains the main implementation of the `simplify()` function, which is central to the bug report. The method's body includes heuristics and mechanisms for simplifying expressions, including algebraic strategies that could be relevant to addressing the reported issue.""}, {""file"": ""sympy/simplify/tests/test_simplify.py"", ""justification"": ""This file includes test cases for the `simplify()` function, including tests that cover various simplifications. The presence of unit tests indicates that this file is likely valuable in reproducing and investigating the bug, as current behavior can be tested against expected outputs.""}, {""file"": ""sympy/simplify/hyperexpand.py"", ""justification"": ""This file works on hypergeometric expansions, which may play a role in the underlying math behind simplification transformations in the Sympy library, particularly given the nature of expressions related to powers.""}, {""file"": ""sympy/simplify/radsimp.py"", ""justification"": ""Rational simplifications may be called within the `simplify()` function, providing more context for managing expressions involving roots, which is characteristic of the expression in question.""}, {""file"": ""sympy/simplify/fu.py"", ""justification"": ""This file is also likely relevant, as it could contain utility functions that `simplify()` may invoke to carry out various algebraic simplifications.""}, {""file"": ""sympy/simplify/cse_opts.py"", ""justification"": ""This file may influence the optimization strategies for expressions involving common subexpressions and how they are handled during the simplification process.""}, {""file"": ""sympy/simplify/cse_main.py"", ""justification"": ""Central methods for common subexpression elimination can impact how expressions are simplified, particularly when the inputs share structures that could benefit from optimization.""}, {""file"": ""sympy/core/expr.py"", ""justification"": ""It contains core expression handling mechanisms, which might interact with simplifications and affect how expressions are represented within Sympy's framework.""}, {""file"": ""sympy/integrals/rubi/utility_function.py"", ""justification"": ""Functions in this file that assist simplification may indirectly relate to the core simplification logic.""}, {""file"": ""sympy/integrals/rubi/tests/test_utility_function.py"", ""justification"": ""Testing utilities for RUBI could expose integrational effects on the outputs of expressions that rely on simplification, providing insight into potential bugs.""}]}",['sympy/core/numbers.py']
sympy__sympy-14396,"The bug report indicates that instantiating a polynomial (Poly) with a specific domain ('RR[y,z]') fails with an OptionError, indicating that the domain specification is invalid. The traceback points to a recent call in `polytools.py` and a failure in `polyoptions.py` where the options and pre-processing of the domain are handled. Key components to investigate include the `Poly` method within `polytools.py`, and the `build_options` and `preprocess_options` within `polyoptions.py`. Possible issues are with how domain types are validated and processed.","{""ranked_list"": [{""file"": ""sympy/polys/polyoptions.py"", ""justification"": ""Contains the `preprocess_options` and `preprocess` methods that are directly involved in validating and translating domain specifications. The error raised indicates a failure in this domain specification pipeline.""}, {""file"": ""sympy/polys/polytools.py"", ""justification"": ""The main `Poly` method is defined here along with the creation and initialization of polynomial instances. It coordinates with `polyoptions.py` for option processing, making it crucial for understanding the error context.""}, {""file"": ""sympy/polys/tests/test_polytools.py"", ""justification"": ""This test file likely contains tests related to the `Poly` functionality. If there are tests for domains, they may directly relate to issues seen in the bug report.""}, {""file"": ""sympy/polys/tests/test_constructor.py"", ""justification"": ""Includes tests for various constructs in polynomial creation, which could encompass domain specifications as well.""}, {""file"": ""sympy/polys/domains/algebraicfield.py"", ""justification"": ""Handles domain specifications related to algebraic fields. The problem might be tied to how subdomains like 'RR[y,z]' are defined or processed.""}, {""file"": ""sympy/polys/domains/polynomialring.py"", ""justification"": ""Contains implementations for polynomial rings that may interact with domain specifications relevant to the bug.""}, {""file"": ""sympy/polys/domains/old_polynomialring.py"", ""justification"": ""An older implementation of a polynomial ring that might contain legacy domain handling, possibly affecting how current domains are processed.""}, {""file"": ""sympy/polys/domains/domain.py"", ""justification"": ""Acts as a base for defining domains and domain functionalities, which would be pertinent given the domain issue in the error.""}, {""file"": ""sympy/polys/polyerrors.py"", ""justification"": ""Centralized error definitions related to polynomial operations, potentially affecting how domain errors are raised or handled.""}, {""file"": ""sympy/polys/polyfuncs.py"", ""justification"": ""Contains various polynomial functions that may utilize or impact domain handling under certain conditions.""}]}",['sympy/polys/polyoptions.py']
sympy__sympy-14308,"The bug report indicates issues related to the pretty-printing of vectors specifically from the 'sympy' library, referencing operations involving coordinates and expressions. It notes that vectors break pretty printing, and when printing is successful, the output is not centered as per expectations. The methods and functionalities relevant to vector operations and pretty printing are of primary interest. Keywords derived from the report include 'pretty printing', 'vectors', 'coordinates', and 'output'. Affected components likely involve the printing logic and vector management classes.","{""ranked_list"": [{""file"": ""sympy/physics/vector/printing.py"", ""justification"": ""Contains the 'vsprint' method, which handles display outputs for expressions in the sympy physics vector package. This is crucial for understanding any misbehavior in pretty printing.""}, {""file"": ""sympy/printing/pretty/pretty.py"", ""justification"": ""Includes the 'pretty_print' method that is directly involved in rendering expressions, thus any bugs in how it formats outputs for vectors could cause the described issues.""}, {""file"": ""sympy/vector/vector.py"", ""justification"": ""This file contains core vector operations, including 'magnitude', 'normalize', 'dot', and particularly the 'components' function which directly influences how vector entries are outputted.""}, {""file"": ""sympy/vector/tests/test_printing.py"", ""justification"": ""Contains tests for pretty printing specifically, which can reveal how the current implementation behaves against expected results and may uncover specific misalignments.""}, {""file"": ""sympy/physics/vector/tests/test_printing.py"", ""justification"": ""Includes tests for pretty printing, particularly for vectors, which will help in verifying whether the outputs align with the expected pretty printed results.""}, {""file"": ""sympy/physics/vector/vector.py"", ""justification"": ""Handles various operations and representations for vector types, closely related to how they're printed within the context of physics.""}, {""file"": ""sympy/vector/scalar.py"", ""justification"": ""Might interact with vector operations, especially since the bug relates to how outputs are formatted, which could include scalar operations.""}, {""file"": ""sympy/vector/coordsysrect.py"", ""justification"": ""Potentially relevant for understanding how Cartesian coordinates affect vector presentations and printing formats.""}, {""file"": ""sympy/physics/vector/tests/test_vector.py"", ""justification"": ""Tests related to vectors in general and could provide insights into interactions affecting pretty printing behavior.""}]}",['sympy/printing/pretty/pretty.py']
sympy__sympy-14774,"The bug report indicates that the LaTeX printer in the Sympy library fails to properly support the full inverse trigonometric function names for 'acsc' and 'asec'. It explicitly mentions that while calling `latex(asin(x), inv_trig_style=""full"")` returns the expected output '\arcsin{\left (x \right )}', the call `latex(acsc(x), inv_trig_style=""full"")` does not generate the anticipated output, instead resulting in '\operatorname{acsc}{\left (x \right )}'. The report suggests modifying the 'inv_trig_table' in the file `sympy/printing/latex.py` to include 'acsc' and 'asec'. The file location and line number where this modification should occur are also provided. This indicates that the likely location of the bug resides in the `latex` function targeted toward inverse trigonometric functions.","{""ranked_list"": [{""file"": ""sympy/printing/latex.py"", ""justification"": ""Contains the latex function for rendering expressions in LaTeX format, which are core to the reported issue with inverse trigonometric function handling.""}, {""file"": ""sympy/printing/tests/test_latex.py"", ""justification"": ""Contains unit tests directly related to LaTeX output formatting, including tests for various functions and methods that could directly or indirectly test the behavior of acsc and asec.""}, {""file"": ""sympy/integrals/rubi/utility_function.py"", ""justification"": ""Shows method 'ArcCsc' which may be closely linked to the functionality for arc-cosecant that might need testing for latex output.""}, {""file"": ""sympy/functions/elementary/trigonometric.py"", ""justification"": ""This file likely contains definitions for arc functions and could influence or relate to how these functions are rendered in LaTeX.""}]}",['sympy/printing/latex.py']
sympy__sympy-14317,"The bug report describes an inconsistency in the LaTeX output of polynomial representations compared to the output of the pretty and string printers in a mathematical software, likely SymPy. The main points extracted from the report include: 
1. **Keywords**: LaTeX, polynomial, printer, order, monomials, pretty, str.
2. **Error Description**: The order of monomials is not consistent between the LaTeX output and the outputs of the pretty and str functions when printing the same polynomial. 
3. **Functional Hints**: The methods involved in producing the LaTeX output likely need investigation, especially the methods associated with monomial ordering. 
4. **Components**: The main components affected by this bug seem to relate to how polynomials are printed across different formats. The methods that may be involved are primarily those responsible for handling outputs (latex, pretty, str) and any potential helper or internal methods that manage ordering of monomials.","{""ranked_list"": [{""file"": ""sympy/printing/latex.py"", ""justification"": ""Contains the main latex method responsible for converting expressions to LaTeX format. Any issues with the ordering of monomials in the LaTeX output would be critical to address within this file.""}, {""file"": ""sympy/printing/pretty/pretty.py"", ""justification"": ""Implements the pretty printer that may be related to how expressions are organized visually. Comparison to LaTeX output might provide insights into discrepancies in ordering.""}, {""file"": ""sympy/polys/rings.py"", ""justification"": ""Includes methods that handle polynomial representation, including str function for generating a string representation of the polynomial. It might reveal underlying issues with polynomial ordering.""}, {""file"": ""sympy/polys/tests/test_polytools.py"", ""justification"": ""Contains tests that confirm polynomials' behavior under various circumstances, including their string (and potentially latex) representations. It helps validate existing implementations.""}, {""file"": ""sympy/vector/tests/test_printing.py"", ""justification"": ""Tests conversions of vector expressions to LaTeX, revealing any inconsistencies in representation order which may parallel issues seen in polynomials.""}, {""file"": ""sympy/physics/quantum/tests/test_printing.py"", ""justification"": ""Includes tests for LaTeX representations in quantum mechanics contexts, potentially exposing similar inconsistencies in how polynomials or other expressions are printed.""}, {""file"": ""sympy/printing/pretty/tests/test_pretty.py"", ""justification"": ""Tests various pretty print outputs, essential to understand differences against LaTeX outputs.""}, {""file"": ""sympy/printing/printer.py"", ""justification"": ""Potentially contains shared logic for different printers including LaTeX, which indirectly impacts how ordering is determined.""}, {""file"": ""sympy/printing/tests/test_str.py"", ""justification"": ""Covers tests relevant to string outputs, closely related to the str method that may influence polynomial ordering consistency.""}]}",['sympy/printing/latex.py']
sympy__sympy-14024,"The bug report describes an inconsistency when simplifying the expression (-a)**x * a**(-x) for positive integer values of 'a'. The output of the simplifying operation results in two different evaluations for complex numbers, indicating the presence of potential issues in handling the simplification of expressions with negative bases and their interactions with positive integers, particularly in relation to functions from symbolic computation. Key functionalities referenced include symbol definitions, simplification, evaluation of numerical results, and comparisons between different expressions. Affected components appear to involve symbolic math operations, especially simplifications and the management of complex and arithmetic forms in equations. Keywords include simplify, inconsistency, positive integer, complex, simplify expressions, and symbolic math.","{""ranked_list"": [{""file"": ""sympy/simplify/simplify.py"", ""justification"": ""This file contains the general simplify function, which is directly relevant to the bug report's focus on simplification inconsistencies when handling expressions. Its method 'simplify' outlines several strategies for simplifying mathematical expressions and handles specific cases that may include roots and power functions.""}, {""file"": ""sympy/simplify/powsimp.py"", ""justification"": ""This file specializes in combining powers with similar bases and exponents. The expressions in the bug report heavily involve powers of negative and positive integers, making this file key to understanding how such terms are handled in simplification.""}, {""file"": ""sympy/simplify/tests/test_simplify.py"", ""justification"": ""The test cases in this file directly validate the functionality of the simplify() method. Given that it includes various simplification tests, including edge cases similar to those described in the bug report, it is highly likely to contain tests specific to handling cases like (-a)**x.""}, {""file"": ""sympy/simplify/tests/test_powsimp.py"", ""justification"": ""This file contains tests for the powsimp function which simplifies expressions like those found in the bug report, specifically around handling powers and their combinations. The relevancy aligns with the potential faults identified in simplifying expressions like (-a)**x.""}, {""file"": ""sympy/simplify/tests/test_ratsimp.py"", ""justification"": ""Contains tests for rational simplifications which may cross over into similar functionality as described in the bug report by dealing with expressions that involve division and common denominators that could arise from simplifications.""}, {""file"": ""sympy/simplify/gammasimp.py"", ""justification"": ""Though focused on the gamma functions, the core operations of simplifying expressions can interact with issues found in the simplification process detailed in the bug report, particularly how complex functions are manipulated.""}, {""file"": ""sympy/simplify/radsimp.py"", ""justification"": ""Addresses rationalizing denominators, which may indirectly impact simplifications that involve roots and powers found in the bug report, providing additional context on managing these expressions.""}, {""file"": ""sympy/simplify/ratsimp.py"", ""justification"": ""Similar to radsimp, this focuses on rationalizing and reducing expressions, which might highlight issues arising from the simplification operations on expressions like those in the bug report.""}, {""file"": ""sympy/simplify/tests/test_fu.py"", ""justification"": ""Contains tests related to functions used in the simplification processes. Although not directly connected to the bug report, tests here may showcase function interactions that could reveal underlying issues during simplifications.""}, {""file"": ""sympy/simplify/tests/test_radsimp.py"", ""justification"": ""While focused on another simplification aspect, tests here may interact and provide insights on how the internal mechanisms within simplification tools operate, especially for edge cases similar to those discussed in the bug report.""}]}",['sympy/core/numbers.py']
