bug_id,bug_report_analysis,suspicious_files,fixed_files
sympy__sympy-12454,"The bug report indicates that the method `is_upper()` within the `Matrix` class raises an `IndexError` when called with a 4x2 matrix of zeros. The traceback shows that the error occurs during the iteration over the matrix dimensions when trying to access indices that exceed the defined size of the matrix. The logical check within `is_upper()` iterates over `i` from 1 to `self.rows` and over `j` from 0 up to `i`. For a matrix defined as 4 (rows) by 2 (columns), the maximum index for j should be constrained to the 2 columns. However, the implemented logic does not incorporate checks to prevent accessing an out-of-range index, leading to the IndexError at `self[3, 2]` for the last combination of indices.","{""ranked_list"": [{""file"": ""sympy/matrices/matrices.py"", ""justification"": ""The `is_upper()` method is directly responsible for the bug, as it contains logic that attempts to access indices that are out of bounds for a non-square matrix. This file is one of the primary sources of the error.""}, {""file"": ""sympy/matrices/dense.py"", ""justification"": ""The `dense.py` file is relevant as it may contain matrix handling and indexing methods like `__getitem__()` that could affect how elements are accessed in matrices. Understanding how elements are retrieved can provide additional insights into the bug.""}]}",['sympy/matrices/matrices.py']
sympy__sympy-12481,"The bug report discusses an issue with the `Permutation` constructor, specifically that it does not handle non-disjoint cycles correctly. Instead of constructing the identity permutation, it raises a `ValueError` when cycles are provided that overlap. The report emphasizes the need for the constructor to process these cycles in left-to-right order to yield the correct permutation. The key terms extracted from the report include: 'Permutation', 'non-disjoint cycles', 'ValueError', and 'identity permutation'. This prompts a focus on files related to permutations and cycle handling, specifically the `permutations.py` file.","{""ranked_list"": [{""file"": ""sympy/combinatorics/permutations.py"", ""justification"": ""This file houses the `Permutation` class and its constructor. The analysis of the `__init__` method indicates it validates the cycle inputs, raising a `ValueError` if duplicates are found. The constructor is thus central to the bug as it directly deals with cycle inputs.""}, {""file"": ""sympy/combinatorics/tests/test_permutations.py"", ""justification"": ""This file includes unit tests related to the `Permutation` class and its various functionalities, including tests for correct behavior with cycles. The function `test_Permutation()` likely tests scenarios relevant to the bug report.""}, {""file"": ""sympy/combinatorics/util.py"", ""justification"": ""Contains utility functions including `_check_cycles_alt_sym(perm)`, which checks properties of permutation cycles. It may provide insights on handling the cycles or their validation, relevant to understanding the bug.""}, {""file"": ""sympy/combinatorics/generators.py"", ""justification"": ""Includes a method for generating permutations. The `perm(show=0)` function appears to create permutations from provided cycle format, relevant in understanding how permutations can be constructed and possibly pertain to this issue.""}, {""file"": ""sympy/combinatorics/tests/test_perm_groups.py"", ""justification"": ""Also includes tests that may reference or indirectly relate to permutations and their behaviors, potentially shedding light on expected behaviors that should align with the bug report.""}]}",['sympy/combinatorics/permutations.py']
sympy__sympy-12236,"The bug report specifically describes a wrong result being produced by the `apart()` function from the `sympy` library when applied to a symbolic expression involving variables defined with `symbols`. Key observations from the report include the use cases of `apart()` for partial fraction decomposition and how it fails to correctly simplify certain expressions in the context of the given calculation. This suggests that issues may lie within the methods defining or implementing `apart()`, especially in the files where this function is defined and tested.","{""ranked_list"": [{""file"": ""sympy/polys/partfrac.py"", ""justification"": ""This file contains the implementation of the `apart()` function, which computes the partial fraction decomposition of rational functions. It includes methods `apart`, `apart_undetermined_coeffs`, and `apart_full_decomposition`, all directly relevant to the bug report's context of incorrect results when using `apart()`. The method body indicates that the function uses different algorithms for decomposition depending on the options specified.""}, {""file"": ""sympy/core/expr.py"", ""justification"": ""This file defines the `apart()` method within the `Expr` class, which serves as a wrapper calling the `apart()` function in the `polys` module. The direct reference to the other module shows how the functionalities are linked, making this file relevant.""}, {""file"": ""sympy/core/tests/test_expr.py"", ""justification"": ""This file likely contains tests for expression manipulations including simplification and decomposition. It could have relevant tests checking the functionality of `apart()`, contributing to uncovering discrepancies or bugs.""}, {""file"": ""sympy/simplify/tests/test_hyperexpand.py"", ""justification"": ""Tests related to simplifications may indirectly assess the effectiveness and correctness of `apart()`. Possible tests evaluating decomposition are of interest.""}, {""file"": ""sympy/core/tests/test_function.py"", ""justification"": ""Tests related to functions in `sympy` could also indirectly involve the `apart()`. It's worth checking if any tests hold relevant edge cases for the function.""}, {""file"": ""sympy/core/tests/test_sympify.py"", ""justification"": ""This file could contain tests that verify the behavior of symbolic computations which aligns with how `apart()` resolves fractions.""}, {""file"": ""sympy/core/tests/test_evalf.py"", ""justification"": ""Precision tests could also link to `apart()`, especially if floating points are involved in the simplification process which may influence results.""}, {""file"": ""sympy/solvers/solvers.py"", ""justification"": ""This could indirectly involve functions that rely on `apart()`, especially in solving rational expressions, which might lead to relevant bugs seen by users.""}]}",['sympy/polys/domains/polynomialring.py']
sympy__sympy-11400,"The bug report refers to a call to the function `ccode(sinc(x))`, which does not execute correctly. The output indicates that the `sinc` function is not supported in the context of a C code representation. This indicates that there might be issues either with the handling of the `sinc` function within the `ccode` function or the lack of proper support for this function in Sympy's code generation capabilities. Moreover, the report mentions using the `Piecewise` function in SymPy, which suggests a connection to piecewise-defined functions in the broader context of symbolic mathematics. The invoked expressions and provided outputs hint at involved mathematical functions and their symbolic conversions.","{""ranked_list"": [{""file"": ""sympy/printing/ccode.py"", ""justification"": ""Central to the bug report, this file has the `ccode` function which is directly invoked in the bug description. Its method body indicates it handles conversions to C code, implying any issues with `sinc` directly relate here.""}, {""file"": ""sympy/printing/fcode.py"", ""justification"": ""This file also deals with code generation but targets Fortran. Similar functionality to `ccode` may provide insights into handling function conversions.""}, {""file"": ""sympy/functions/elementary/trigonometric.py"", ""justification"": ""This file defines important trigonometric function behaviors, including `sinc` related functions. The presence of methods that rewrite expressions as sine or cosine may indirectly support `sinc` and its contextual usage.""}, {""file"": ""sympy/functions/elementary/piecewise.py"", ""justification"": ""Relevant to handling piecewise function representations, as noted in the report. It includes functions that manage the overall handling of piecewise expressions, aligning it with the user report's context.""}, {""file"": ""sympy/printing/jscode.py"", ""justification"": ""While focused on JavaScript code generation, understanding how it manages function definitions may provide clues parallel to the C code generation context, especially with respect to undefined functions.""}, {""file"": ""sympy/functions/special/error_functions.py"", ""justification"": ""Functions defined here might provide special function outputs, including possibly `sinc`-like behavior as the report hints at issues with mathematical function outputs.""}, {""file"": ""sympy/printing/mathml.py"", ""justification"": ""Although primarily dealing with MathML, the conversion intricacies involve various function definitions that can shed light on print logic when mathematical expressions are rendered in symbolic forms.""}, {""file"": ""sympy/simplify/trigsimp.py"", ""justification"": ""This file addresses trigonometric simplifications that may involve conditions and transformations related to sine and cosine functions, connecting them back to `sinc`.""}, {""file"": ""sympy/printing/latex.py"", ""justification"": ""Similar to the JavaScript file, insights here might benefit understanding function string representations across different formats, including that which `sinc` could be adapted to.""}, {""file"": ""sympy/utilities/codegen.py"", ""justification"": ""This file may contain utilities that support code generation between different languages, which can assist in understanding broader implications when certain mathematical functions are unsupported.""}]}",['sympy/printing/ccode.py']
sympy__sympy-12171,"The bug report indicates that the Mathematica code printer in the SymPy library is experiencing bugs when handling derivatives and floating-point numbers with exponents. The specific issues reported are:
1. Derivatives such as `Derivative(f(t), t)` are not being printed correctly. The expected output is `D[f[t],t]`, but it currently prints the derivative expression in its original form.
2. Floating-point numbers like `1.0e-4` should be converted to `1.0*^-4`, but this is not being handled correctly either. 

The suggested fixes involve adding methods to handle these cases in a class likely named `MCodePrinter`. Therefore, we should search for files related to ""MCodePrinter"" or terms like ""print"" in their filenames and focus on the handling of the `Derivative` and `Float` methods as highlighted in the report. These components are critical for the issue at hand, indicating that we need to focus on files that implement methods concerning these two functionalities.","{""ranked_list"": [{""file"": ""sympy/printing/latex.py"", ""justification"": ""Contains both _print_Derivative and _print_Float with relevant logic modifications. Specifically, it has checks for the `Derivative` and correct float formatting, aligning directly with the reported issues.""}, {""file"": ""sympy/printing/fcode.py"", ""justification"": ""Includes the method _print_Float which deals with floating-point formatting. Potentially important for resolving issues with exponent notation.""}, {""file"": ""sympy/printing/pretty/pretty.py"", ""justification"": ""Has implementations for both _print_Derivative and _print_Float. It may use alternative formatting that could be related to or affect the current issue.""}, {""file"": ""sympy/printing/mathml.py"", ""justification"": ""Contains _print_Derivative which might implement a different means of handling derivatives in its own context, potentially shedding light on the bug.""}, {""file"": ""sympy/printing/theanocode.py"", ""justification"": ""Includes _print_Derivative that uses Theano-style printing, which could be different and provide perspectives on the issue due to context differences.""}, {""file"": ""sympy/physics/vector/printing.py"", ""justification"": ""Contains multiple _print_Derivative implementations, addressing different expressions which might be significant to the problems described.""}, {""file"": ""sympy/printing/str.py"", ""justification"": ""Includes _print_Float, which handles basic conversion logic and may be simple but critical for fixing the float representation.""}, {""file"": ""sympy/printing/rcode.py"", ""justification"": ""Has both _print_Float and _print_Derivative that may relate to the necessary fixes as per the bug report.""}, {""file"": ""sympy/printing/jscode.py"", ""justification"": ""Contains functions that deal with float formatting which are relevant to the parsing of floats with exponents.""}, {""file"": ""sympy/printing/codeprinter.py"", ""justification"": ""Has a variety of print functionalities including _print_Float that could influence multiple printing behaviors including those referenced in the bug report.""}]}",['sympy/printing/mathematica.py']
sympy__sympy-11897,"The bug report highlights inconsistencies between the output of LaTeX and pretty printers. Keywords and expressions like 'LaTeX printer', 'pretty printer', 'inconsistent output', and specific examples of mathematical expressions suggest the code related to printing or formatting expressions is likely faulty. Components like 'latex', 'pretty', and functions related to rendering expressions should be closely investigated as they directly correspond to the reported issue.","{""ranked_list"": [{""file"": ""sympy/printing/latex.py"", ""justification"": ""The LaTeX printer's core functionality is encapsulated in this file, particularly within the 'latex' and 'doprint' methods which handle the conversion of expressions to LaTeX representation. Analyzing these methods is critical given the bug report's focus on LaTeX output.""}, {""file"": ""sympy/printing/pretty/pretty.py"", ""justification"": ""This file contains the pretty printer implementation\u2014its 'doprint' method is essential for producing formatted output. The inconsistency between pretty printing and LaTeX representation indicates potential issues here.""}, {""file"": ""sympy/interactive/printing.py"", ""justification"": ""This file manages interactive printing, including methods that utilize LaTeX for display. Its connection with the main rendering functions bears relevance as the bug report discusses interactive examples.""}, {""file"": ""sympy/printing/printer.py"", ""justification"": ""General printing utilities are crucial for the LaTeX and pretty printer functionalities. The methods defined here (especially 'doprint' and '_print') could influence how expressions are output regardless of the specific printer.""}, {""file"": ""sympy/printing/mathml.py"", ""justification"": ""Includes methods for rendering expressions in MathML, and while not directly mentioned, its 'doprint' method parallels the LaTeX and pretty print processes, indicating potential shared logic that could cause discrepancies.""}, {""file"": ""sympy/printing/codeprinter.py"", ""justification"": ""This file provides code representations of expressions, and its 'doprint' method suggests it may share logic or functionalities with the LaTeX printer, potentially contributing to format inconsistencies.""}, {""file"": ""sympy/printing/lambdarepr.py"", ""justification"": ""The 'doprint' method in this file deals with lambda rendering which could affect how expressions are analyzed for pretty or LaTeX printing.""}, {""file"": ""sympy/printing/theanocode.py"", ""justification"": ""Handles Theano code representations through a 'doprint' function, relevant in the scenario of translating and formatting expressions correctly.""}, {""file"": ""sympy/printing/preview.py"", ""justification"": ""Although not the primary focus, this file may handle rendering previews which could reveal inconsistencies in expression representations.""}, {""file"": ""examples/beginner/print_pretty.py"", ""justification"": ""Includes examples of pretty printing which may help illustrate how the pretty printer is intended to function. It is not directly responsible for the bug but provides context that might help understand expected outputs.""}]}",['sympy/printing/latex.py']
sympy__sympy-13031,"The bug report discusses a change in the behavior of the `hstack` and `vstack` methods of `sympy` matrices between versions 1.0 and 1.1. Specifically, it highlights how these methods now return different shapes for matrices of zero dimensions, which suggests that the methods responsible for constructing matrix arrangements are now improperly handling certain edge cases involving empty matrices. The focus of this bug is on these two methods, and we would need to inspect their implementations and related functionality in the codebase. Keywords extracted include: 'hstack', 'vstack', 'Matrix', 'shape', and 'zero dimension'.","{""ranked_list"": [{""file"": ""sympy/matrices/common.py"", ""justification"": ""This file contains the implementations of both `hstack` and `vstack`, which are the primary methods mentioned in the bug report. Any changes or bugs related to their functionality will likely be found here.""}, {""file"": ""sympy/matrices/tests/test_matrices.py"", ""justification"": ""This test file likely contains unit tests that validate the behavior of matrix operations including `hstack` and `vstack`. Investigating tests may reveal if existing tests cover the previously reported behavior and help identify if the functionality has changed.""}, {""file"": ""sympy/matrices/tests/test_commonmatrix.py"", ""justification"": ""This file contains tests specifically targeting operations involving matrices, including the `hstack` and `vstack`. The existence of tests for these methods makes this file relevant for identifying how the behavior was expected to function.""}, {""file"": ""sympy/matrices/tests/test_densearith.py"", ""justification"": ""Although focusing on dense arithmetic, changes in general matrix operations may impact arithmetic behaviors, especially matrix concatenations. This could indirectly reflect on the behavior of `hstack` and `vstack`.""}, {""file"": ""sympy/matrices/tests/test_sparse.py"", ""justification"": ""Similar to dense arithmetic, sparse matrix implementations could also be using `hstack` or `vstack` for combining matrices, making it necessary to review if its behavior aligns with the expected one.""}, {""file"": ""sympy/printing/tests/test_str.py"", ""justification"": ""Includes tests for matrix string representations which can help us understand if the visual output (resulting from shape changes) reflects the changes in `hstack` and `vstack`.""}, {""file"": ""sympy/matrices/matrices.py"", ""justification"": ""This file may house essential matrix configuration/initializations that can affect how these matrices behave in relation to `hstack` and `vstack`.""}]}",['sympy/matrices/sparse.py']
sympy__sympy-11870,"The bug report discusses simplifying exponential functions to trigonometric identities, specifically aiming for results like `sin(k)` or `sinc(k)`. The terms 'trigsimp' and 'simplify' are central to the request, implying that specific functions related to trigonometric simplification are potentially involved. The use of exponential expressions like `exp(I*k)` indicates a connection to functions handling complex numbers and potentially Fourier transforms. Critical keywords include 'exponential', 'trigonometric', 'trigsimp', 'simplify', and the specific outcomes desired, namely `sin(k)` and `sinc(k)`. Affected components likely relate to simplification processes in mathematical expressions, particularly trigonometric functions derived from exponential forms.","{""ranked_list"": [{""file"": ""sympy/simplify/trigsimp.py"", ""justification"": ""This file contains the method 'trigsimp' which is directly referenced in the bug report. Its role is to simplify expressions using known trigonometric identities, making it highly relevant for transforming exponential functions to trigonometric forms.""}, {""file"": ""sympy/simplify/simplify.py"", ""justification"": ""This file provides a general simplification method that may also apply trigonometric simplification when necessary, as indicated by the method's design to simplify a wide range of expressions.""}, {""file"": ""sympy/functions/elementary/exponential.py"", ""justification"": ""Contains methods that interact with exponential functions, including rewriting expressions in terms of trigonometric functions, which aligns well with the bug report's desire to convert exponential forms to trigonometric outcomes.""}, {""file"": ""sympy/functions/elementary/trigonometric.py"", ""justification"": ""Specifically dedicated to trigonometric functions, this file contains methods that could facilitate simplifications related to trig functions, further supporting the operations required to handle cases like 'sinc(k)'.""}, {""file"": ""sympy/simplify/fu.py"", ""justification"": ""This file implements the 'fu' method, which applies various transformation rules related to trigonometric simplifications and may assist in achieving the simplifications needed from exponential forms.""}, {""file"": ""sympy/simplify/hyperexpand.py"", ""justification"": ""While primarily concerned with hypergeometric functions, this file might still contain methods for efficient simplification that could apply to the rational expressions mentioned in the report.""}, {""file"": ""sympy/simplify/combsimp.py"", ""justification"": ""Though more focused on combinatorial expressions, understanding how different mathematical functions can be simplified is essential, making this file a potential candidate.""}, {""file"": ""sympy/functions/special/gamma_functions.py"", ""justification"": ""Might not directly relate to trigonometric functions, however, understanding gamma functions can provide insights into their relationships with trigonometric identities, relevant for simplification.""}, {""file"": ""sympy/integrals/transforms.py"", ""justification"": ""This file potentially involves methods that transform functions, which could include the transformations needed to convert or simplify exponential functions into their trigonometric equivalents.""}, {""file"": ""sympy/functions/special/bessel.py"", ""justification"": ""Though primarily about Bessel functions, understanding these special functions can provide broader context for dealing with complex transformations and simplifications.""}]}",['sympy/functions/elementary/trigonometric.py']
