bug_id,bug_report_analysis,suspicious_files,fixed_files
sympy__sympy-16792,"The bug report specifies an issue with the `autowrap` function from SymPy's `utilities.autowrap` module when using the Cython backend. The problem arises specifically when function expressions do not utilize certain input arguments, causing the generated C function to have incorrect signatures (e.g., expecting to receive an array but defined as a scalar). Key terms to extract from the report include 'autowrap', 'Cython', 'incorrect signature', 'array arguments', 'TypeError', and `ufuncify`, which indicates a connection with generating user-defined functions from mathematical expressions. The report also highlights the importance of ensuring that output signatures align properly with input arguments, especially in the context of interfacing with external numerical libraries.","{""ranked_list"": [{""file"": ""sympy/utilities/autowrap.py"", ""justification"": ""This file contains the main implementation of the `autowrap` function, which is directly related to the bug reported. The function generates Python callable binaries from a SymPy expression and is crucial for understanding issues related to argument handling.""}, {""file"": ""sympy/utilities/tests/test_autowrap.py"", ""justification"": ""This file contains tests specifically designed for `autowrap`, including various scenarios that might reproduce the bug reported regarding argument dependencies.""}, {""file"": ""sympy/utilities/codegen.py"", ""justification"": ""This module includes functions related to code generation, which is integral to how `autowrap` processes input arguments and generates appropriate C code.""}, {""file"": ""examples/advanced/autowrap_integrators.py"", ""justification"": ""This example shows practical usage of the `autowrap` function and demonstrates how incorrect argument handling could lead to wrong outputs. Understanding these examples could help localize the bug.""}, {""file"": ""sympy/codegen/tests/test_array_utils.py"", ""justification"": ""This contains tests for array-related code generation that may provide insights into how expressions involving arrays are handled, aligning with the reported bug's context.""}, {""file"": ""sympy/utilities/tests/test_codegen.py"", ""justification"": ""Contains tests for code generation that could illuminate how the backend interfaces with the Autowrap function and its argument handling mechanism.""}, {""file"": ""sympy/core/tests/test_expr.py"", ""justification"": ""Includes tests that ensure expressions behave as expected in different contexts, potentially illuminating issues involved with autowrap expressions.""}, {""file"": ""sympy/matrices/expressions/tests/test_matexpr.py"", ""justification"": ""Given the use of matrix symbols in the provided code example, tests in this file could help verify expected behaviors of matrix expressions and their treatment by `autowrap`.""}, {""file"": ""sympy/utilities/lambdify.py"", ""justification"": ""Contains functions that facilitate converting SymPy expressions into executable code, which may interact with functionality similar to `autowrap` for handling expressions.""}, {""file"": ""sympy/core/evalf.py"", ""justification"": ""This module handles evaluations of SymPy expressions, providing useful context on what happens during the evaluations that could be affected by incorrect argument handling.""}]}",['sympy/utilities/codegen.py']
sympy__sympy-15678,"The bug report indicates issues with the `idiff` method from the SymPy library that deals with implicit differentiation. The reported cases highlight two primary problems: (1) `idiff` does not support the `Eq` function when used as an input for numerical analysis, leading to an `IndexError`, and (2) it fails when a function `f(x)` is handled instead of a symbol `y`, resulting in a `ValueError`.  This implies potential bugs around the handling of dependent variables and the equation inputs in the `idiff` function. Keywords such as 'idiff', 'Eq', 'ValueError', and 'IndexError' are especially relevant.","{""ranked_list"": [{""file"": ""sympy/geometry/util.py"", ""justification"": ""Contains the implementation of the 'idiff' function that is directly reported as buggy in the bug report. The associated method body shows that it differentiates equations that may involve symbols and their dependencies, validating its central role in the bugs related to implicit differentiation.""}, {""file"": ""sympy/geometry/tests/test_util.py"", ""justification"": ""Includes the 'test_idiff()' method which tests the 'idiff' function's behavior, ensuring it covers scenarios mentioned in the bug report. The test cases specifically validate the proper handling of equations, strengthening its relevance.""}, {""file"": ""sympy/calculus/finite_diff.py"", ""justification"": ""While not directly reported to contain the bug, its potential interaction with numerical methods for finite differences could indirectly relate to the differentiation issues observed with the 'idiff' method. This file's relevance may arise if 'idiff' uses finite difference methods.""}, {""file"": ""sympy/core/tests/test_diff.py"", ""justification"": ""As a test file for differentiation methods, it helps validate the differentiability expected in various mathematical functions, which may intersect with the issues of 'idiff' when handling complex expressions.""}, {""file"": ""sympy/solvers/ode.py"", ""justification"": ""Although focused on ordinary differential equations, it contains methods that may interact with the 'idiff' functionality, particularly if differential equations were to involve implicit dependencies.""}, {""file"": ""sympy/calculus/tests/test_finite_diff.py"", ""justification"": ""Involves tests that cover the functionality for finite differences, indirectly implying scenarios that could present problems when differentiating functions or variables, possibly overlapping with the issues in 'idiff'.""}, {""file"": ""sympy/core/basic.py"", ""justification"": ""This foundational component of the SymPy library may regulate basic operations integral to differentiation processes, meaning any bugs arising there could propagate into the differentiation functions like 'idiff'.""}, {""file"": ""sympy/functions/special/error_functions.py"", ""justification"": ""Special functions could be involved in the dependencies fed into 'idiff', thus indirectly affecting it if those special cases were improperly managed.""}, {""file"": ""sympy/core/function.py"", ""justification"": ""Manages core function representations used throughout SymPy; any mismanagement of function handling could influence 'idiff' operations, particularly with user-defined functions.""}]}",['sympy/geometry/util.py']
sympy__sympy-16988,"The bug report involves improvements to the 'Intersection' function for handling duplicate elements in set intersections. The expected behavior is that duplicates should be ignored when creating the intersection. The report also provides specific examples which highlight that the presence of duplicates should not affect the outcome of function calls. Key terms from this bug report include 'intersection', 'remove duplicates', 'FiniteSet', and 'EmptySet'. The functionality is affected by sets, particularly in the manipulation of mathematical objects in Python, specifically within the SymPy library context. There are specific methods mentioned related to set operations, which need to be investigated for compliance with the reported bug.","{""ranked_list"": [{""file"": ""sympy/sets/handlers/intersection.py"", ""justification"": ""This file contains the 'intersection_sets' method which is critical for handling set intersections. It likely contains the logic for intersecting multiple sets, and thus its implementation should be closely examined for bugs related to duplicate handling.""}, {""file"": ""sympy/sets/tests/test_sets.py"", ""justification"": ""This file contains various unit tests for set-related operations including intersection. The 'test_intersection' method directly tests the behavior of the Intersection function, making it highly relevant to understanding how duplicates are handled in set operations.""}, {""file"": ""sympy/functions/elementary/piecewise.py"", ""justification"": ""The 'piecewise' file could be relevant because piecewise functions may interact with conditions on set intersections. The '__new__' method potentially deals with conditions that may be relevant when creating sets that handle duplicates.""}, {""file"": ""sympy/sets/tests/test_conditionset.py"", ""justification"": ""This file tests condition sets, including intersections involving complex conditions. The 'test_CondSet_intersect' method checks how condition sets behave under intersection, which may reveal issues with duplicates if we consider conditions that may lead to redundancy.""}, {""file"": ""sympy/functions/elementary/tests/test_piecewise.py"", ""justification"": ""Tests here may involve piecewise definitions and expressions, which can intertwine with the intersection of sets where duplicates are a concern.""}, {""file"": ""sympy/sets/tests/test_fancysets.py"", ""justification"": ""Fancy sets may include advanced set behaviors, and tests here could reveal interactions with duplicate handling in intersections.""}, {""file"": ""sympy/solvers/tests/test_solveset.py"", ""justification"": ""Solvers involved with sets might also interact with intersection logic, especially in cases where redundancy could cause erroneous outputs in mathematical evaluations.""}, {""file"": ""sympy/sets/tests/test_setexpr.py"", ""justification"": ""Set expressions might yield results that could be impacted by duplicates, making this file worth reviewing for relevant tests or methods related to set intersections.""}]}",['sympy/sets/sets.py']
sympy__sympy-17655,"The bug report indicates an unexpected exception when attempting to perform arithmetic operations involving SymPy's `Point` objects. Specifically, it details how the operation `point1 + sympy.sympify(2.0) * point2` raises a `GeometryError`, while a similar operation formatted differently does not yield an exception. This suggests there may be an issue in how the `__add__` method of the `Point` class interacts with multiplication or when handling the multiplication of a `Point` object with a constant. The error traceback points to a specific line in `point.py`, indicating that the mechanism that normalizes dimensions during addition is not functioning as expected.","{""ranked_list"": [{""file"": ""sympy/geometry/point.py"", ""justification"": ""This file contains the implementation of `Point`, including the `__add__` and `__mul__` methods, both of which are implicated in the reported bug. The method body for `__add__` describes how coordinates are added and includes error handling that raises a `GeometryError`, which is exactly what the exception in the bug report indicates.""}, {""file"": ""sympy/core/mul.py"", ""justification"": ""This file defines the `__neg__` method and possibly other multiplication-related operations that may relate to how `Point` objects are treated when multiplied by numerical constants. Effects of operations in this file may influence the behavior seen in the bug, especially regarding how multiplication interacts with the `Point` class.""}, {""file"": ""sympy/geometry/tests/test_point.py"", ""justification"": ""Contains unit tests for the `Point` class, including specific tests that validate operations like additions. The test method `test_point()` references multiplication with constants explicitly, which is relevant to the bug report's context and may serve as an important check for identifying failures during arithmetic operations.""}, {""file"": ""sympy/core/add.py"", ""justification"": ""This file contains methods related to addition, including sorting arguments which could affect how operations are processed during the addition of `Point` instances with other types, such as numbers.""}]}",['sympy/geometry/point.py']
sympy__sympy-17022,"The bug report describes an issue with the `lambdify` function from the SymPy library, specifically relating to the interpretation of the identity matrix in expressions. When using `lambdify` with an identity matrix, the result is unexpectedly complex due to `lambdify` misinterpreting `I` as a complex 1j instead of the identity matrix. Key aspects to focus on include the handling of matrix expressions, identity matrices, and how these are printed or represented in the output. The suggested output when adding the identity matrix to a numerical array is incorrect, indicating a likely failure in the handling of these mathematical objects. Evidence from the report stresses that the function should correctly identify and handle identity matrices without mistakenly introducing complex number representations.","{""ranked_list"": [{""file"": ""sympy/utilities/lambdify.py"", ""justification"": ""Contains the 'lambdify' function, which directly relates to the bug's issue with matrix expressions. The method body shows it bridges SymPy expressions and numerical libraries. Misinterpretation of the identity matrix directly involves this file.""}, {""file"": ""sympy/utilities/tests/test_lambdify.py"", ""justification"": ""Contains various tests for the lambdify function, including tests for handling multiple types of symbols and functions. The tests can provide insights into how the function interprets matrix inputs and should reveal edge cases related to identity matrices.""}, {""file"": ""sympy/matrices/expressions/matexpr.py"", ""justification"": ""Handles matrix expressions which are likely involved in the bug. Particularly the method 'I' could relate to the identity matrix issue described in the bug report.""}, {""file"": ""sympy/matrices/matrices.py"", ""justification"": ""Defines base classes for matrix operations and could play a role in how matrix addition is implemented, especially when working with identity matrices.""}, {""file"": ""sympy/printing/tests/test_numpy.py"", ""justification"": ""Includes tests related to NumPy, which is crucial since the identity matrix issue manifests specifically with NumPy arrays. Testing how expressions print or behave with numpy could provide useful context.""}, {""file"": ""sympy/matrices/expressions/tests/test_matadd.py"", ""justification"": ""Tests various additions involving matrices. This could substantiate how matrix additions, including identity matrices, are handled and might expose the fault.""}, {""file"": ""sympy/matrices/tests/test_commonmatrix.py"", ""justification"": ""Tests for common matrix operations which may indirectly involve identity matrices or similar constructs and could help clarify interactions and results in matrix-related operations.""}, {""file"": ""sympy/physics/matrices.py"", ""justification"": ""Contains physics-based matrix operations. While less directly related, any specialized handling involving identity or complex matrices could have relevance to the bug's context.""}, {""file"": ""sympy/printing/tests/test_numpy.py"", ""justification"": ""Tests specifically designed for matrix functionalities with numpy, aligning closely with how the lambdify function interacts with numerical operations.""}]}",['sympy/printing/pycode.py']
sympy__sympy-17139,"The bug report details an issue with an invalid comparison of a complex number 'I' within the 'simplify' function from the SymPy library. The error traceback indicates that the issue arises when attempting to simplify an expression that contains 'cos(x)**I'. The keywords and relevant components include 'simplify', 'trigsimp', and 'fu.py'. The affected operations involve reduction and transformations using trigonometric identities, specifically involving powers and potential transformations from complex expressions. This suggests looking into files and methods that deal with simplification and transformation of trigonometric and exponential expressions, as well as those handling powers and their conditions in expressions.","{""ranked_list"": [{""file"": ""sympy/simplify/fu.py"", ""justification"": ""Contains methods related to trigonometric simplifications and transformations ('_f(rv)', 'TR6(rv)'). Critical in handling powers of trigonometric functions and potentially yielding the error regarding complex comparisons.""}, {""file"": ""sympy/simplify/trigsimp.py"", ""justification"": ""Defines 'trigsimp' which reduces expressions using known trigonometric identities. The issue with complex numbers relates to trigonometric transformations that occur in this method, potentially leading to invalid comparisons.""}, {""file"": ""sympy/simplify/simplify.py"", ""justification"": ""The 'simplify' method orchestrates overall simplification strategies, including invoking 'trigsimp'. It\u2019s important to analyze as it drives the flow toward final simplification, including method calls that may result in the error.""}]}",['sympy/simplify/fu.py']
sympy__sympy-17630,"The bug report describes an exception triggered during the multiplication of `BlockMatrix` instances that contain `ZeroMatrix` blocks. Specifically, when attempting to multiply a `BlockMatrix` with zero blocks more than once (`b * b * b`), an `AttributeError` occurs: the result mistakenly uses an instance of the `Zero` class instead of a `ZeroMatrix`, leading to a missing `cols` attribute. The issue seems to lie in how the multiplication operator, specifically `_blockmul`, handles zero entries, which results in creating instances of `Zero` rather than `ZeroMatrix`. This hints at a potential problem in the method `_blockmul` defined in the `blockmatrix.py` file, since it is responsible for how block matrices are combined and, thus, how behaviors during multiplication are defined. The error could be a logical flaw in returning types when zero blocks are common in multiplication scenarios. The keywords derived from the report are: ""BlockMatrix"", ""ZeroMatrix"", ""_blockmul"", ""block_collapse"". The affected components are mainly the `BlockMatrix` implementation and any associated methods for matrix operations that handle these matrices, especially for multiplication and collapsing block structures.","{""ranked_list"": [{""file"": ""sympy/matrices/expressions/blockmatrix.py"", ""justification"": ""The file contains the method definitions `_blockmul(self, other)` and `block_collapse(expr)`, which are directly mentioned in the bug description. The `_blockmul` method, in particular, implements the multiplication logic for block matrices, crucial for understanding the source of the error when handling `ZeroMatrix` blocks.""}, {""file"": ""sympy/matrices/matrices.py"", ""justification"": ""This file likely includes the `ZeroMatrix` implementation or related matrix types that are fundamental to the construction of `BlockMatrix`. The relationship between zero matrices and operations may be defined here.""}, {""file"": ""sympy/core/numbers.py"", ""justification"": ""The file contains the implementation for the `Zero` class, which is pivotal in understanding how instances of zero are created and managed in multiplication operations. Given that the error involves an instance of `Zero`, this could potentially reveal unexpected behavior in matrix multiplication.""}, {""file"": ""sympy/matrices/expressions/matmul.py"", ""justification"": ""As the name suggests, this file likely deals with matrix multiplication logic beyond what is defined in `blockmatrix.py`, and thus might provide insights or interactions that could contribute to the bug.""}, {""file"": ""sympy/matrices/expressions/kronecker.py"", ""justification"": ""The Kronecker operations may involve zero matrices as well, and any issues related to expanded computations involving `BlockMatrix`s could intersect with functionality defined here.""}, {""file"": ""sympy/matrices/common.py"", ""justification"": ""This file might contain common utilities or helpers that support matrix operations including those relevant to multiplication and could contribute to matrix-type interactions.""}, {""file"": ""sympy/matrices/dense.py"", ""justification"": ""This file likely handles implementation details for dense matrices, which might intersect the operations or return types when manipulating block matrices containing zero elements.""}, {""file"": ""sympy/printing/pycode.py"", ""justification"": ""While indirect, this file might include printing-related functionality that handles how results of matrix operations are displayed, and thus capture the impact of the error while interacting with matrices.""}, {""file"": ""sympy/solvers/solvers.py"", ""justification"": ""In case any linear algebra solving functionalities impacted the multiplication logic here, this file should be checked for additional interactions and handling that could modify expected types.""}, {""file"": ""sympy/matrices/expressions/matexpr.py"", ""justification"": ""This file may involve matrix expressions, and any aspects related to symbolic mathematics handling of zero matrices might intersect with the mentioned bug due to layered complexity.""}]}",['sympy/matrices/expressions/matexpr.py']
sympy__sympy-18189,"The bug report describes incomplete results from the `diophantine` function in the context of symbolic mathematics when the order of symbols varies. The relevant keywords include `diophantine`, `incomplete results`, `order`, `syms`, and `permute=True`. It indicates that the behavior of the function alters based on the arrangement of symbols (e.g., `(m, n)` vs `(n, m)`), suggesting a problem in how symbols are handled and returned. The tests included in the report confirm that the output varies incorrectly depending on the symbol order, and attaching permutations of the solutions appears to be critical for the function's correctness. This report directs us to focus on the `sympy/solvers/diophantine.py` file, particularly the `diophantine` method and its ability to manage the permutations of outputs. The presence of multiple test cases in `sympy/solvers/tests/test_diophantine.py` also suggests this file is highly relevant due to its direct testing of the core functionality of the `diophantine` method.","{""ranked_list"": [{""file"": ""sympy/solvers/diophantine.py"", ""justification"": ""Direct implementation of the 'diophantine' function which is reported to have incomplete results depending on symbol order with the 'permute' parameter affecting outputs.""}, {""file"": ""sympy/solvers/tests/test_diophantine.py"", ""justification"": ""Contains extensive tests directly related to the 'diophantine' function, checking for various input cases including those that demonstrate the reported issue with incomplete results based on symbol order.""}]}",['sympy/solvers/diophantine.py']
sympy__sympy-18057,"The bug report describes an issue with the SymPy library, specifically involving its `__eq__` method when comparing instances with unknown object representations. The error arises when calling `eval` on strings produced by an object's `__repr__` method during equality checks, which can lead to unexpected behavior and exceptions like `AttributeError`. There is a strong emphasis on the danger of `eval` usage with untrusted input, especially in an equality context. Keywords derived from the report include 'SymPy', 'eval', '__eq__ method' and 'AttributeError', suggesting that files related to equality checks and parsing should be prioritized in the search for potential bug locations. Components likely affected include functions handling symbolic mathematics, equality comparison, and potentially the parser for the expressions.","{""ranked_list"": [{""file"": ""sympy/core/expr.py"", ""justification"": ""Contains the `__eq__` method that handles equality checks for expressions, where the inappropriate use of `eval` can lead to the bug described.""}, {""file"": ""sympy/parsing/sympy_parser.py"", ""justification"": ""Manages the evaluation and parsing of input expressions. The method `eval_expr`, directly related to evaluating parsed expressions using `eval`, is crucial to the bug's root cause.""}, {""file"": ""sympy/core/basic.py"", ""justification"": ""Holds the base class for symbolic expressions, also includes an `__eq__` method that checks equality between objects, which directly relates to the issue of comparing symbolic expressions.""}, {""file"": ""sympy/core/containers.py"", ""justification"": ""Implements the equality checks for containers, which may be affected when comparing symbolic objects, particularly in how values are derived.""}, {""file"": ""sympy/core/numbers.py"", ""justification"": ""Deals with numerical types that could interact with the SymPy objects and the defined equality checks, especially when those numbers are evaluated during comparisons.""}, {""file"": ""sympy/core/sympify.py"", ""justification"": ""Sympify method processes strings and arbitrary input, including the potential use of `eval` that could lead to the flaw described.""}, {""file"": ""sympy/core/exprtools.py"", ""justification"": ""Tools for manipulating expressions, which could indirectly affect how equality is evaluated in expressions.""}, {""file"": ""sympy/core/function.py"", ""justification"": ""Houses functionality for sympy functions, related to determining equality based on function representations.""}]}",['sympy/core/expr.py']
