bug_id,bug_report_analysis,suspicious_files,fixed_files
sympy__sympy-21614,"The bug report focuses on the `kind` attribute of Derivative objects being incorrectly identified as `UndefinedKind`, whereas it should provide a valid kind (like `MatrixKind`). The description includes two examples demonstrating correct and incorrect usage of the `kind` attribute: `Integral` gives a valid kind while `Derivative` does not. Thus, relevant keywords include 'kind', 'Derivative', 'UndefinedKind', and 'Integral'. This situation hints that the problem likely pertains to how `Derivative` objects are initialized or handled.","{""ranked_list"": [{""file"": ""sympy/core/kind.py"", ""justification"": ""Contains the method related to kinds and their handling, specifically for cases such as Derivatives and Integrals. The analysis of the `__call__` method indicates a dispatch for various kinds that need scrutiny when checking Derivative behavior.""}, {""file"": ""sympy/core/tests/test_kind.py"", ""justification"": ""This test file has various tests for the `kind` attribute, including `test_Integral_kind()`, which directly correlates with the bug report. It verifies the expected output for an Integral, giving context on what the `kind` should yield for similar constructs.""}, {""file"": ""sympy/matrices/expressions/tests/test_derivatives.py"", ""justification"": ""Contains tests related to matrix derivatives which might uncover specific handling of Derivative objects that could impact their `kind`. Particularly relevant as the report involves matrix symbols.""}, {""file"": ""sympy/core/symbol.py"", ""justification"": ""Includes a method `kind()` that determines the kind of symbol which influences its derivatives. This file is essential because it may provide insight into how types determine their `kind`, which could be the source of the issue.""}, {""file"": ""sympy/core/function.py"", ""justification"": ""The `_eval_derivative(self, v)` method might influence the evaluation of Derivative operations and their resulting kinds. This file's logic may clarify how derivatives are managed within the codebase.""}, {""file"": ""sympy/integrals/integrals.py"", ""justification"": ""Involves integral evaluations that may influence or relate to derivative behavior concerning the `kind`, making it potentially relevant.""}, {""file"": ""sympy/integrals/manualintegrate.py"", ""justification"": ""Could contain functionalities or rules that overlap with how derivatives might be managed, particularly in a manual evaluation context that might stem into issues with kind evaluation.""}, {""file"": ""sympy/integrals/tests/test_integrals.py"", ""justification"": ""Includes various integration tests that could reveal discrepancies when working with derivatives if the integration and differentiation mechanisms are impacted by related logic.""}, {""file"": ""sympy/integrals/rde.py"", ""justification"": ""Might provide relevant classes or methods related to differential equations that could also hold elements affecting the Derivative's kind.""}, {""file"": ""examples/beginner/differentiation.py"", ""justification"": ""Could have practical examples or scenarios of differentiation that may reference `kind` in relation to user-generated content that could align with the bug context.""}]}",['sympy/core/function.py']
sympy__sympy-21055,"The bug report indicates that the `refine()` function in SymPy is not simplifying complex arguments properly when provided with assumptions, specifically for real numbers. Keywords from the report include 'refine', 'simplify', 'complex arguments', and various mathematical constructs like 'Integral', which suggests that the issue may lie within mathematical expressions utilizing `refine()` in the context of real number assumptions. The issue may affect several components within the `sympy` library, particularly those dealing with simplification and assumptions on mathematical operations.","{""ranked_list"": [{""file"": ""sympy/assumptions/refine.py"", ""justification"": ""Contains the main implementation of `refine()`, which is central to simplifying expressions with assumptions. The method body reveals potential weaknesses in handling certain expressions logically related to the bug report.""}, {""file"": ""sympy/simplify/simplify.py"", ""justification"": ""Includes the implementation of `simplify()`, which is referenced in the bug report as a parallel functionality to refine. The method body discusses simplification heuristics and might interact with the functioning of `refine()`.""}, {""file"": ""sympy/core/basic.py"", ""justification"": ""Defines how the core symbols and basic operations interact with methods like `refine()`. The method `refine(self, assumption=True)` suggests that this file plays a role in the behavior of the core functionality when assumptions are applied.""}, {""file"": ""sympy/matrices/common.py"", ""justification"": ""Implements `refine()` specifically for matrices. Although its context is limited to matrix operations, it may still contribute to understanding how `refine()` acts on different types of mathematical objects.""}, {""file"": ""sympy/polys/rootisolation.py"", ""justification"": ""Contains a related `refine` implementation that performs root refinement, which could highlight similar logic errors or assumptions not adequately handled in the primary `refine()`.""}, {""file"": ""sympy/assumptions/tests/test_refine.py"", ""justification"": ""Includes tests for the `refine()` functionality. Contains various unit tests which can help pinpoint functional discrepancies or edge cases that might elucidate the bug.""}, {""file"": ""sympy/simplify/tests/test_simplify.py"", ""justification"": ""Tests related to `simplify()` which operate in conjunction with `refine()`. Insights gathered here could provide validations or tests highlighting issues with assumptions in simplification.""}, {""file"": ""sympy/__init__.py"", ""justification"": ""Contains initial setup and may provide context on how assumptions are intended to operate throughout SymPy, potentially revealing initialization errors affecting the `refine()` function.""}, {""file"": ""sympy/core/function.py"", ""justification"": ""Defines function behaviors in SymPy, which can directly affect how expressions involving `refine()` are represented and manipulated within the code.""}, {""file"": ""sympy/simplify/hyperexpand.py"", ""justification"": ""Related to hypergeometric terms which might interact with the parameters being passed to `refine()`, especially in complex argument scenarios outlined in the bug report.""}]}",['sympy/assumptions/refine.py']
sympy__sympy-20639,"The bug report addresses an issue with inaccurate rendering of the mathematical expression `pi**(1/E)` in a pretty printing context. The keywords extracted from the report include 'inaccurate rendering', 'pi', 'E', 'pretty printing', and 'LaTeX'. It specifically mentions the printing.pretty module, linking it directly to rendering functionalities. The expression is shown to render incorrectly, appearing with non-standard notation, which suggests a potential bug in the formatting or calculation of this expression within the pretty printing functions.","{""ranked_list"": [{""file"": ""sympy/printing/pretty/pretty.py"", ""justification"": ""The pretty.py file handles pretty printing in SymPy, including functions related to formatting expressions such as pi and powers. The presence of methods like pretty_print and pretty suggests direct involvement with rendering expressions, making it highly relevant to the bug regarding 'pi**(1/E)'.""}, {""file"": ""sympy/printing/mathml.py"", ""justification"": ""This file is responsible for generating MathML outputs for expressions. Given that the bug report refers to a rendering issue, the methods related to printing in MathML may interact with the representation of expressions and could help identify where the rendering goes wrong.""}, {""file"": ""sympy/printing/latex.py"", ""justification"": ""The latex.py file converts expressions to LaTeX format. As the bug report mentions LaTeX rendering and shows discrepancies between results in different formats, this file's methods for converting expressions to LaTeX may provide insights into where the confusion arises.""}, {""file"": ""sympy/interactive/printing.py"", ""justification"": ""This file initializes printing settings and methods to control how expressions are displayed in an interactive environment. Given the context of the bug report, where an interactive display is likely involved, it could be relevant to how expressions like 'pi**(1/E)' are handled.""}, {""file"": ""sympy/physics/vector/printing.py"", ""justification"": ""Though primarily focused on vector printing, it may still share functions or formatting logic overlapping with general mathematical expressions and provide insights into how expressions get rendered incorrectly.""}, {""file"": ""sympy/functions/elementary/exponential.py"", ""justification"": ""This file may handle exponential functions directly (e.g., E), and thus might be worth examining to check if the rendering issue relates to how exponentials are processed in the pretty printing context.""}, {""file"": ""sympy/core/power.py"", ""justification"": ""As it relates to power operations including exponentiation, examining this file may help identify if there are any underlying issues in how the power of expressions is computed or formatted, particularly in the case of 'pi**(1/E)'.""}, {""file"": ""sympy/printing/pycode.py"", ""justification"": ""This module generates Python code representations of expressions. While not directly related to rendering issues, exploring this file could reveal code formatting issues that impact display during pretty printing.""}, {""file"": ""sympy/printing/str.py"", ""justification"": ""This file handles string representations of SymPy expressions. Investigating it might help see if the incorrect output of 'pi**(1/E)' is related to string formatting before it reaches the pretty printer.""}, {""file"": ""sympy/printing/codeprinter.py"", ""justification"": ""Being associated with generating code from expressions, it could contain aspects of rendering that might generate different outputs affecting the display of mathematical expressions.""}]}",['sympy/printing/pretty/pretty.py']
sympy__sympy-21612,"The bug report states that the parsing of nested fractions in LaTeX yields an incorrect mathematical expression due to missing brackets. The problematic LaTeX input is ""\frac{\frac{a^3+b}{c}}{\frac{1}{c^2}}"", which was parsed as `((a**3 + b) / c) / 1 / (c**2)`. The expected output should maintain the nested structure, resulting in `((a**3 + b) / c) / (1 / (c**2))`. This indicates a potential issue with how nested fractions are handled in the parsing logic.","{""ranked_list"": [{""file"": ""sympy/parsing/latex/__init__.py"", ""justification"": ""Contains the main `parse_latex` method which calls the actual parsing implementation. This is a critical integration point for converting LaTeX strings to SymPy expressions.""}, {""file"": ""sympy/parsing/latex/_parse_latex_antlr.py"", ""justification"": ""Defines the `parse_latex` function that handles the semantic parsing using ANTLR. This is highly relevant since the bug pertains to how nested fractions are interpreted.""}, {""file"": ""sympy/printing/latex.py"", ""justification"": ""The method `_print_frac(self, expr)` is responsible for how fractions are printed as LaTeX. While this file is focused on output rather than input parsing, it can still influence the correctness of rendered LaTeX.""}]}",['sympy/printing/str.py']
sympy__sympy-21847,"The bug report centers around the `itermonomials` function in the SymPy library, which reportedly produces incorrect results when the optional `min_degrees` argument is utilized. The expected behavior is that calling `itermonomials` with specified maximum and minimum degrees should return a complete set of monomials that fit within the specified degree constraints. The current implementation appears to incorrectly limit the output of monomials when both maximum and minimum degrees are equal. This inconsistency is highlighted by the provided example, which fails to include certain monomials that should be generated according to the logic described in the documentation. The affected components are related to polynomial generation and monomial evaluation, particularly within polynomial mathematics and combinatorial aspects in symbolic computation.","{""ranked_list"": [{""file"": ""sympy/polys/monomials.py"", ""justification"": ""This file contains the implementation of the `itermonomials` function itself, which is at the center of the bug report. Analysis of its code shows it handles both `max_degrees` and `min_degrees` and is responsible for generating the monomials, directly correlating to the reported issue.""}, {""file"": ""sympy/polys/orderings.py"", ""justification"": ""The `monomial_key` function within this file is mentioned in the context of sorting monomials, which is relevant to the functionality of `itermonomials`. Any issues in ordering could impact the set of monomials generated, thus making this a relevant file.""}, {""file"": ""sympy/polys/tests/test_polytools.py"", ""justification"": ""This file contains tests for polynomial tools, including monomial tests like `test_Poly_monoms()` which confirms the expected behaviors of polynomial representations. It\u2019s likely that any issues with monomial generation may already be covered or could leverage these test cases.""}, {""file"": ""sympy/polys/polytools.py"", ""justification"": ""The presence of polynomial helper functions might interact with `itermonomials`, especially in cases of polynomial arithmetic where generated monomials are used. This file should be checked for any integration points that may lead to the discrepancies noted.""}, {""file"": ""sympy/polys/tests/test_polyroots.py"", ""justification"": ""Testing for polynomial roots may involve monomial generation. Tests regarding roots may indirectly validate or invalidate assumptions made in monomial generation, especially around degrees.""}, {""file"": ""sympy/polys/multivariate_resultants.py"", ""justification"": ""Multivariate polynomials often depend on correct monomial generation for resultant calculations. Bugs in this core functionality may propagate to other areas like resultants and should thus be analyzed.""}, {""file"": ""sympy/polys/constructor.py"", ""justification"": ""This file\u2019s functionality might relate to how polynomials are constructed from monomials. Any incorrect assumptions in `itermonomials` could also affect constructors, leading to potential failures that could be revealed through testing.""}, {""file"": ""sympy/polys/tests/test_numberfields.py"", ""justification"": ""Tests here might interact with polynomial structures and monomial generation, checking if functions returning monomials fail under certain configurations, thus validating bugs in `itermonomials`.""}, {""file"": ""sympy/polys/rings.py"", ""justification"": ""Operations on rings may involve monomial constructions, especially in larger algebraic contexts, adding weight to checking this file to see effects on generated outputs.""}, {""file"": ""sympy/polys/tests/test_rings.py"", ""justification"": ""This file involves tests on ring operations that could touch upon monomial generation and thus could provide relevant checks validating `itermonomials` operations.""}]}",['sympy/polys/monomials.py']
sympy__sympy-21379,"The bug report indicates an unexpected `PolynomialError` occurring with the `subs()` method in Sympy when dealing with expressions that utilize hyperbolic sine and piecewise functions. The problem appears to stem from the conditions set on the piecewise function and how these interact when attempting to substitute values. The report notes that this error is specifically tied to the symbolic variables being defined as real, along with certain combinations of sympy functions like `cosh`, `tanh`, and `sinh`, as well as the order in which assumptions are applied. Therefore, files related to piecewise operations, substitutions, or hyperbolic functions are likely candidates to contain the issue. The findings from analyzing the reports can guide the investigation towards bug localization based on relevant method names and file structures.","{""ranked_list"": [{""file"": ""sympy/functions/elementary/piecewise.py"", ""justification"": ""Contains the `piecewise_fold()` method which handles piecewise expressions. It may relate closely to conditions being incorrectly evaluated across substitutions.'""}, {""file"": ""sympy/simplify/hyperexpand.py"", ""justification"": ""Includes the `hyperexpand()` method, capable of expanding hypergeometric functions related to hyperbolic functions. It may reveal issues with how hyperbolic functions interact with substitutions.""}, {""file"": ""sympy/polys/fields.py"", ""justification"": ""Manages polynomial operations including `subs()`. Relevant given the `PolynomialError` mentioned in the report.""}, {""file"": ""sympy/core/basic.py"", ""justification"": ""Contains general implementations of the `subs()` method, which are likely affecting all expressions within Sympy.""}, {""file"": ""sympy/core/expr.py"", ""justification"": ""Includes foundational methods for handling expressions, including substitutions which could lead to unintended behaviors.""}, {""file"": ""sympy/physics/vector/vector.py"", ""justification"": ""Manipulates vector substitutions, might experience similar bugs regarding types when substituting.""}, {""file"": ""sympy/physics/vector/dyadic.py"", ""justification"": ""Similar to vectors regarding substitution errors, particularly if payloads leverage piecewise or polynomial structures.""}, {""file"": ""sympy/solvers/diophantine/diophantine.py"", ""justification"": ""Handles algebraic structures and relations potentially similar to complicated substitutions that might result in errors.""}, {""file"": ""sympy/strategies/rl.py"", ""justification"": ""Includes substitution algorithms which may have interactions with the error thrown by the context of the bug report.""}, {""file"": ""sympy/functions/elementary/exponential.py"", ""justification"": ""Contains explicit handling of `exp`, relating to the expressions which might be involved in generating the `PolynomialError`.""}]}",['sympy/core/mod.py']
sympy__sympy-22005,"The bug report describes an issue related to handling polynomial systems in the `solve_poly_system` function. The specific exception raised (`NotImplementedError`) indicates that the function does not support certain cases of its inputs, specifically when it is expected to handle more complex systems than just zero-dimensional ones (system with a finite number of solutions). The excerpt shows that calling `solve_poly_system((y - 1,), x, y)` should return a specific solution but is currently mishandled, returning a NotImplementedError instead. This suggests that the issue is likely related to the handling of univariate and multivariate polynomial equations, possibly the conditions under which the function raises not implemented errors.","{""ranked_list"": [{""file"": ""sympy/solvers/polysys.py"", ""justification"": ""Contains the definitions of the `solve_poly_system`, `solve_generic`, and `solve_biquadratic` methods, directly related to the bug described. The changes in the diffs also point to conditional logic that affects how the system's solutions are determined.""}, {""file"": ""sympy/solvers/tests/test_solveset.py"", ""justification"": ""Though the file is not directly referenced in the report, testing files may provide additional insights or test cases related to `solve_poly_system` that could help in localizing issues.""}, {""file"": ""sympy/solvers/tests/test_solvers.py"", ""justification"": ""Similar to the above, it likely contains additional tests for solving capabilities in the `solvers` module, which may offer insights into edge cases or failures related to polynomial solving.""}, {""file"": ""sympy/solvers/tests/test_inequalities.py"", ""justification"": ""While primarily testing inequalities, insights from edge cases in this context may also be relevant.""}, {""file"": ""sympy/polys/tests/test_polyroots.py"", ""justification"": ""This tests polynomial behavior, which could relate to root-solving strategies employed in `solve_poly_system` and help explore potential input scenarios contributing to the bug.""}, {""file"": ""sympy/solvers/ode/tests/test_systems.py"", ""justification"": ""The routines dealing with systems of equations in an ODE context might offer insights into similar problem-solving scenarios as those presented in the polynomial bug report.""}, {""file"": ""sympy/polys/solvers.py"", ""justification"": ""Contains polynomial solving techniques associated with the polynomial behavior. Understanding here could aid in resolving complexities in polynomial solution detection.""}]}",['sympy/solvers/polysys.py']
sympy__sympy-22714,"The bug report indicates that using `with evaluate(False)` causes a crash when trying to create an instance of `Point2D`. The error message suggests that the issue arises from trying to handle imaginary coordinates, which are not allowed. The relevant line in the code shows how `evaluate` is used to control whether expressions are simplified or evaluated, indicating that `evaluate(False)` should prevent evaluation and lead to the expression being treated as-is, possibly causing a logic flow that leads to invalid arguments (imaginary coordinates). The keywords to focus on include 'evaluate', 'Point2D', and terms related to handling expressions in SymPy, particularly functions that manage evaluation or type conversion.","{""ranked_list"": [{""file"": ""sympy/core/sympify.py"", ""justification"": ""The `sympify` function is critical as it converts expressions into SymPy types and has a parameter for evaluation. This directly relates to how `with evaluate(False)` manages expressions.""}, {""file"": ""sympy/parsing/sympy_parser.py"", ""justification"": ""The `eval_expr` method evaluates generated Python code and could be involved when `evaluate(False)` is used as it pertains to executing parsed expressions.""}, {""file"": ""sympy/geometry/point.py"", ""justification"": ""Contains the constructor for `Point2D`. It explicitly checks for imaginary coordinates, which relate directly to the reported bug.""}, {""file"": ""sympy/core/parameters.py"", ""justification"": ""The `evaluate` method controls automatic expression evaluation in SymPy. Understanding its implementation is essential to localizing the bug.""}, {""file"": ""sympy/core/function.py"", ""justification"": ""This contains how functions are called in SymPy, which may be relevant when evaluating expressions under different evaluation contexts.""}, {""file"": ""sympy/core/evalf.py"", ""justification"": ""The `evalf` method evaluates expressions to a specified decimal accuracy, which is another level of evaluation that could relate to how points are handled.""}, {""file"": ""sympy/core/relational.py"", ""justification"": ""The relational constructs manage comparisons in SymPy. If the bug leads to invalid deep evaluations leading to exceptions, this might be of interest.""}, {""file"": ""sympy/simplify/simplify.py"", ""justification"": ""While not directly referenced in the bug, simplification processes may inherently deal with geometric objects and their evaluations.""}, {""file"": ""sympy/core/basic.py"", ""justification"": ""`Basic` is a fundamental class for many objects in SymPy. Issues can arise if subclasses, like `Point2D`, do not properly handle basic expectations.""}, {""file"": ""sympy/concrete/expr_with_limits.py"", ""justification"": ""This could be relevant if limits are evaluated incorrectly in tandem with the use of `evaluate(False)`, particularly in complex expressions.""}]}",['sympy/geometry/point.py']
