bug_id,bug_report_analysis,suspicious_files,fixed_files
3418,"The bug report highlights an issue with the deserialization of an empty `List<String>` when the `ACCEPT_SINGLE_VALUE_AS_ARRAY` feature is enabled. Specifically, the report mentions that during deserialization, the empty list ends up being interpreted as a list containing a single empty string (`List.of("""")`). This indicates a potential problem in the handling logic of empty values within the deserialization process, specifically in classes that manage collections, such as `StringCollectionDeserializer`. The report suggests that the `isExpectedStartArrayToken` method in `FromXmlParser` may not handle this scenario correctly, leading to incorrect coercion outcomes during deserialization. The report proposes two possible fixes—either modifying the logical checks in `FromXmlParser` or adjusting the order of operations in `StringCollectionDeserializer`. Key components referenced include deserializers, collection handling, and specific methods focusing on handling single-value cases without correctly interpreting empty values.","{""ranked_list"": [{""file"": ""src/main/java/com/fasterxml/jackson/databind/deser/std/StringCollectionDeserializer.java"", ""justification"": ""This file contains the `StringCollectionDeserializer` class, which directly manages the deserialization of string collections. The method `handleNonArray` is particularly relevant, as it checks for the `ACCEPT_SINGLE_VALUE_AS_ARRAY` feature, indicating this class's involvement in how empty strings and empty lists are deserialized.""}, {""file"": ""src/main/java/com/fasterxml/jackson/databind/deser/std/CollectionDeserializer.java"", ""justification"": ""The `CollectionDeserializer` class provides a more general functionality for handling collections during deserialization. Its method `handleNonArray` also implements similar logic to `StringCollectionDeserializer`, making it a critical candidate as the underlying framework for deserializing strings within collections.""}, {""file"": ""src/main/java/com/fasterxml/jackson/databind/deser/std/StringArrayDeserializer.java"", ""justification"": ""This file's `StringArrayDeserializer` class manages the deserialization of arrays of strings, which is relevant because the bug report's test includes deserializing an empty XML tag as a string in an array. The `handleNonArray` method here checks for the `ACCEPT_SINGLE_VALUE_AS_ARRAY` feature, linking it closely to the reported issue.""}, {""file"": ""src/main/java/com/fasterxml/jackson/databind/deser/std/PrimitiveArrayDeserializers.java"", ""justification"": ""This class handles primitive array deserializer cases, and its `handleNonArray` method reflects logic for how non-array inputs should be processed. It includes checks for empty strings, which is part of the issue raised in the bug report.""}, {""file"": ""src/main/java/com/fasterxml/jackson/databind/deser/std/ObjectArrayDeserializer.java"", ""justification"": ""The interaction of object arrays with the deserialization feature is significant. This class has a `handleNonArray` method that might be invoked during the process when a string is treated as an object representation; thus, it broadens context for handling non-array inputs.""}]}","src/main/java/com/fasterxml/jackson/databind/deser/std/CollectionDeserializer.java,src/main/java/com/fasterxml/jackson/databind/deser/std/StringCollectionDeserializer.java"
4467,"The bug report highlights an issue with the `isEmpty()` method of serializers not being called when the `Include.NON_DEFAULT` setting is applied using Jackson's ObjectMapper. This indicates a specific interaction between the object's property inclusion settings during serialization and custom serializer implementations. The keywords derived include: `Include.NON_DEFAULT`, `isEmpty()`, `serializer`, `serialization`, and relevant Java class files in the Jackson library that may handle serialization processes. There is an implication that custom serializers should have their `isEmpty()` methods invoked to prevent serialization of default or empty values when globally configured. The potentially affected components involve the serialization framework, specifically those handling value inclusion and empty checks.","{""ranked_list"": [{""file"": ""src/main/java/com/fasterxml/jackson/databind/ser/std/MapSerializer.java"", ""justification"": ""The `MapSerializer` class contains the `isEmpty(SerializerProvider prov, Map<?,?> value)` method that checks conditions around empty maps, which aligns closely with how serialization is likely being affected by `Include.NON_DEFAULT`. The logic within further inspects values, supporting custom empty checks.""}, {""file"": ""src/main/java/com/fasterxml/jackson/databind/JsonSerializer.java"", ""justification"": ""This file includes the `isEmpty(T value)` method, which is abstract and is expected to be overridden by serializers. Its relevance lies in managing object serialization, specifically the default behavior that may influence how properties are included in the serialized output.""}, {""file"": ""src/main/java/com/fasterxml/jackson/databind/ser/std/SerializableSerializer.java"", ""justification"": ""Contains the `isEmpty(SerializerProvider serializers, JsonSerializable value)` method that could interact with the custom serializer mentioned in the bug report, particularly if the custom serializer is cast to `JsonSerializable`.""}, {""file"": ""src/main/java/com/fasterxml/jackson/databind/ser/std/BeanSerializerBase.java"", ""justification"": ""Provides abstract serialization handling, and implementations of the `serialize(Object bean, JsonGenerator gen, SerializerProvider provider)` method could depend on checks done for empty or default objects, potentially in conflict with `Include.NON_DEFAULT` settings.""}, {""file"": ""src/main/java/com/fasterxml/jackson/databind/ser/BasicSerializerFactory.java"", ""justification"": ""Responsible for creating serializers and could be part of the flow where the `isEmpty` implementation is organized or invoked based on inclusion settings.""}, {""file"": ""src/main/java/com/fasterxml/jackson/databind/ser/PropertyBuilder.java"", ""justification"": ""Although not directly related to `isEmpty`, the file\u2019s role in building properties and configurations for serializers hints it may hold relevance in how properties are initialized and serialized with respect to emptiness and defaults.""}, {""file"": ""src/main/java/com/fasterxml/jackson/databind/ser/DefaultSerializerProvider.java"", ""justification"": ""Essential for managing serializer instances, which may involve applying the rules set by `Include.NON_DEFAULT` and how this interacts with various serializers' `isEmpty` checks.""}, {""file"": ""src/main/java/com/fasterxml/jackson/databind/JsonSerializer.java"", ""justification"": ""Aside from including `isEmpty`, this file is foundational for serializer behaviors, impacting how objects are serialized with respect to the inclusion criteria.""}, {""file"": ""src/main/java/com/fasterxml/jackson/databind/ser/BeanSerializerFactory.java"", ""justification"": ""It manages the creation of bean serializers which might include checks related to `isEmpty` based on the context of the settings.""}, {""file"": ""src/main/java/com/fasterxml/jackson/databind/ser/std/ReferenceTypeSerializer.java"", ""justification"": ""Handles serialization of reference types; potential issues could arise if empty references aren't properly accounted for, affecting serialization behavior set by the `ObjectMapper`.""}]}",src/main/java/com/fasterxml/jackson/databind/ser/PropertyBuilder.java
3868,"The bug report highlights discrepancy in how the `ObjectId-property` is handled with two different deserialization approaches in Jackson: 1) Setter-based deserialization, which fails silently when the `id-property` is missing; and 2) Instantiator-based deserialization, which throws a `MismatchedInputException` when it cannot find the `id-property`. This suggests the issue resides likely in how properties are resolved during deserialization. Keywords for this report include `JsonIdentityInfo`, `ObjectId`, `deserialization`, `SetterBased`, `CreatorBased`, `MismatchedInputException`, and `id`, which will guide our search for relevant files. The components affected appear to include the deserialization logic, particularly related to object identifiers and creators.","{""ranked_list"": [{""file"": ""src/test/java/com/fasterxml/jackson/databind/objectid/TestObjectIdDeserialization.java"", ""justification"": ""Contains direct tests for object ID deserialization, including handling of null values and mismatched scenarios as described in the bug report.""}, {""file"": ""src/main/java/com/fasterxml/jackson/databind/deser/BeanDeserializerBase.java"", ""justification"": ""This file is core to the deserialization process and may contain relevant methods to identify and report mismatched input scenarios that could contribute to the issue.""}, {""file"": ""src/main/java/com/fasterxml/jackson/databind/deser/impl/ObjectIdReferenceProperty.java"", ""justification"": ""Handles object identifiers during deserialization which is directly related to how the mentioned `ObjectId-property` is resolved and may contain the logic leading to the difference in behavior.""}, {""file"": ""src/test/java/com/fasterxml/jackson/databind/deser/creators/CreatorWithObjectIdTest.java"", ""justification"": ""Tests the behavior of object identifiers when using creators to instantiate objects, which is within the context of the bug report.""}, {""file"": ""src/main/java/com/fasterxml/jackson/databind/DeserializationContext.java"", ""justification"": ""Controls the deserialization context and includes methods that could affect handling of object IDs during deserialization.""}, {""file"": ""src/test/java/com/fasterxml/jackson/databind/objectid/ObjectIdWithCreator1261Test.java"", ""justification"": ""Contains tests for ID handling in creator-based constructions, relevant as it could reveal differences in behavior related to the issue.""}, {""file"": ""src/main/java/com/fasterxml/jackson/databind/deser/CreatorProperty.java"", ""justification"": ""This file defines properties as they are constructed and may contain logic relevant to the application of defaulting or missing values through creators.""}, {""file"": ""src/test/java/com/fasterxml/jackson/databind/objectid/TestObjectId.java"", ""justification"": ""Contains various tests related to `ObjectId`s which could reveal inconsistencies with the outlined behavior of ID handling.""}, {""file"": ""src/main/java/com/fasterxml/jackson/databind/deser/DeserializationProblemHandler.java"", ""justification"": ""It addresses deserialization problems and could be involved in the reporting of missing properties, which aligns with the MismatchedInputException observed.""}, {""file"": ""src/main/java/com/fasterxml/jackson/databind/deser/impl/PropertyBasedObjectIdGenerator.java"", ""justification"": ""Handles the generation of Object IDs based on properties, and its logic could be key to understanding different deserialization outcomes.""}]}",src/main/java/com/fasterxml/jackson/databind/deser/BeanDeserializer.java
4050,"The bug report states that after upgrading the `jackson-databind` version, the `ObjectMapper.valueToTree()` method does not respect the `SerializationFeature.WRAP_ROOT_VALUE` setting. The presence of the `@JsonRootName` annotation on the `Event` class implies that root wrapping is expected. The report compares results between the prior and current versions, indicating that the failure to wrap the root value in the new version may be related to a change in `ObjectMapper.valueToTree()` which explicitly disables wrapping. The output indicates a potential inconsistency in root value serialization between `valueToTree()` and `writeValueAsString()`, suggesting immediate areas for investigation: the `ObjectMapper` class, methods related to serialization features, and the effects of the `SerializationConfig` settings. Additionally, the specific configuration and usage of the `ObjectMapper` in user code should also be considered.","{""ranked_list"": [{""file"": ""src/main/java/com/fasterxml/jackson/databind/ObjectMapper.java"", ""justification"": ""The `valueToTree(Object fromValue)` method in `ObjectMapper` directly controls the behavior indicated in the bug. It disables `SerializationFeature.WRAP_ROOT_VALUE`, leading to the incorrect behavior reported.""}, {""file"": ""src/main/java/com/fasterxml/jackson/databind/SerializationConfig.java"", ""justification"": ""Contains methods that manage serialization settings. The `useRootWrapping()` method retrieves the setting for root wrapping, which is fundamental to the bug.""}, {""file"": ""src/main/java/com/fasterxml/jackson/databind/ObjectWriter.java"", ""justification"": ""The `isEnabled(SerializationFeature f)` method calls `isEnabled` in `SerializationConfig`, affecting serialization output consistency, including wrapping.""}, {""file"": ""src/test/java/com/fasterxml/jackson/databind/ser/TestRootType.java"", ""justification"": ""Includes test cases that check for correct handling of root wrapping, which is central to this bug report.""}, {""file"": ""src/test/java/com/fasterxml/jackson/databind/ser/TestTypedRootValueSerialization.java"", ""justification"": ""Tests related to serialization with explicitly typed constraints, useful for verifying behavior aligned with root wrapping.""}, {""file"": ""src/test/java/com/fasterxml/jackson/databind/ser/TestTreeSerialization.java"", ""justification"": ""Tests tree serialization functionality that might indirectly involve or expose issues with how data is marshaled, including root wrapping.""}, {""file"": ""src/test/java/com/fasterxml/jackson/databind/ObjectMapperTest.java"", ""justification"": ""General tests for `ObjectMapper` that may cover edge cases, including those linked to `valueToTree()` behavior.""}, {""file"": ""src/main/java/com/fasterxml/jackson/databind/ser/DefaultSerializerProvider.java"", ""justification"": ""Handles the serialization process; issues here could propagate to direct impacts on how values are wrapped or not.""}, {""file"": ""src/test/java/com/fasterxml/jackson/databind/ser/JsonValueSerializationTest.java"", ""justification"": ""Potentially related to test cases that inspect various JSON serialization aspects which may touch upon root wrapping.""}]}",src/main/java/com/fasterxml/jackson/databind/ObjectMapper.java
4320,"The bug report focuses on incorrect handling of `null` values during the deserialization process in the context of the Jackson library, particularly when using `@JsonSetter(nulls=Nulls.SKIP)` alongside the `READ_UNKNOWN_ENUM_VALUES_AS_NULL` and `FAIL_ON_INVALID_SUBTYPE` features. The expected behavior is that null values should be skipped during deserialization, especially in collections, yet the report indicates a failure to do so when unknown enums or subtypes are encountered. The descriptions and provided code snippets hint at various test cases related to enum handling and null conversions, which are critical in effectively tracing this bug.","{""ranked_list"": [{""file"": ""src/test/java/com/fasterxml/jackson/failing/NullsSkip4309Test.java"", ""justification"": ""This file contains tests directly related to the skipping of null values in enum deserialization methods. Both methods `shouldSkipUnknownEnumDeserializationWithSetter()` and `shouldSkipUnknownSubTypeDeserializationWithSetter()` are directly relevant to the bug report's claims, clearly addressing the core problem of unwanted null values being included when using certain deserialization settings.""}, {""file"": ""src/test/java/com/fasterxml/jackson/databind/deser/enums/EnumDeserializationTest.java"", ""justification"": ""The test `testAllowUnknownEnumValuesReadAsNull()` tests the `READ_UNKNOWN_ENUM_VALUES_AS_NULL` feature, confirming if null values are produced as a result of using unknown enum types. This relates directly to the bug report's assertion about the incorrect handling of unknown enum values.""}, {""file"": ""src/test/java/com/fasterxml/jackson/databind/deser/NullHandlingTest.java"", ""justification"": ""Contains the test methods `testAnySetterNulls()` and `testListOfNulls()` which relate to handling nulls in deserialization. They provide a broader context of how null values are treated within different scenarios, which can inform understanding how enum nulls could be mishandled.""}, {""file"": ""src/test/java/com/fasterxml/jackson/databind/deser/filter/NullConversionsSkipTest.java"", ""justification"": ""The method `testEnumAsNullThenSkip()` examines the behavior related to null values in enums, confirming if they should be skipped. This directly tests the expected behavior of skipping nulls which is central to the bug report.""}, {""file"": ""src/test/java/com/fasterxml/jackson/databind/deser/filter/NullConversionsForContentTest.java"", ""justification"": ""The `testNullsSkipWithCollections()` method tests the skipping of nulls in collection deserialization, reflecting part of the issue highlighted in the bug report. Additionally, methods like `testNullsSkipWithMaps()` deal with similar functionality.""}, {""file"": ""src/test/java/com/fasterxml/jackson/databind/deser/filter/NullConversionsForEnumsTest.java"", ""justification"": ""The tests `testEnumSetSkipNulls()` and `testEnumMapNullsAsEmpty()` confirm handling of nulls within enum collections and maps. These tests are essential for understanding the expected behavior in relation to null values as described in the bug report.""}, {""file"": ""src/test/java/com/fasterxml/jackson/databind/deser/merge/MergeWithNullTest.java"", ""justification"": ""Test methods here indirectly touch on the interactions of null handling during deserialization processes, which may inform further insights on the reported bug.""}, {""file"": ""src/test/java/com/fasterxml/jackson/databind/deser/jdk/JDKScalarsDeserTest.java"", ""justification"": ""While not directly addressing enums, this file's tests on handling various data types and conversions during deserialization might provide useful context regarding how other types interact with the null handling system.""}, {""file"": ""src/test/java/com/fasterxml/jackson/databind/deser/enums/EnumMapDeserializationTest.java"", ""justification"": ""This file may not be the primary focus but does contain testing related to enums within maps, which might align with the reported issues of incorrect enum handling.""}]}",src/main/java/com/fasterxml/jackson/databind/deser/std/CollectionDeserializer.java
4684,"The bug report indicates an issue where a custom key deserializer for `Object.class` in a nested map structure is ignored due to untyped deserialization caused by the nature of JSON data being arbitrary. The system fails to utilize the registered custom key deserializer when the map key type isn't explicitly defined. Relevant keywords include: `custom key deserializer`, `ignore`, `Map`, `untitled deserialization`, and `ObjectMapper`. The affected components likely involve classes responsible for JSON deserialization such as `ObjectMapper`, `MapDeserializer`, and `KeyDeserializer`. The provided code sample includes a test case that verifies if the custom key deserializer is used during deserialization.  This suggests that the test cases are essential to analyze for confirming the expected behavior of deserialization with a custom key deserializer in nested map scenarios.","{""ranked_list"": [{""file"": ""src/main/java/com/fasterxml/jackson/databind/deser/std/MapDeserializer.java"", ""justification"": ""This file contains the MapDeserializer class which manages the deserialization of maps in Jackson. The issue described in the bug report pertains directly to how maps are handled and deserialized, particularly with regards to custom key deserializers, making this file highly relevant.""}, {""file"": ""src/main/java/com/fasterxml/jackson/databind/deser/std/UntypedObjectDeserializer.java"", ""justification"": ""This file implements untyped object deserialization, which is at the core of the issue reported. Since the bug revolves around handling untyped deserialization in nested maps, the logic present in this file will directly influence the functionality being tested.""}, {""file"": ""src/main/java/com/fasterxml/jackson/databind/KeyDeserializer.java"", ""justification"": ""KeyDeserializer is crucial for implementing custom key deserialization logic. The report's issue suggests that the custom key deserializer is ignored, which indicates a potential fault in how key deserializers are invoked in relation to nested maps.""}, {""file"": ""src/main/java/com/fasterxml/jackson/databind/ObjectMapper.java"", ""justification"": ""ObjectMapper is central to the deserialization process in Jackson and could directly impact how custom key deserialization is registered and utilized. Understanding its configuration methods, particularly around module registration, is critical for resolving the bug.""}, {""file"": ""src/main/java/com/fasterxml/jackson/databind/module/SimpleModule.java"", ""justification"": ""This file manages the registration of custom serializers and deserializers, including key serializers. Since the bug involves a custom key deserializer not being applied, examining this file will provide insights into how deserializers are registered and might point out issues in the registration process.""}, {""file"": ""src/test/java/com/fasterxml/jackson/databind/module/TestKeyDeserializers.java"", ""justification"": ""This test file contains unit tests specifically designed to check the behavior of custom key deserializers, which is crucial for validating the bug in question and understanding if the expected behavior is being met.""}, {""file"": ""src/test/java/com/fasterxml/jackson/databind/deser/jdk/MapKeyDeserializationTest.java"", ""justification"": ""This file includes tests related to the deserialization of map keys, particularly in varying scenarios. Given that the bug report highlights issues with custom key deserializers in nested maps, the tests here may pinpoint where things are going wrong.""}, {""file"": ""src/test/java/com/fasterxml/jackson/databind/deser/jdk/CustomMapKeys2454Test.java"", ""justification"": ""This test file focuses on testing custom key types in maps and can provide valuable context on how the deserialization is expected to function. Analysis of the tests within this file may reveal discrepancies related to the bug.""}, {""file"": ""src/test/java/com/fasterxml/jackson/databind/deser/jdk/MapDeserializerCachingTest.java"", ""justification"": ""Caching strategies for deserializers can impact performance and behavior. Understanding how caching is handled for map deserialization may provide insights into the bug, particularly if the issue might relate to cached deserializers failing to invoke the custom logic.""}, {""file"": ""src/test/java/com/fasterxml/jackson/databind/deser/jdk/MapDeserializationTest.java"", ""justification"": ""This test file generally encompasses a wide range of tests for deserializing maps and will likely contain tests that are similar to the scenario provided in the bug report, providing additional insight into the expected behavior.""}]}",src/main/java/com/fasterxml/jackson/databind/deser/std/UntypedObjectDeserializer.java
